2017|Biodiversity, Health Implications of Bernstein, Aaron
1995|BIODIVERSITY AND HUMAN HEALTH ROWE, PM
1998|Biodiversity and human health. Guillette, EA
1995|Biodiversity and human health Johnson, K
2017|Urban biodiversity affects children's respiratory health Lucey, Morgan
2009|Biodiversity is good for your health Pelley, Janet
1995|BIODIVERSITY SEEN AS WELLSPRING FOR HUMAN HEALTH [Anonymous]
2017|Offline: Planetary health's next frontier-biodiversity Horton, Richard
1998|Biodiversity and human health. Grifo, Francesca T.
2009|Sustaining Life How Human Health Depends on Biodiversity Mindell, David P.
2008|Sustaining life: How human health depends on biodiversity Weintraub, Irwin
2001|Biodiversity in agroecosystems and bioindicators of environmental health Paoletti, MG
2015|Commentary on Matthew Butkus' ,Biodiversity, Ethics, and Human Health' Kretz, Lisa
2010|LiDAR Use Expands into Monitoring Biodiversity, Ecosystem Health [Anonymous]
2005|The potential health benefits of protecting marine biodiversity. Wilson, Nick; Wallace, Cath; Weeber, Barry
2013|Diversifying Food and Diets: Using Agricultural Biodiversity to Improve Nutrition and Health 
2015|ECOLOGY Is biodiversity good for your health? Keesing, Felicia; Ostfeld, Richard S.
2013|Conservation social work. The interconnectedness of biodiversity health and human resilience. Tedeschi, Philip; Bexell, Sarah M.; NeSmith, Jolie
1999|Health ecology and the biodiversity of natural medicine - Perspectives from traditional complementary health systems Bodeker, G
1995|SCIENTISTS STRESS BIODIVERSITY - HUMAN HEALTH LINKS MARWICK, C
1998|Biodiversity loss: a human health issue Cassis, G
1997|Biodiversity and its relationship to ecosystem health and integrity (Reprinted from Policy Options, November 1996) Kimmins, JP
1999|Biodiversity: Our greatest natural resource Bailey, BJ
1992|Butterflies as ecological and biodiversity indicators. Kremen, C.
1995|Traditional health systems: policy, biodiversity, and global interdependence. Bodeker, G
2003|Landscape bid diversity and biological health risk assessment: The map of Italian nature Zurlini, G; Rossi, O; Amadio, V
2014|Measures of the Health of Rivers and Streams Martin, James Lenial
2015|Plant microbiota: implications for human health von Hertzen, Leena
2012|Accounting for Nature's Benefits The Dollar Value of Ecosystem Services Holzman, David C.
2013|Diversifying Food and Diets Using agricultural biodiversity to improve nutrition and health Foreword de Souza Dias, Braulio Ferreira
2014|Lessons in Sustainable Development from Malaysia and Indonesia Hsu, S; Perry, N
2012|Biodiversity and global health-hubris, humility and the unknown Stephens, Carolyn
2013|Diversifying diets: using agricultural biodiversity to improve nutrition and health in Asia Nielsen, Jennifer; Haselow, Nancy; Osei, Akoto; Talukder, Zaman
2009|Recent progress in the conservation of groundwaters and their dependent ecosystems Boulton, Andrew J.
2013|Diversifying Food and Diets Using agricultural biodiversity to improve nutrition and health Preface Frison, Emile; Burlingame, Barbara
2003|Ecologically based pest management: A key pathway to achieving agroecosystem health Altieri, MA; Nicholls, CI
2000|Emerging infectious diseases of wildlife - Threats to biodiversity and human health (vol 287, pg 443, 2000) Daszak, P
2006|Pure enhancement. Silvers, Anita
2015|Nature's bounties: reliance on pollinators for health Daily, Gretchen C.; Karp, Daniel S.
2004|Embedded in nature: Human health and biodiversity Chivian, E; Bernstein, AS
2010|National Conference on Impact of Climate Change on Biodiversity of Insects and Environment (CBI' 2010). Murugan, K
2015|Trans* health: "diversity, not pathology" Morgan, Jules
2009|Land Health and Mental Health: A New Field for Research Nurturing Biodiversity and Well-Being on Farms Giblett, Rod
2011|Why should biomedical scientists care about biodiversity? Kelsh, Robert N.; Szekely, Tamas; Stuart, Simon
2017|Biodiversity, drug discovery, and the future of global health: Introducing the biodiversity to biomedicine consortium, a call to action Neergheen-Bhujun, Vidushi; Awan, Almas Taj; Baran, Yusuf; Bunnefeld, Nils; Chan, Kit; Edison Dela Cruz, Thomas; Egamberdieva, Dilfuza; Elsasser, Simon; Johnson, Mari-Vaughn V.; Komai, Shoji; Konevega, Andrey L.; Malone, John H.; Mason, Paul; Nguon, Rothsophal; Piper, Ross; Shrestha, Uttam Babu; Pesic, Milica; Kagansky, Alexander
2008|The Importance of Biodiversity to Medicine Bernstein, Aaron S.; Ludwig, David S.
2011|Strengthening International Cooperation for Health and Biodiversity Campbell, Kathryn; Cooper, David; Dias, Braulio; Prieur-Richard, Anne-Helene; Campbell-Lendrum, Diarmid; Karesh, William B.; Daszak, Peter
2017|Special Issue : Conservation, biodiversity and infectious disease: scientific evidence and policy implications. 
2007|Public health ethics in times of global environmental change: time to look beyond human interests Mackenbach, Johan P.
2011|Southeast Asia: an emerging focus for global health Acuin, Jose; Firestone, Rebecca; Htay, Thein Thein; Khor, Geok Lin; Thabrany, Hasbullah; Saphonn, Vonthanak; Wibulpolprasert, Suwit
2013|Overview of agricultural biodiversity and its contribution to nutrition and health Heywood, Vernon H.
2007|Biodiversity, traditional medicine and public health: where do they meet? Alves, Romulo R. N.; Rosa, Ierece M. L.
2009|Envisioning a healthy and sustainable future: essential to closing the gap in a generation. Baum, Fran
1998|Conservation medicine: an emerging approach to protection of biodiversity. Rolland, Rosalind M.; Kaufman, Gretchen; Pokras, Mark; Tabor, Gary
2016|Water Use Analysis Verones, Francesca; Pfister, Stephan; Berger, Markus
1996|Medicinal resources of the tropical forest: Biodiversity and its importance to human health - Balick,MJ, Elisabetsky,E, Laird,SA Pimentel, D
2000|Special issue - Soil health: Managing the biotic component of soil quality - Guest editor: M.R. Zeiss - Introduction Zeiss, MR
2013|Diversifying Food and Diets Using agricultural biodiversity to improve nutrition and health Foreword De Schutter, Olivier
2012|MICROBIOLOGY Learning about who we are Relman, David A.
2011|Coffee Culture: Local Experiences, Global Connections Tucker, CM
2012|Diversity v. globalization: traditional foods at the epicentre Trichopoulou, Antonia
2015|OCEAN HEALTH Micheli, Fiorenza; De Leo, Giulio; Ferretti, Francesco; Hines, A. Margaret; Honey, Kristen; Kroeker, Kristy; Martone, Rebecca G.; McCauley, Douglas J.; O'Leary, Jennifer K.; Rosim, Daniele F.; Sokolow, Susanne H.; Stock, Andy; Wood, Chelsea L.
2014|POPULATION HEALTH Immaturity in the gut microbial community Costello, Elizabeth K.; Relman, David A.
2014|The unknown underworld: Understanding soil health in South Africa Louw, Schalk v. d. M.; Wilson, John R. U.; Janion, Charlene; Veldtman, Ruan; Davies, Sarah J.; Addison, Matthew
2008|Editors' Overview: The Emergence of Ecological Ethics Minteer, Ben A.; Collins, James P.; Bird, Stephanie J.
1996|Medical resources of the tropical forest: Biodiversity and its importance to human health - Balick,MJ, Elisabetsky,E, Laird,SA [Anonymous]
2012|Disease invasion: impacts on biodiversity and human health. Cunningham, Andrew A.; Dobson, Andrew P.; Hudson, Peter J.
2002|Plankton stowaways in the Black Sea - impacts on biodiversity and ecosystem health. Moncheva, S.P.; Kamburska, L.T.
2001|A new voice in conservation Norris, S
1996|The long-term biodiversity and ecosystems change on radioactively polluted areas Krivolutskii, DA
2016|Biodiversity central to food security DeClerck, Fabrice
2002|Biodiversity in biomedical research Rosenthal, JR; Preszler, T
2002|Proceedings of the NATO Advanced Research Workshop on effects of air pollution on forest health and biodiversity in forests of the Carpathian Mountains 22-26, 2002 Stara Lesna, Slovakia. Szaro, Robert C.; Bytnerowicz, Andrzej; Oszlanyi, Julius
2002|Conservation medicine: ecological health in practice. 
2012|Biodiversity and Mental Health Duarte Tagles, Hector; Idrovo, Alvaro J.
2009|The international cooperative biodiversity groups [Anonymous]
2005|Biodiversity of alkalithermophiles. Wiegel, J
2002|Biodiversity Price, ARG; Jones, DA; Krupp, F
2013|Biodiversity's contribution to dietary diversity Magnitude, meaning and measurement Berti, Peter R.; Jones, Andrew D.
2006|Biodiversity: Cashing in on the rich coast Dalton, R
2014|Biodiversity, cultural pathways, and human health: a framework Clark, Natalie E.; Lovell, Rebecca; Wheeler, Benedict W.; Higgins, Sahran L.; Depledge, Michael H.; Norris, Ken
2012|Mainstreaming One Health Zinsstag, Jakob; Mackenzie, John S.; Jeggo, Martyn; Heymann, David L.; Patz, Jonathan A.; Daszak, Peter
2009|Small but tenacious: South Africa's health biotech sector Al-Bader, Sara; Frew, Sarah E.; Essajee, Insiya; Liu, Victor Y.; Daar, Abdallah S.; Singer, Peter A.
2014|From Manaus to Maputo: Toward a Public Health and Biodiversity Framework Forum Romanelli, Cristina; Corvalan, Carlos; Cooper, H. David; Manga, Lucien; Maiero, Marina; Campbell-Lendrum, Diarmid
2006|Genomics and biodiversity in yeasts Bolotin-Fukuhara, M
2016|Biodiversity undertakings call for extensive discussion on species concept and the criteria for species delimitation Kong, Hongzhi
2007|Fungal biodiversity: Putting our house in order Sharma, N. D.
2006|Yeast biodiversity and culture collections Robert, V; Stalpers, J; Boekhout, T; Tan, SH
2002|Polyfunctional role of biodiversity in processes leading to water purification: current conceptualizations and concluding remarks Ostroumov, SA
2003|Biodiversity: Its evolution, maintenance and ecosystem impacts. Tilman, David
2010|Characteristics of Biodiversity of Thermophilic Microbial Community by Parellel Pyrosequencing Approach Mardanov, A. V.; Gumerov, V. M.; Beletsky, A. V.; Bonch-Osmolovskaya, E. A.; Ravin, N. V.; Skryabin, K. G.
2009|Implementing the Approach Bunnell, Fred L.; Beese, William J.; Dunsworth, Glen B.
1998|Biodiversity at the crossroads Powledge, F
2002|Biodiversity, climate change, and emerging infectious diseases Epstein, PR
2003|CRAYNET: programme and potential. Reynolds, Julian D.; Souty-Grosset, Catherine
2011|Active scepticism must drive biodiversity conservation science Arlettaz, Raphael; Chapron, Guillaume; Braunisch, Veronika
2001|The diversity of benthic macroinvertebrates as an indicator of water quality and ecosystem health: a case study for Brazil. Barbosa, F.A.R.; Callisto, M.; Galdean, N.
2017|Biodiversity loss: Public health risk of disease spread and epidemics Patil, Rajan R.; Kumar, Ch. Satish; Bagvandas, M.
2015|Coordinates of study sites Perovic, David; Gamez-Virues, Sagrario; Steckel, Juliane; Rothenwohrer, Christoph; Erasmi, Stefan; Westphal, Catrin
2017|Coffee Culture: Local Experiences, Global Connections, 2nd Edition Tucker, CM
2013|Opening a can of mopane worms Can cross-sectoral partnerships leverage agricultural biodiversity for better quality diets? McEwan, Margaret; Prain, Gordon; Hunter, Danny
2005|How should we set priorities? Gibbs, WW
2016|Promoting Sustainable Innovations in Plant Varieties Kochupillai, M
2013|The role of livestock and livestock diversity in sustainable diets Hoffmann, Irene; Baumung, Roswitha
2013|Agricultural biodiversity, diverse diets and improving nutrition Introduction Hunter, Danny; Fanzo, Jessica
2006|Preface Minns, Ken; Munawar, Mohiuddin; Mandrak, Nicholas E.
1998|Vital connections. Bawa, K S
2004|Breakthrough of the year. The runners-up. [Anonymous]
2013|Change in tropical landscapes Implications for health and livelihoods Young, Kenneth R.
2015|Mercy on these people, and give us a road Lawler, Andrew
2015|Trading places [Anonymous]
2015|Earthworms data Taylor, Astrid
2014|The Diversity of Aging Wildner, Manfred
2013|PROPERTY CASE STUDIES Hobbs, Richard J.
2013|formica_genotypes Yamamoto, Junpei; Uchida, Kei; Takami, Yasuoki
2011|[Insects and the health of forests.] Nageleisen, Louis-Michel
2015|Public health perspective on patterns of biodiversity and zoonotic disease Salkeld, Daniel J.; Padgett, Kerry A.; Jones, James Holland; Antolin, Michael F.
2003|Adaptive ecosystem management and regulatory penalty defaults: Toward a bounded pragmatism Karkkainen, BC
2014|Scaptotrigona Genotypes Duarte, Olivia MP; Gaiotto, Fernanda A; Costa, Marco A
2012|Urban green parks Sustainable tourism, biodiversity and quality of life: A case study Catibog-Sinha, Corazon
2010|MARINE ECOLOGY Key Indicator of Ocean Health May Be Flawed Stokstad, Erik
2004|SRP meeting on Protecting Biota from Ionising Radiation. Edinburgh, 23 January 2004. Thorne, M; Jackson, D; Stone, D; Whittall, A
2008|Biodiversity and forest ecosystem health: Some key questions Chen Liang; Wang Xu-gao
2014|Shortcuts for biodiversity evaluation: a review of terminology and recommendations for the use of target groups, bioindicators and surrogates. Moreno, Claudia E.; Sanchez-Rojas, Gerardo; Pineda, Eduardo; Escobar, Federico
1997|Biodiversity of soil organisms as an indicator of soil health Pankhurst, C. E.
1996|What makes populations vulnerable to ill health? Woodward, A
2005|Safeguarding human health, safeguarding aquatic snail diversity: conflicting goals? Brown, David S.
2012|Failure to achieve 2010 biodiversity's target in developing countries: How can conservation help? Adenle, Ademola A.
2012|Ecosystem theory and conservation Moulton, Timothy P.
2012|Urban Biodiversity: Successes and Challenges: Health-promoting environments - is good greenspace good enough? Irving, Deryck
2007|Holistic pattern measurement, biodiversity, and ecosystem health Bunn, Jeremy T.
2012|HOW AGRICULTURAL INTENSIFICATION THREATENS TEMPERATE GRASSY WOODLANDS McIntyre, Sue
2008|Ethnobotany in Canada: where biological and cultural diversity meet Cuerrier, A.; Arnason, J. T.
2017|Conservation of biodiversity as a strategy for improving human health and well-being. Kilpatrick, A Marm; Salkeld, Daniel J; Titcomb, Georgia; Hahn, Micah B
2011|Natural immunity von Hertzen, Leena; Hanski, Ilkka; Haahtela, Tari
2006|The North American model of wildlife conservation: a means of creating wealth and protecting public health while generating biodiversity. Geist, Valerius
2008|Emerging Consequences Biotechnology Biodiversity Loss and IPR Issues Anonymous
2014|LIABILITY FOR BIODIVERSITY PROTECTION WITH SPECIAL FOCUS ON WILD FLORA AND FAUNA CONSERVATION Bjelajac, Z.; Mijatovic, M. D.; Fatic, M. Z.; Dukanovic, D.
1995|BIODIVERSITY AND HUMAN HEALTH DOBSON, A
2015|Exploring connections among nature, biodiversity, ecosystem services, and human health and well-being: Opportunities to enhance health and biodiversity conservation Sandifer, Paul A.; Sutton-Grier, Ariana E.; Ward, Bethney P.
2017|The Fogarty International Center is Essential to Global Health Security Porter, John Edward
2014|[Imbalance in global environmental processes affects human health]. Rockstrom, Johan; Moberg, Fredrik
2014|[The Convention on Biological Diversity and the Nagoya Protocol- Beware of and prevent their possible side effects on virus research and public health measures]. Sumida, Seizo
2005|Satellite remote sensing can improve chances of achieving sustainable health Patz, J
2006|DNA banking and health, safety and security. Kapinos, E.; Graham, S.
2009|[Medicine beyond the economic peaks]. Kiefer, Bertrand
2011|Does biodiversity improve mental health in urban settings? Dean, Julie; van Dooren, Kate; Weinstein, Philip
2017|Conservation of biodiversity as a strategy for improving human health and well-being Kilpatrick, A. Marm; Salkeld, Daniel J.; Titcomb, Georgia; Hahn, Micah B.
2004|Global biodiversity informatics: setting the scene for a "New World" of ecological modeling. Canhos, V.P.; Souza, S.; Giovanni, R.; Canhos, D.A.L.
1996|Biodiversity: The implications for human health Mahidol, Chulabhorn Didyasarin
1995|BIODIVERSITY AND HEALTH - PRESCRIPTION FOR PROGRESS REID, WV
1995|[Biodiversity biotechnology and health]. Garcia, E S
2017|Biodiversity change behind wide applications of nanomaterials? Chen, Ming; Qin, Xiaosheng; Zeng, Guangming
2002|Balancing the approaches of environmental conservation by considering ecosystem services as well as biodiversity Singh, SP
2006|Grasshopper (Orthoptera : Acrididae) biodiversity and grassland ecosystems Guo, Zhong-Wei; Li, Hong-Chang; Gan, Ya-Ling
2013|Aquatic Ecosystem Health and Management Society 20 year celebration Nagaraj, G.; Yusoff, F. Md; Shazili, N. A. M.
2010|Profile Jeff Waage-building a coalition of disciplines for global health Kirby, Tony
2016|Biodiversity and human well-being: an essential link for sustainable development. Naeem, Shahid; Chazdon, Robin; Duffy, J Emmett; Prager, Case; Worm, Boris
1996|What policies for biodiversity management in the Wallonia region? Chemical industry and environment: Actions and prospects De Greve, Jean-Pierre
2014|Eco-History: An Introduction to Biodiversity & Conservation Rotherham, ID
2010|THE IMPORTANCE OF THE HEALTH ASPECTS IN THE MAINTENANCE OF ANIMAL BIODIVERSITY: THE CASE OF THE INTERRELATION WILDLIFE-DOMESTIC SPECIES IN THE AREA OF GIBRALTAR. Pastor Fernandez, Jose Ma; Molina Alcala, Antonio; Cervantes Navarro, Isabel; Fernandez Morente, Manuel; Jaen Tellez, Juan Antonio
1993|NSF JOINS USAID, NIH TO CREATE 2 BIODIVERSITY PROGRAMS FRAZER, L
2011|The significance of fieldwork in monographic studies Spooner, David M.
2000|Rift over biodiversity divides ecologists Kaiser, J
2010|National Indicators Show Biodiversity Progress Xu, Haigen; Ding, Hui; Wu, Jun
2004|The role of biodiversity on ecosystem functioning: A removal experiment in the Patagonian steppe, Argentina. Flombaum, Pedro; Sala, Osvaldo E.
1997|Biodiversity and exploitation in fresh waters: A case of Lake Malawi Rashidi, Brian B. A.
2001|Environment - Can we defy nature's end? Pimm, SL; Ayres, M; Balmford, A; Branch, G; Brandon, K; Brooks, T; Bustamante, R; Costanza, R; Cowling, R; Curran, LM; Dobson, A; Farber, S; da Fonseca, GAB; Gascon, C; Kitching, R; McNeely, J; Lovejoy, T; Mittermeier, RA; Myers, N; Patz, JA; Raffle, B; Rapport, D; Raven, P; Roberts, C; Rodriguez, JP; Rylands, AB; Tucker, C; Safina, C; Samper, C; Stiassny, MLJ; Supriatna, J; Hall, DH; Wilcove, D
2008|Plant tissue culture - answer to biodiversity conservation? Tripathi, Mayank
2000|Large-scale hydrological changes in tropical Asia: Prospects for riverine biodiversity Dudgeon, D
2014|Understanding of Biodiversity Among Western Canadian University Students Arbuthnott, Katherine D.; Devoe, Daniel
2005|Establishing indicators for biodiversity Czech, B; Trauger, DL; Farley, J; Costanza, R; Daly, HE; Hall, CAS; Noss, RF; Krall, L; Krausman, PR
2008|Economic valuation for the conservation of marine biodiversity Beaumont, N. J.; Austen, M. C.; Mangi, S. C.; Townsend, M.
2010|Water: act now to restore river health Dugan, Patrick; Allison, Edward H.
2007|Conversation for the people - Pitting nature and biodiversity against people makes little sense. Many conservationists now argue that human health and well-being should be central to conservation efforts Kareiva, Peter; Marvier, Michelle
2016|Scientists stand with Standing Rock Januehowski-Hartley, Stephanie R.; Hilborn, Anne; Crocker, Katherine C.; Murphy, Asia
2002|Toward a sustainable future Annan, KA
1992|PROTECTING THE BIODIVERSITY OF RIVERINE AND RIPARIAN ECOSYSTEMS - THE NATIONAL-RIVER-PUBLIC-LAND-POLICY-DEVELOPMENT-PROJECT DEWBERRY, TC
2004|Climate Change, Biodiversity, and Ecosystem Health The Past as a Key to the Future Barnosky, Anthony D.
2014|Biodiversity and human health: evidence for causality? Hough, Rupert Lloyd
2011|A Systematic Review on the Contributions of Edible Plant and Animal Biodiversity to Human Diets Penafiel, Daniela; Lachat, Carl; Espinel, Ramon; Van Damme, Patrick; Kolsteren, Patrick
1997|Workshop on freshwater biodiversity 
2014|Conservation biology and the endarkenment Ehrlich, Paul R.
2014|Assessing fouling assemblages Canning-Clode, Joao; Sugden, Heather
2003|How to take into account the noise components in ecological time series? Cazelles, B.; Guegan, J. F.
2016|Protected_IBAs_IPBES 
2003|Seasonal adaptation cycles in boreal environments. Hanninen, Osmo
2007|Creating a cyberinfrastructure to involve volunteer groups in citizen science Graham, Jim; Newman, Greg; Crall, Alycia; Jarnevich, Catherine; Stohlgren, Thomas J.
2018|Bialowieza Forest: Logging data lacking Konarzewski, Marek; Zabielski, Romuald; Kowalczyk, Rafal; Duszynski, Jerzy
2010|Global threats to human water security and river biodiversity (vol 467, pg 555, 2010) Voeroesmarty, C. J.; McIntyre, P. B.; Gessner, M. O.; Dudgeon, D.; Prusevich, A.; Green, P.; Glidden, S.; Bunn, S. E.; Sullivan, C. A.; Liermann, C. Reidy; Davies, P. M.
2016|Public feedback at risk in Brazil Athayde, Simone; Moreira, Paula Franco; Heckenberger, Michael
2007|Murray Region Community Bat Monitoring Program Linke, Aimee; Jaunay, Louise
2004|The relative importance of biodiversity in the stability of plant populations in successional communities. Rollins, Scott L.; Parker, Christian A.; Gross, Katherine L.; Mittelbach, Gary G.
2007|The edge of markets: Ecosystem services and meeting the needs of the poor Sanjayan, M.
2016|Descriptive statistics based on interviews (n = 88) with Torotorofotsy, Madagascar residents, May 2014. Gore, Meredith L; Lute, Michelle L; Ratsimbazafy, Jonah H; Rajaonson, Andry
2003|International Symposium on Integrative Biology and Complexity in Natural Systems, Paris, France, May 27-29, 2002. Anonymous
1997|Freshwater as a limited resource Wrammer, Per
2015|The Spawn and Beyond Spitzer, Mark
2016|Eight threats to environmental security in Torotorofotsy, Madagascar in May 2014 (n = 88). Gore, Meredith L; Lute, Michelle L; Ratsimbazafy, Jonah H; Rajaonson, Andry
2004|Are biodiversity effects stronger in mixtures of coevolved species? Eichenberger-Glinz, Susann; Baudois, O.; Wacker, L.; Schmid, B.
1997|Getting to the bottom of marine biodiversity: Sedimentary habitats Snelgrove, Paul V. R.; Butman, Cheryl Ann
1995|Invertebrates. Mason, William T., Jr
2002|Asinara declaration on oil pollution and conservation of biodiversity. Anonymous
1996|Sustainable use of biodiversity - Components of a model project for Brazil BarretodeCastro, LA
2014|Overview of the ecology and biodiversity of the LAB Giraffa, Giorgio
2013|Reducing emissions in the forest sector under the United Nations Framework Convention on Climate Change: A new opportunity for biodiversity conservation? Savaresi, Annalisa
2014|The conceptual framework of the Intergovernmental Platform on Biodiversity and Ecosystem Services/IPBES Joly, Carlos Alfredo
2014|The integration of biodiversity into One Health Romanelli, C.; Cooper, H. D.; Dias, B. F. de Souza
2015|Accounting for biodiversity in the dairy industry Sizemore, Grant C.
2007|Economic Inequality Predicts Biodiversity Loss Mikkelson, Gregory M; Gonzalez, Andrew; Peterson, Garry D
2013|One world, one health van Helden, Paul D.; van Helden, Lesley S.; Hoal, Eileen G.
2010|Shedding some light on people and biodiversity McKinney, M. L.
2016|Oceania Arabena, Kerry; Kingsley, Jonathan
2017|Monitoring biodiversity in libraries: a pilot study and perspectives for indoor air quality. Valeriani, F; Cianfanelli, C; Gianfranceschi, G; Santucci, S; Romano Spica, V; Mucci, N
2017|Ecosystem Approaches to Community Health and Wellbeing: Towards an Integrated Australian Governance Framework in Response to Global Environmental Change Kingsley, Jonathan; Thomas, Sebastian
2015|Soil biodiversity and human health Wall, Diana H.; Nielsen, Uffe N.; Six, Johan
2014|Biodiversity condition estimation and health of environment. Zakharov, V.M.
1999|The role of biodiversity products as incentives for conserving biological diversity: some instructive examples Koo, B; Wright, BD
2007|Ecosystem services and biodiversity in developing countries Mertz, Ole; Ravnborg, Helle Munk; Loevei, Gabor L.; Nielsen, Ivan; Konijnendijk, Cecil C.
2014|IMPACT OF BIODIVERSITY ON TICK-BORNE DISEASES. Dudek, Krzysztof
2016|Supplement S2 SNP Data Ewers-Saucedo, Christine; Pringle, James M; Sepulveda, Hector H; Byers, James E; Navarrete, Sergio A; Wares, John P
2011|Brac 2006 - fish data Sizling, Arnost L; Kunin, William E; Sizlingova, Eva; Reif, Jiri; Storch, David
1995|EXPERTS WARN OF HEALTH RISKS FROM LOSS OF BIODIVERSITY RANDAL, J
2016|Four routes to better maritime governance Wan, Zheng; Chen, Jihong; El Makhloufi, Abdel; Sperling, Daniel; Chen, Yang
2013|Standardized Trait Data Kimball, Sarah; Gremer, Jennifer R; Huxman, Travis E; Venable, David Lawrence; Angert, Amy L
2015|Coor_Geneland Victoriano, Pedro F; Munoz-Mendoza, Carla; Saez, Paola A; Salinas, Hugo F; Munoz-Ramirez, Carlos; Sallaberry, Michel; Fibla, Pablo; Mendez, Marco A
1992|Biodiversity supported. [Anonymous]
2015|Non-market valuation in France. An overview of the research activity Introduction Mahieu, Pierre-Alexandre; Crastes, Romain; Kristroem, Bengt; Riera, Pere
2005|Confronting the human dilemma Mooney, H; Cropper, A; Reid, W
2016|Abundance data of San Lorenzo arthropods in Panama Basset, Yves; Cizek, Lukas; Cuenoud, Philippe; Didham, Raphael K; Novotny, Vojtech; Odegaard, Frode; Roslin, Tomas; Tishechkin, Alexey K; Schmidl, Jurgen; Winchester, Neville N; Roubik, David W; Aberlenc, Henri-Pierre; Bail, Johannes; Barrios, Hector; Bridle, Jonathan R; Castano-Meneses, Gabriela; Corbara, Bruno; Curletti, Gianfranco; Da Rocha, Wesley Duarte; De Bakker, Domir; Delabie, Jacques HC; Dejean, Alain; Fagan, Laura L; Floren, Andreas; Kitching, Roger L; Medianero, Enrique; De Oliveira, Evandro Gama; Orivel, Jerome; Pollet, Marc; Rapp, Mathieu; Ribeiro, Servio P; Roisin, Yves; Schmidt, Jesper B; Sorensen, Line; Lewinsohn, Thomas M; Leponce, Maurice
2016|Water Microbiology Scholz, Miklas
2014|Consortium for Microbial Forensics and Genomics (AFORGE): Capturing Global Biodiversity of Pathogens 
