2006|Profile modification as a means of soil improvement: Promoting root health through deep tillage Labuschagne, Nico; Joubert, Deon
2005|The effects of mine drainage on frog population viability Tune, JS; Schiermeier, M; McDaniel, M; Mueller, J; Campbell, J; Maglia, AM
1997|Basic knowledge and perspectives on microbial diversity and genetics of biodegradation of aromatic compounds Fukuda, M; Kudo, T
2008|When agriculture fails Martyn, Ray D.
2011|Realising One Health: How the Food and Agriculture Organization of the United Nations Envisions Success Newman, Scott; Slingenbergh, Jan; Kaeslin, Edgar; Reantaso, Melba; Subasinghe, Rohana; Lubroth, Juan
1998|Extreme cases: A strategy for ecological risk assessment in ecosystem health Hood, RL
2003|Does diversity mediate frequency-dependence in plant communities? Schnitzer, Stefan; Kinkel, Linda; Xiao, Kun; Reich, Peter
2015|Hepatocystis of African Fruit Bats - Evidence for Continuous and Efficient Transmission Cycles Schaer, Juliane; Vodzak, Megan; Ejotre, Imran; Kurpiers, Laura; Mayer, Frieder; Perkins, Susan; Matuschewski, Kai; Reeder, DeeAnn
2010|The Dynamics Concerning the Degradation of Haloacetic Acid in a Drinking Water Distribution System are Linked to Variations in Biofilm Berthiaume, C.; Pluchon, C.; Gilbert, Y.; Filion, G.; Serodes, J-B.; Pinzon, M. J. Rodriguez; Duchaine, C.; Charette, S. J.
2003|Ecological health of Salmon River, New York tributaries. McKenna, J. E., Jr.; Johnson, J. H.
2007|Source-water dependent variations in fecal indicator assay bacterial community composition and diversity Sercu, B.; De Werfhorst, L. C. Van; Murray, J.; Zachary, J.; Holden, P. A.
2010|AN ASSESSMENT OF EFFLUENT TREATMENT TO REDUCE HEAVY METAL LEVELS IN EFFLUENT FROM A BATTERY MANUFACTURING CONCERN Muleya, E.; Chiumira, F.
2004|Regulation in the invasion process: More than stochastic colonization. Arim, Matias; Neill, Paula E.; Abades, Sebastian R.; Lima, Mauricio; Marquet, Pablo A.
1993|Parasitism in fish: Some perspectives contributing to ichthyology Pereira, Joaber Jr.
2013|Green areas for sustainable city development Sera, Bozena
2000|Animals, public health and the example of cowpox Pastoret, PP; Bennett, M; Brochier, B; Akakpo, AJ
2011|Biochemistry and physiology of medicinal plants and phytomedicines in human health Rajabian, Majid; Fani, Amin; Fani, Fatemeh
2013|How a nested framework illuminates the challenges of comparative environmental analysis Bors, Eleanor K.; Solomon, Susan
2017|Effects of biodiversity and environment-related attitude on perception of urban green space Gunnarsson, B.; Knez, I.; Hedblom, M.; Sang, A. Ode
2016|Urbanisation, Nutrition and Food Security: A Climatological Perspective Beer, Tom; Lin, Brenda B.; McGill, Albert E. J.
1997|Long term effects of sludge applied heavy metals on soil microbial communities Kelly, John J.; Tate, Robert L., III
2009|Assessment of Restoration Activities in Un-Mined and Chronosequentially Reclaimed Sites Using Functional Diversity Analyses of Soil Microbiota Lewis, D. E.; Williams, H. N.; White, J.; Chauhan, A.
1994|Why conservation by legal fiat does not work Latin, Howard
2002|[The deterioration of water layers: Manifestation and tools to fight eutrophication.] Galvez-Cloutier, Rosa; Ize, Sylvaine; Arsenault, Sylvain
2010|Towards a unification of unified theories of biodiversity McGill, Brian J.
2013|Neglected wild life: Parasitic biodiversity as a conservation target Gomez, Andres; Nichols, Elizabeth
2001|Community structure and fish and invertebrate biodiversity in marine ecosystems: The consequences of our actions Fishelson, Lev
2009|Odonata enter the biodiversity crisis debate: The first global assessment of an insect group Clausnitzer, Viola; Kalkman, Vincent J.; Ram, Mala; Collen, Ben; Baillie, Jonathan E. M.; Bedjanic, Matjaz; Darwall, William R. T.; Dijkstra, Klaas-Douwe B.; Dow, Rory; Hawking, John; Karube, Haruki; Malikova, Elena; Paulson, Dennis; Schuette, Kai; Suhling, Frank; Villanueva, Reagan J.; von Ellenrieder, Natalia; Wilson, Keith
2017|Restoration of degraded forest ecosystem through non-forestry livelihood supports: experience from the Chunati Wildlife Sanctuary in Bangladesh Rahman, Mohammad Mahfuzur; Al Mahmud, Md. Abdullah; Ahmed, Farid Uddin
2011|Biodiversity of Borrelia burgdorferi Strains in Tissues of Lyme Disease Patients Brisson, Dustin; Baxamusa, Nilofer; Schwartz, Ira; Wormser, Gary P.
2006|A note on the effect of farmer mental health on adoption: The case of agri-environment schemes Hounsome, Barry; Edwards, Rhiannon T.; Edwards-Jones, Gareth
2008|Assessing the Ecological Impacts of Bioenergy Projects Firbank, Les G.
2016|A knowledge-based approach to estimating the magnitude and spatial patterns of potential threats to soil biodiversity Orgiazzi, Alberto; Panagos, Panos; Yigini, Yusuf; Dunbar, Martha B.; Gardi, Ciro; Montanarella, Luca; Ballabio, Cristiano
2014|Tools for determining critical levels of atmospheric ammonia under the influence of multiple disturbances Pinho, P.; Llop, E.; Ribeiro, M. C.; Cruz, C.; Soares, A.; Pereira, M. J.; Branquinho, C.
2011|N deposition as a threat to the World's protected areas under the Convention on Biological Diversity Bleeker, A.; Hicks, W. K.; Dentener, E.; Galloway, J.; Erisman, J. W.
2007|Expert panel assessment of attributes for natural variability benchmarks for biodiversity Oliver, Ian; Jones, Hugh; Schmoldt, Daniel L.
2014|Thinking globally and siting locally - renewable energy and biodiversity in a rapidly warming world Allison, Taber D.; Root, Terry L.; Frumhoff, Peter C.
2006|FAO Regional Technical Expert Workshop on aquatic biodiversity, its nutritional composition, and human consumption in rice-based systems Halwart, M.; Bartley, D.; Burlingame, B.; Funge-Smith, S.; James, D.
2010|An ecological approach to promoting population mental health and well-being - A response to the challenge of climate change Nurse, Jo; Basher, Damian; Bone, Angie; Bird, William
2009|Relating landscape structure, environment and management to biodiversity indicators estimated from forest inventory data in Catalonia (NE Spain) Torras, O.; Martin-Queller, E.; Saura, S.
2015|Biodiversity and depressive symptoms in Mexican adults: Exploration of beneficial environmental effects Duarte-Tagles, Hector; Salinas-Rodriguez, Aaron; Idrovo, Alvaro J.; Burquez, Alberto; Corral-Verdugo, Victor
2012|Identifying and mitigating dam-induced declines in river health: Three case studies from the western United States Wohl, Ellen
2003|Biomonitoring in the evaluation of human impact: use of lichen biodiversity, and moss accumulation of radioisotopes in an Alpine valley (Valle Orco, Piedmont, Italy) Griselli, B; Bari, A; Magnoni, M; Bertino, S; Isocrono, D; Piervittori, R
2013|Environmental Monitoring of Soil Health in the EIA System (Selection Methodology of Evaluation Criteria) Sokolov, M. S.; Marchenko, A. I.
2014|One Health: Lessons Learned from East Africa. Travis, Dominic A; Chapman, David W; Craft, Meggan E; Deen, John; Farnham, MacDonald W; Garcia, Carolyn; Hueston, William D; Kock, Richard; Mahero, Michael; Mugisha, Lawrence; Nzietchueng, Serge; Nutter, Felicia B; Olson, Debra; Pekol, Amy; Pelican, Katharine M; Robertson, Cheryl; Rwego, Innocent B
2010|HIV/AIDS and forests in Sub-Saharan Africa: exploring the links between morbidity, mortality, and dependence on biodiversity Timko, J. A.; Kozak, R. A.; Innes, J. L.
2006|Sharing the benefits of genetic resources: From biodiversity to human genetics Schroeder, Doris; Lasen-Diaz, Carolina
2015|Beyond species loss: the extinction of ecological interactions in a changing world Valiente-Banuet, Alfonso; Aizen, Marcelo A.; Alcantara, Julio M.; Arroyo, Juan; Cocucci, Andrea; Galetti, Mauro; Garcia, Maria B.; Garcia, Daniel; Gomez, Jose M.; Jordano, Pedro; Medel, Rodrigo; Navarro, Luis; Obeso, Jose R.; Oviedo, Ramona; Ramirez, Nelson; Rey, Pedro J.; Traveset, Anna; Verdu, Miguel; Zamora, Regino
2013|The more polluted the environment, the more important biodiversity is for food web stability Garay-Narvaez, Leslie; Arim, Matias; Flores, Jose D.; Ramos-Jiliberto, Rodrigo
2010|Polar Microbiology: The Ecology, Biodiversity and Bioremediation Potential of Microorganisms in Extremely Cold Environments 
2004|Integrating mineral development and biodiversity conservation into regional land-use planning Richards, DG
2011|Sustainable diets: the Mediterranean diet as an example Burlingame, Barbara; Dernini, Sandro
2008|European monitoring for raptors and owls: State of the art and future needs Kovacs, Andras; Mammen, Ubbo C. C.; Wernham, Chris V.
2005|Community structure of corals and reef fishes at multiple scales Connolly, SR; Hughes, TP; Bellwood, DR; Karlson, RH
2012|Biodiversity inventories and conservation of the marine fishes of Bootless Bay, Papua New Guinea. Drew, Joshua A.; Buxman, Charlene L.; Holmes, Darcae D.; Mandecki, Joanna L.; Mungkaje, Augustine J.; Richardson, Amber C.; Westneat, Mark W.
2001|The current biodiversity extinction event: Scenarios for mitigation and recovery Novacek, MJ; Cleland, EE
2012|Phylogenetic and Functional Metagenomic Profiling for Assessing Microbial Biodiversity in Environmental Monitoring Kisand, Veljo; Valente, Angelica; Lahm, Armin; Tanet, Gerard; Lettieri, Teresa
1994|RELEASE OF TRANSGENIC PLANTS - BIODIVERSITY AND POPULATION-LEVEL CONSIDERATIONS ANGLE, JS
1997|Biodiversity of hedgerows surrounding a point source of nitrogen pollution (Wensleydale, northern England) Kovar, Pavel
1994|POLLUTION, HABITAT DESTRUCTION, AND BIODIVERSITY IN POLAND OLEKSYN, J; REICH, PB
2017|Contribution to the Biodiversity Assessment of Mosquitoes (Diptera: Culicidae) in the Atlantic Forest in Santa Catarina, Brazil Ferreira-de-Freitas, Vinicios; Franca, Rodrigo Massabki; Bartholomay, Lyric C.; Marcondes, Carlos Brisola
2015|Tropospheric O-3, the nightmare of wild plants: a review study Agathokleous, Evgenios; Saitanis, Costas J.; Koike, Takayoshi
2009|Farmers and nature conservation: What is known about attitudes, context factors and actions affecting conservation? Ahnstrom, Johan; Hockert, Jenny; Bergea, Hanna L.; Francis, Charles A.; Skelton, Peter; Hallgren, Lars
2003|Bacterial diversity patterns along a gradient of primary productivity Horner-Devine, MC; Leibold, MA; Smith, VH; Bohannan, BJM
2011|In search of effective bioassessment of urban stormwater pond sediments: enhancing the 'sediment quality triad' approach with oligochaete metrics Tixier, G.; Rochfort, Q.; Grapentine, L.; Marsalek, J.; Lafont, M.
2007|Biodiversity conservation Hone, Jim
2014|The dangers of carbon-centric conservation for biodiversity: a case study in the Andes Duque, Alvaro; Feeley, Kenneth J.; Cabrera, Edersson; Callejas, Ricardo; Idarraga, Alvaro
2012|IMPACT OF INDUSTRIAL EFFLUENT ON THE BENTHIC BIODIVERSITY OF GIZRI CREEK, KARACHI Khan, Moazzam Ali; Shaukat, S. Shahid; Alamgir, Aamir; Zaheen, Wafra Matanat
2013|Ecosystems and Their Services in a Changing World: An Ecological Perspective Raffaelli, Dave; White, Piran C. L.
2008|Basics of the molecular-ecological mechanism of water quality formation and water self-purification Ostroumov, S. A.
2016|The Biodiversity Changes in the Microbial Population of Soils Contaminated with Crude Oil Abbasian, Firouz; Lockington, Robin; Megharaj, Mallavarapu; Naidu, Ravi
2016|Aquatic Biodiversity Conservation and Ecosystem Services 
2010|Plant Biodiversity and Ethnobotany of Chotanagpur Plateau of Jharkhand Bondya, S. L.; Sahu, H. B.
1996|Biodiversity of microorganisms that degrade bacterial and synthetic polyesters Mergaert, J; Swings, J
2015|Iron supply constrains producer communities in stream ecosystems Larson, Chad A.; Liu, Hongsheng; Passy, Sophia I.
2011|Toward a transdisciplinary understanding and a global control of emerging infectious diseases Gonzalez, Jean-Paul; Lambert, Gerard; Legand, Anais; Debre, Patrice
2015|On Public Influence on People's Interactions with Ordinary Biodiversity Skandrani, Zina; Daniel, Lucie; Jacquelin, Lauriane; Leboucher, Gerard; Bovet, Dalila; Prevot, Anne-Caroline
2017|Ecosystem services in a peri-urban protected area in Cyprus: a rapid appraisal Manolaki, Paraskevi; Vogiatzakis, Ioannis N.
2008|Reducing greenhouse gas emissions from deforestation and forest degradation: Global land-use implications Miles, Lera; Kapos, Valerie
2008|Distributed systems and automated biodiversity informatics: Genomic analysis and geographic visualization of disease evolution Hill, Andrew W.; Guralnick, Robert P.
2002|The San Miguel Headwaters - Valley Floor. Volume 1: scientific analysis, synthesis, and recommendations. 
2015|The Health Benefits of Urban Nature: How Much Do We Need? Shanahan, Danielle F.; Fuller, Richard A.; Bush, Robert; Lin, Brenda B.; Gaston, Kevin J.
2017|Ecosystem change and human health: implementation economics and policy. Pattanayak, S K; Kramer, R A; Vincent, J R
2010|Cultivation and Utilization of Minor Subsistence Plant Resources On the Miyako Islands of Japan Sugihara, Tamae; Shinzato, Takayoshi
2015|The sustainable management of cypress Chiu, Chih-Ming; Koh, Chao-Nien
2010|2010 Environmental Performance Index (EPI) Esty, DC; Levy, MA; Srebotnjak, T; De Sherbinin, A; Kim, CH; Anderson, B
2017|SELF-SUSTAINING FOREST Petrokas, R.; Baliuckas, V
2014|Simple Additive Weighting Method on Intelligent Agent for Urban Forest Health Monitoring Pranolo, Andri; Widyastuti, Siti Muslimah
2003|Lichen recolonization of Tilia trees in Arezzo (Tuscany, central Italy) under conditions of decreasing air pollution Loppi, S; Bosi, A; Signorini, C; De Dominicis, V
2014|Surveillance for Emerging Biodiversity Diseases of Wildlife Grogan, Laura F.; Berger, Lee; Rose, Karrie; Grillo, Victoria; Cashins, Scott D.; Skerratt, Lee F.
2009|Rodent biodiversity in changing environments. Auffray, Jean-Christophe; Renaud, Sabrina; Claude, Julien
2003|Community ecology meets epidemiology: Biodiversity loss and elevated Lyme disease risk in fragmented landscapes. Ostfeld, Richard S.; Keesing, Felicia; Logiudice, Kathleen
2008|Lichen bioindication of biodiversity, air quality, and climate: baseline results from monitoring in Washington, Oregon, and California Anonymous
2011|Urban Forests and Their Ecosystem Services in Relation to Human Health Sanesi, Giovanni; Gallis, Christos; Kasperidus, Hans Dieter
2015|Visualisation of Acoustic Entropy Index for Rainforest Health Monitoring System Razali, M. H. M.; Zakaria, A.; Shakaff, A. Y. M.; Visvanathan, R.; Saad, F. S. A.; Kamarudin, L. M.; Abdullah, N. S. Hj
2014|Aromatic, Medicinal Plants and Vulnerability of Traditional Herbal Knowledge in a Berber Community of the High Atlas Mountains of Morocco Montanari, Bernadette
2011|Natural Resource Management Index (NRMI), 2011 Release Anonymous
2005|Landscape heterogeneity and the biodiversity of Arctic stream communities: a habitat template analysis Huryn, AD; Slavik, KA; Lowe, RL; Parker, SM; Anderson, DS; Peterson, BJ
2010|PHYTOREMEDIATION OF WATERS AT AN URBAN STATION OF WATER PURIFICATION BY WATER HYACINTH WITH PREINDUCTION OF METALLOTHIONEINS Danilin, Ilya; Momot, Olga; Synzynys, Boris
1997|Mycorrhizal biodiversity of petroeffluent-irrigated fields Kothari, I. L.; Joseph, Udhyaya; Patel, C. R.
2015|Research Challenges in Modelling Ecosystems Cerone, Antonio; Scotti, Marco
1993|Biodiversity and biosystematic priorities: Microorganisms and invertebrates Hawksworth, D. L.; Ritchie, J. M.
2012|Biogeography in the air: fungal diversity over land and oceans Froehlich-Nowoisky, J.; Burrows, S. M.; Xie, Z.; Engling, G.; Solomon, P. A.; Fraser, M. P.; Mayol-Bracero, O. L.; Artaxo, P.; Begerow, D.; Conrad, R.; Andreae, M. O.; Despres, V. R.; Poeschl, U.
2015|Baseline Assessment of Mesophotic Reefs of the Vit&#243;ria-Trindade Seamount Chain Based on Water Quality, Microbial Diversity, Benthic Cover and Fish Biomass Data Moura, Rodrigo L De; Bastos, Alex C; Meirelles, Pedro M; Nakamura, Shota; Thompson, Fabiano L; Pereira-Filho, Guilherme H; Edwards, Robert A; Rezende, Carlos E; Joyeux, Jean-Christophe; Pinheiro, Hudson T; Paranhos, Rodolfo; Dinsdale, Elizabeth; Mazzei, Eric F; Santos, Eidy O; Jr, Luiz M R Gadelha; Thompson, Cristiane; Gotoh, Kazuyoshi; Amado-Filho, Gilberto M; Sawabe, Tomoo; Francini-Filho, Ronaldo B; Iida, Tetsuya
2013|The Overlooked Terrestrial Impacts of Mountaintop Mining Wickham, James; Wood, Petra Bohall; Nicholson, Matthew C.; Jenkins, William; Druckenbrod, Daniel; Suter, Glenn W.; Strager, Michael P.; Mazzarella, Christine; Galloway, Walter; Amos, John
2002|Monitoring biodiversity and ecosystem function: Grasslands, deserts, and steppe Rosentreter, R; Eldridge, DJ
2000|The ecology of tropical Asian rivers and streams in relation to biodiversity conservation Dudgeon, D
2011|Natural Resource Management Index (NRMI), 2011 Release 
2010|Effect of petroleum organic compounds in synthetic wastewater on treatment performance and microbial community structures in membrane biological reactor (MBR) Wiszniowski, Jaroslaw; Ziembinska, Aleksandra; Ciesielski, Slawomir
2006|Sacred Cows and Sympathetic Squirrels: The Importance of Biological Diversity to Human Health Dobson, Andy; Cattadori, Isabella; Holt, Robert D.; Ostfeld, Richard S.; Keesing, Felicia; Krichbaum, Kristle; Rohr, Jason R.; Perkins, Sarah E.; Hudson, Peter J.
2002|Biodiversity of epiphytic lichens and air pollution in the town of Siena (Central Italy) Loppi, S; Ivanov, D; Boccardi, R
2007|Harnessing the health benefits of plant biodiversity originating from the American tropics in the diet Fahrasmane, Louis; Ganou, Berthe; Aurore, Guylene
2016|Bibliometric analysis of ecosystem monitoring-related research in Africa: implications for ecological stewardship and scientific collaboration Yevide, Armand S. I.; Wu, Bingfang; Khan, Ahmed S.; Zeng, Yuan; Liu, Jian
2012|STRATEGIES FOR CONSERVATION OF ENDANGERED ECOSYSTEMS Ashraf, Muhammad; Hussain, Mumtaz; Ahmad, Muhammad Sajid Aqeel; Al-Qurainy, F.; Hameed, Mansoor
2012|Composite bird indicators robust to variation in species selection and habitat specificity Renwick, Anna R.; Johnston, Alison; Joys, Andrew; Newson, Stuart E.; Noble, David G.; Pearce-Higgins, James W.
2001|Diversity patterns from ecological models at dynamical equilibrium Bastolla, U; Lassig, M; Manrubia, SC; Valleriani, A
2015|Food, Agriculture & the Environment: Can We Feed the World & Save the Earth? Tilman, David; Clark, Michael
2009|Reducing the Risks of the Wildlife Trade Smith, Katherine F.; Behrens, Michael; Schloegel, Lisa M.; Marano, Nina; Burgiel, Stas; Daszak, Peter
2016|Eco-hydromorphic Classification for Understanding Stream Macroinvertebrate Biodiversity in Brunei Darussalam, Northern Borneo Baker, Kate; Chadwick, Michael A.; Sulaiman, Zohrah Haji
2018|Measuring the impact of global tropospheric ozone, carbon dioxide and sulfur dioxide concentrations on biodiversity loss Bhuiyan, Miraj Ahmed; Khan, Haroon Ur Rashid; Zaman, Khalid; Hishan, Sanil S.
1999|Management and restoration of fish communities in Lake Taihu, China Kangmin, LI
2017|The contribution of theory and experiments to conservation in fragmented landscapes Resasco, Julian; Bruna, Emilio M.; Haddad, Nick M.; Banks-Leite, Cristina; Margules, Christopher R.
2013|Reinstating soil microbial diversity in agroecosystems: The need of the hour for sustainability and health Seneviratne, G.; Kulasooriya, S. A.
2013|Can REDD plus Help the Conservation of Restricted-Range Island Species? Insights from the Endemism Hotspot of Sao Tome de Lima, Ricardo Faustino; Olmos, Fabio; Dallimer, Martin; Atkinson, Philip W.; Barlow, Jos
2005|Twenty-first century systematics and the human predicament Ehrlich, Paul R.
2018|Carbon and Biodiversity Impacts of Intensive Versus Extensive Tropical Forestry Griscom, Bronson W.; Goodman, Rosa C.; Burivalova, Zuzana; Putz, Francis E.
2014|Overview of adaptive management for multiple biodiversity values at the Western Treatment Plant, Werribee, leading to a pilot nutrient addition study Steele, W. K.; Harrow, S.
2014|Four-Year Study on Phytoplankton Biodiversity in a Small Hypertrophic Lake Affected by Water Blooms of Toxigenic Cyanobacteria Toporowska, Magdalena; Pawlik-Skowronska, Barbara
2001|Role of nematodes in soil health and their use as indicators Neher, DA
2015|Assessment of the Conservation Status of Natural and Semi-Natural Patches Associated with urban Areas Through Habitat Suitability Indices Natale, E.; Villalba, G.; Junquera, J. E.; Zalba, S. M.
2014|The effects of light and noise from urban development on biodiversity: Implications for protected areas in Australia Newport, Jenny; Shorthouse, David J.; Manning, Adrian D.
2014|Marine spatial planning for fisheries management and biodiversity conservation: More to be done Guo Zhenren
2013|Consequences of human modification of the global nitrogen cycle Erisman, Jan Willem; Galloway, James N.; Seitzinger, Sybil; Bleeker, Albert; Dise, Nancy B.; Petrescu, A. M. Roxana; Leach, Allison M.; de Vries, Wim
2016|Biodiversity management of organic orchard enhances both ecological and economic profitability Meng, Jie; Li, Lijun; Liu, Haitao; Li, Yong; Li, Caihong; Wu, Guanglei; Yu, Xiaofan; Guo, Liyue; Cheng, Da; Muminov, Mahmud A.; Liang, Xiaotian; Jiang, Gaoming
2016|Marine Biota and Psychological Well-Being: A Preliminary Examination of Dose-Response Effects in an Aquarium Setting Cracknell, Deborah; White, Mathew P.; Pahl, Sabine; Nichols, Wallace J.; Depledge, Michael H.
2016|Designer ecosystems: A solution for the conservation-exploitation dilemma Awasthi, Ashutosh; Singh, Kripal; O'Grady, Audrey; Courtney, Ronan; Kalra, Alok; Singh, Rana Pratap; Cerda, Artemi; Steinberger, Yosef; Patra, D. D.
2016|A NEW WEED MANAGEMENT APPROACH TO IMPROVE SOIL HEALTH IN A TROPICAL PLANTATION CROP, RUBBER (HEVEA BRASILIENSIS) Abraham, Joshua; Joseph, Phebe
2006|The clock is ticking - Revegetation and habitat for birds and arboreal mammals in rural landscapes of southern Australia Vesk, PA; Mac Nally, R
2015|Volunteer and professional macroinvertebrate monitoring provide concordant assessments of stream health Moffett, E. R.; Neale, M. W.
2013|Natural Resource Management Index (NRMI), 2010 Release Natural Resource Management Index (NRMI), 2011 Release Natural Resource Protection and Child Health Indicators, 2012 Release Natural Resource Protection and Child Health Indicators, 2013 Release 
2005|Proceedings of the British Society of Animal Science 2005 
2017|Contribution of organic farming to public goods in Denmark. Jespersen, L. M.; Baggesen, D. L.; Fog, E.; Halsnaes, K.; Hermansen, J. E.; Andreasen, L.; Strandberg, B.; Sorensen, J. T.; Halberg, N.
2009|Emerging diseases, zoonoses and vaccines to control them Paul-Pierre, Pastoret
2016|Water quality of rural ponds in the extensive agricultural landscape of the Cerrado (Brazil) Bichsel, David; De Marco, Paulo, Jr.; Bispo, Arthur Angelo; Ilg, Christiane; Dias-Silva, Karina; Vieira, Thiago Bernardi; Correa, Caroline Costa; Oertli, Beat
2014|Socioeconomic influences on biodiversity, ecosystem services and human well-being: A quantitative application of the DPSIR model in Jiangsu, China Hou, Ying; Zhou, Shudong; Burkharda, Benjamin; Mueller, Felix
2002|The impact of globalization and environmental change on health: challenges for nurse education Kirk, M
2009|Design and implementation of a web-based platform to support interactive environmental planning Ghaemi, Parisa; Swift, Jennifer; Sister, Chona; Wilson, John P.; Wolch, Jennifer
2014|Relationship between benthic macroinvertebrate bio-indices and physicochemical parameters of water: a tool for water resources managers Yazdian, Hamed; Jaafarzadeh, Nematollah; Zahraie, Banafsheh
2017|Global hotspots and correlates of emerging zoonotic diseases Allen, Toph; Murray, Kris A.; Zambrana-Torrelio, Carlos; Morse, Stephen S.; Rondinini, Carlo; Di Marco, Moreno; Breit, Nathan; Olival, Kevin J.; Daszak, Peter
2008|ETHONOBOTANICAL PROPERTIES AND USES OF MEDICINAL PLANTS OF MORGAH BIODIVERSITY PARK, RAWALPINDI Husain, Syed Zahoor; Malik, Riffat Naseem; Javaid, Mubashera; Bibi, Sadia
2008|Integrative Approaches to the Study of Primate Infectious Disease: Implications for Biodiversity Conservation and Global Health Gillespie, Thomas R.; Nunn, Charles L.; Leendertz, Fabian H.
2006|Virus in nonhuman primates: Zoonosis, anthroponosis and biodiversity Pujol, Flor H.
2001|Health, biodiversity, and natural resource use on the Amazon frontier: an ecosystem approach. Murray, T P; Sanchez-Choy, J
2012|Megadiverse developing countries face huge risks from invasives Lovei, Gabor L.; Lewinsohn, Thomas. M.
1999|Biological diversity and ecosystem functions of forest soil fungi: Management implications Molina, R; O'Dell, T; Dunham, S; Pilz, D
2017|Smart Composite Materials for Environmental Decontamination Kuvarega, Alex T.; Mishra, Ajay Kumar; Mamba, Bhekie B.
2012|Stochastic Assembly Dictates the Succession of Microbial Communities in Response to Environmental Perturbations Zhou, J.; Deng, Y.; Zhang, P.; Xue, K.; Van Nostrand, J.; He, Z.
2011|Assessment of soil quality using microbial properties and attributes of ecological relevance Garbisu, Carlos; Alkorta, Itziar; Epelde, Lur
2013|Threat: Pollution Williams, David R.; Pople, Robert G.; Showler, David A.; Dicks, Lynn V.; Child, Matthew F.; Ermgassen, Erasmus K. H. J. Zu; Sutherland, William J.
2004|Molecular microbial diversity assessment of post-flight international space station potable waters Venkat, P.; La Duc, M. T.; Pierson, D.; Sumner, R.; Venkateswaran, K.
1994|Biosystematics and Ecology Series, Suppl.: Fundamentals of ecology in Austria: Model for Europe? 
2004|Will ecology provide the next major advance in freshwater science? Powell, A
2007|The value of medicinal plants in Ecuador Gachet, M. S.; Bauer, R.; Munoz, R.
2004|ZINC AND LEAD RESISTANCE OF LICHEN POPULATIONS INHABITING ENVIRONMENTS OF DIFFERENT METAL CONTENTS Pawlik-Skowronska, B.; Skowronski, T.; Wojciak, H.
