2016|DIVERSITY, ABUNDANCE AND PREVALENCE OF NEMATODES INSIDE THE INTESTINE OF NORTH AMERICAN MILLIPEDES Phillips, D.; Bernard, E. C.; Shelley, R. M.; Sun, X.
2014|Model-averaged parameter estimates and standard errors based on the 95% confidence set for variables potentially affecting the number of Ixodes scapularis nymphs (NON)* at various locations in the Thousand Islands in 2009 and 2010. Bowman, Jeff; Werden, Lisa; Barker, Ian K; Gonzales, Emily K; Leighton, Patrick A; Lindsay, L Robbin; Jardine, Claire M
2008|Ecological studies and the state of the ecosystem of Amursky Bay and the estuarine zone of the Razdolnaya River (Sea of Japan). Volume 1. 
2006|Does the addition of nitrate affect the diversity and abundance of heterotrophic nitrate assimilating bacteria? Brofft, J.; Frischer, M.; Baylor, V.; Hoelzle, A.; Fraizer, L.; Sanderson, M.; Bronk, D.; Nejstgaard, J.
2004|Populations of Enterococci spp from fresh and aged cattle manure in south-central Idaho Graves, A. K.; Weaver, R. W.; Entry, J. A.; Wey, S. A. Ver
2003|Diversity of streptomycetes isolated from indoor dust. Rintala, H.; Hyvarinen, A.; Nevalainen, A.
1996|Sustainable use of the tropical rain forest: Evidence from the avifauna in a shifting-cultivation habitat mosaic in the Colombian Amazon. (Reprinted from Conservation Biology vol. 8, pp. 545-554, 1994) Andrade, German I.; Rubio-Torgler, Heidi
1996|Cork oaks in arid zones: The use of historical information in the service of ecology Garcia Latorre, J.; Garcia Latorre, J.
1993|Lists and protection, a burning subject Savourey, Michel
1992|Ecological impacts and risks associated with forest management Morris, Larry A.; Bush, P. B.; Clark, J. S.
2016|High efficient Mewar Angithi stove testing in rural Kenya Parigi, Fabio; Del Viscio, Michele; Amicabile, Simone; Testi, Matteo; Rao, Sailesh; Udaykumar, H. S.
2015|The Use and Development of Benefit Transfer in Europe Brouwer, Roy; Navrud, Stale
2015|Agrochemicals in the South Nation River watershed: Relative effects of atrazine versus nutrients on riparian and aquatic plants (PL) Dalton, Rebecca; Pick, Frances; Boutin, Celine
2013|Towards Sustainable Mining: Diffusion of Sustainability Concepts into the Mining Industry within Canada Jarvie-Eggart, Michelle Edith
2011|Quantitative characterization of heavy metals in northern California lakes: Introducing field work in the undegraduate curriculum Bravo, Christopher; Cabrera, Jose
2011|Bacterial Diversity in Drinking Water Samples from Accra, Ghana Ecklu-Mensah, G.; Sackey, S. T.; Morrison, H.; Sogin, M.; Murphy, L.; Reznikoff, W.
2009|Freshwater phytoplankton: diversity and biology Bowling, Lee
2008|Judiveera - An excellent remedy for malaria Pandey, Hari Prakash
2004|From one species to many or many species to one? - The case of begomoviruses Brown, J. K.
1999|Examples of innovative information management for reporting forest data and information Fenech, A
1997|In situ enumeration of anaerobic bacteria that degrade ethylbenzene, toluene and PCE Raimond, C. S. Iii; Stricker, J. R.; Silverstone, S. E.
1995|Boating activity, boat speed regulation and manatee protection in Brevard County, Florida Morris, John; Nodine, Brian
2015|Vegetation Response to Climate Change and Air Pollution - Unifying Research and Evidence from Northern and Southern Hemisphere Matyssek, Rainer; Kozovits, Alessandra R.; Wieser, Gerhard
2014|Geospatial distribution of the primary vectors of Rift Valley Fever (RVF) (Ae. Mcintoshi and Ae. ochraceous) along the Livestock Migration Routes (LMR) in Garissa and Lamu Counties Kenya Okello, S. A.; Weldon, C.; Lande, O. W.; Sang, R.
2013|Herbal Medicine in Indonesian Culture: From Food to Cure Agil, Mangestuti
2012|Untitled Sayre, Richard; Olivares, Jose; Wijffels, Rene H.
2011|The Diversity of the Apes What Is the Future? Boesch, Christophe
2011|Impact of Bauxite Mining to Soil Microbiota and Geochemistry Along a Restoration Chronosequence Chauhan, A.; Overholt, W. A.; White, J. R.; Green, S. J.; Lewis, D. E.; Jasrotia, P.; Wafula, D.
2011|LIPIDS Kieliszewska-Rokicka, Barbara
2010|HOUSEHOLD-LEVEL PREDICTORS OF AEDES AEGYPTI PRESENCE AND ABUNDANCE IN IQUITOS, PERU: IMPLICATIONS FOR DENGUE CONTROL Boldenow, Peter J.; Wilson, Mark L.; Getis, Arthur; Astete, Helvio; Sihuincha, Moises; Stancil, Jeffrey D.; Scott, Thomas W.; Morrison, Amy C.
2009|Influence of Lead Contamination on Bacterial Community in Pine Forest Soil Hui, N.; Romantschuk, M.
2008|THE TRIPS-PLUS IN BILATERAL AGREEMENTS BOOSTED BY UNITED STATES: CONSEQUENCES FOR DEVELOPING COUNTRIES Gomez Uranga, Mikel; Lopez Gomez, Maria del Socorro; Araujo de la Mata, Andres
2002|Changes in insect herbivore communities along an ozone and nitrogen deposition gradient in the San Bernardino Mountains. Eatough Jones, Michele; Paine, Timothy D.
2001|Pollution, tidal level, substratum and seasonality as determining factors in a intertidal marine benthic succession experiment Santolaria, A.; Diez, I.; Secilla, A.; Gorostiaga, J. M.
1997|Anaerobic sediment microbial ecology along a mixed contaminant pollution gradient Bushart, S. P.; Boylen, C. W.; Cane, T. L.; Rankin, J. M.; McEwen, M. M.; Soracco, R. J.
1993|WHAT IS CONSERVATION BIOLOGY AND WHY IS IT SO IMPORTANT GIVEN, DR
2017|Strategically Siting Urban Agriculture: A Socioeconomic Analysis of Roanoke, Virginia Parece, Tammy E.; Serrano, Elena L.; Campbell, James B.
2014|Carbon storage and sequestration of national key ecological restoration programs in China: An introduction to special issue Liu Guohua; Wu Xing
2014|Correlations between current land cover surrounding the village, and art variables representing children's drawings of their future environment. Gaveau, David; Meijaard, Erik; Wells, Jessie A; Pellier, Anne-Sophie; Abram, Nicola K
2013|Research and Development of Underutilised Plant Species: Crops for the Future - beyond Food Security Jaenicke, H.
2013|Microbial Community Structure and Function in Saturated Riverbed and Laboratory Sediments Li, D.; Alidina, M.; Drewes, J. E.; Sharp, J. O.
2012|[Abstract Book of the Third International Neotropical Parasitology Meeting (III COPANEO). Global parasitology: health, biodiversity and zoonoses, 5th to 10th November 2012, Lima, Peru.] Abstracts
2011|The effect of roads on avian communities: Indirect effects on nestlings through parental feeding rates Johnson, E. E.; Crino, O. L.; Breuner, C. W.
2011|The need for Biosafety education in Malaysia Rusly, Noor Sharizad; Amin, Latifah; Zainol, Zinatul Ashiqin
2010|An overview of the Chemical Ecology of Marine Macroalgae and Benthic Invertebrates along the Antarctic Peninsula Mcclintock, J. B.; Amsler, C. D.; Baker, B. J.
2010|Comparison of benthic macroinvertebrate community to sediment quality guidelines classification using various indices: The case of the St. Lawrence River Desrosiers, M.; Cormier, M.; Masson, S.; Archaimbault, V.; Pinel-Alloul, B.
2008|From population structure to genetically engineered vectors: New ways to control vector-borne diseases? Sparagano, Olivier
2005|DIVERSITY OF BENTHIC ALGAE AND THEIR ANNUAL OCCURRENCES IN THE PING RIVER Kunpradid, T.; Peerapornpisal, Y.
2005|Phytoremediation treatment system for landfill leachate Steggall, NA; Hedges, PD; Fermor, PM
2004|The effects of color and design on bird abundance at feeders. Horn, D. J.; Bruch, S.; Goll, A.; Pawelko, T. S.; Snater, J.
2003|Molecular monitoring of microbial diversity in anaerobic wastewater treatment systems with an identification DNA array. Roest, K.; Heilig, H. G. H. J.; Smidt, H.; Akkermans, A. D. L.; Stams, A. J. M.; de Vos, W. M.
2003|The world's shads: Summary of their status, conservation, and research needs Waldman, JR; Limburg, KE
2015|THE GEOLOGICAL CONDITIONING OF HYDROCARBON EMISSIONS RESULTING FROM SOIL CONTAMINATION Lipinska, Ewa J.
2014|Model-averaged parameter estimates and standard errors based on the 95% confidence set for variables potentially affecting the number of infected nymphal Ixodes scapularis (NIN)* collected at various locations in the Thousand Islands in 2009 and 2010. Bowman, Jeff; Werden, Lisa; Barker, Ian K; Gonzales, Emily K; Leighton, Patrick A; Lindsay, L Robbin; Jardine, Claire M
2013|BIOSEQUESTRATION AND ECOLOGICAL DIVERSITY Mitigating and Adapting to Climate Change and Environmental Degradation Introduction Maser, Chris
2012|Biological monitoring and pollution assessment of the Mukuvisi River, Harare, Zimbabwe Regina, Ndebele-Murisa Mzime
2010|Marine foods as functional ingredients in bakery and pasta products. Kadam, S. U.; Prabhasankar, P.
2007|Species on the edge: Genetic diversity and local climatic adaptation in butterflies with contrasting ecological traits Zakharov, Evgueni V.; Pelini, Shannon; Hellmann, Jessica J.
2005|A preliminary report on the importance of termite mounds to the herpetofauna of the cerrado of central Brazil Fenolio, DB; Moreira, LA; Silva, HLR; Da Silva, NJ
2005|Transitions in a globalising world Martens, P; Rotmans, J
2005|Conclusions Kosarev, AN; Kostianoy, AG
2003|Functional and species diversity of soil oil-oxidizing bacteria in contrasting climatic zones. Karaseva, E. V.; Karasev, S. G.; Girich, I. E.; Koksina, V. V.; Ivshina, I. B.; Kuyukina, M. S.; Philp, J. C.
2001|Effects of whole-ecosystem atmospheric CO2 concentration manipulation on arthropod population dynamics in southern California chaparral Anderson, Alison; Williams, Kathy S.
1996|The effects of management systems on ground-foraging ant diversity in Costa Rica. (Reprinted from Ecological Applications vol. 4, pp. 423-436, 1994) Roth, Dana S. Vvette Perfecto; Rathcke, Beverly
1996|Insect diversity in the Thar Desert Tandon, SK
2015|Aquaculture, Resource Use, and the Environment Boyd, CE; McNevin, AA
2012|ENVIRONMENTAL IMPACT ANALYSIS OF QUARRYING ACTIVITIES ESTABLISHED ON AND NEAR A RIVER BED BY USING REMOTELY SENSED DATA Ozcan, Orkan; Musaoglu, Nebiye; Seker, Dursun Zafer
2007|Learning from quarantine successes Hollingsworth, Robert G.; Loope, Lloyd L.
1997|Population dynamics of 3-chlorobenzoate degrading bacteria introduced into streambed sediments Bott, T. L.
1996|Transgenic organisms and evolution: Ethical implications Potthast, T
1994|Terrestrial community types of the United States: Patterns of rarity and threats Grossman, Dennis H.; Goodin, Kathleen Lemon
1991|PROSPECTORS FOR TROPICAL MEDICINES JOYCE, C
2015|Filling infrastructures and urban voids with nature: green areas typology Camilletti, Paolo
2015|Nutrient Loading Natural versus Anthropogenic Inputs Kennish, Michael J.
2014|Model-averaged parameter estimates and standard errors based on the 95% confidence set for variables potentially affecting the prevalence of Borrelia burgdorferi infection in nymphal Ixodes scapularis collected at various locations in the Thousand Islands in 2009 and 2010. Bowman, Jeff; Werden, Lisa; Barker, Ian K; Gonzales, Emily K; Leighton, Patrick A; Lindsay, L Robbin; Jardine, Claire M
2013|DNA SEQUENCING PROVIDES NEW INSIGHTS INTO THE DIVERSITY OF NONGENICULATE CORALLINE ALGAE (CORALLINALES, RHODOPHYTA) IN THE NORTHWESTERN GULF OF MEXICO Richards, J.; Gabrielson, P. W.; Fredericq, S.
2011|Dead-shell assemblages as a means of detecting ecological changes and baseline conditions: A test on the urban southern California continental shelf Kidwell, S. M.; Tomasovych, A.
2010|Real-Time Analysis of Mucosal Flora in Patients with Inflammatory Bowel Disease in India Verma, Ravi; Verma, Anil Kumar; Ahuja, Vineet; Paul, Jaishree
2009|Antarctic subglacial lake exploration: a new frontier in microbial ecology Pearce, D. A.
2009|HUGE DIVERSITY OF MICROALGAE; HOW HAVE SO MANY SPECIES ARISEN? Evans, K. M.; Vanormelingen, P.; Nagai, S.; Mann, D. G.
2009|Ethnoveterinary Plants of Johar Valley of Pithoragarh district, Uttarakhand Himalaya Tiwari, Lalit; Pande, P. C.
2007|Evolutionary response to climatic change? Huntley, B.
2006|Diversity of nifH in microbial biofilm response to added nutrients generated in flow-through seawater microcosms Lee, S. H.; Hellem, K. N.; Knowles, A.; Castillo-Gonzales, H. A.; Snyder, R. A.; Lepo, J. E.
2006|Microbial diversity and functional characteristics in metal- and radionuclide-contaminated soils at Savannah River Sites, South Carolina, USA Ye, Q.; Yan, T.; Zhou, J.; Zhang, C.
1996|Transgenerational loss of function: A threat to biodiversity of marine ecosystems Rolland, Roz; Colborn, Theo
1995|Mitigation banks: A strategy for sustainable ecosystem function Willard, Daniel E.; Klarquist, John
1994|PROTECTING FOREST RESOURCES - THE NEED FOR EXPERTISE IN PATHOLOGY AND ENTOMOLOGY CASTELLO, JD; BRUHN, JN; CUMMINGSCARLSON, J; HAIN, F; THOMAS, C
2014|Conceptualizing the nexus between urban shrinkage and ecosystem services Haase, Dagmar; Haase, Annegret; Rink, Dieter
2013|Understanding Anopheles Diversity in Southeast Asia and Its Applications for Malaria Control Morgan, Katy; Somboon, Pradya; Walton, Catherine
2010|Preliminary Studies of Nectarivorous Bat Foraging in Fragmented and Continuous Forest Landscapes in a Mexican Tropical Dry Forest Thompson, Pamela; Sork, Victoria
2010|Tolerance of Antarctic Soil Fungi to Hydrocarbons and Their Potential Role in Soil Bioremediation Hughes, Kevin A.; Bridge, Paul
2010|Recent Advancements in Amphibian and Reptile Ecotoxicology Sparling, Donald W.; Linder, Greg; Bishop, Christine A.; Krest, Sherry K.
2007|A Study on Metadata for Sharing the Information of Earth Observation Kwak, Seungjin
2006|Populational genetic diversity of the principal vector of malaria, Anopheles darlingi, along the Iquitos-Nauta highway in Loreto, Peru Pinedo, Viviana V.; Castro, Juan C.; Cordova, Juliana; Calderon, Maritza; Gilman, Robert
2004|Adaptive radiation from resource competition in digital organisms Chow, SS; Wilke, CO; Ofria, C; Lenski, RE; Adami, C
2004|Testing the long-term persistence in reserves of a rare butterfly with a spatially-explicit dynamic approach. Gutierrez, David
2004|Assemblage response to anthropogenic stressors in streams. Pollard, Amina; Yuan, Lester
1996|The ''new science'' of wetland restoration Young, P
1996|First data on the presence of a marcescent oak (Quercus faginea Lam.) in an arid environment Garcia Latorre, J.; Garcia Latorre, J.
1994|Fish Creek Bioreserve Project McGrath, Dennis
2014|SPATIAL AND TEMPORAL VARIATION OF INTERTIDAL NEMATODE COMMUNITIES AFTER THE DEEP-WATER HORIZON OIL SPILL. Sharma, J.; Brannock, P. M.; Bik, H.; Halanych, K. M.; Thomas, W. K.
2013|Otters as Symbols in the British Environmental Discourse Syse, Karen Victoria Lykke
2012|Multilocus Sequence Analysis of Escherichia Isolates from Pristine and Contaminated Rivers in Mexico Reveals a High proportion of Novel STs, Contrasting Population Structures, and the Presence of Cryptic Lineages Rodriguez-Bucheli, P.; Ramos-Madrigal, J.; Vinuesa, P.
2011|Metagenomic Analysis of the Deep-Sea Microbial Community Response to the Deepwater Horizon Oil Spill Mason, O. U.; Lamendella, R.; Hultman, J.; Mackelprang, R.; Borglin, S.; Tom, L. M.; Dubinsky, E. A.; Fortney, J.; Hazen, T. C.; Jansson, J. K.
2011|The Human Oral Metagenome Mullany, Peter; Warburton, Philip; Allan, Elaine
2011|Change in Species Composition and Distribution of Algae in the Coastal Waters of Western Japan Nagai, Satoshi; Yoshida, Goro; Tarutani, Kenji
2009|Saro (Cinnamosma fragrans Baillon) essential oil: Application in Health and Medicine Behra, Olivier; Danthu, Pascal; Sarter, Samira; Radaniela, Rina; Fourcade, Cesar; Randrianarivelo, Roger; Ranaivosoa, Boris; Arnal-Schnebelen, Berengere
2007|Building social capital in forest communities: Analysis of New Mexico's Collaborative Forest Restoration Program Prante, Tyler; Thacher, Jennifer A.; Mccollum, Daniel W.; Berrens, Robert P.
2004|Ecotoxicological sediment assessment of flowing water with nematodes and gastropods: Freiland biotest Duft, Martina
2002|The biodiversity of actinomycetes in Lake Baikal. Terkina, I. A.; Drukker, V. V.; Parfenova, V. V.; Kostornova, T. Ya.
2001|Distribution and diversity of crustacean groups in river Cauvery Narayana, J.; Somashekar, R. K.
1999|New methods to elicit and identify environmental values. Satterfield, Theresa A.
2018|Plastic waste associated with disease on coral reefs Lamb, Joleah B.; Willis, Bette L.; Fiorenza, Evan A.; Couch, Courtney S.; Howard, Robert; Rader, Douglas N.; True, James D.; Kelly, Lisa A.; Ahmad, Awaludinnoer; Jompa, Jamaluddin; Harvell, C. Drew
2015|The Sava River Preface Milacic, Radmila; Scancar, Janez; Paunovic, Momir
2014|Primary captures of animals at 12 sites in the Thousand Islands during trapping sessions in June and August 2009 and 2010 included the white-footed mouse (Peromyscus leucopus), short-tailed shrew (Blarina brevicauda), eastern chipmunk (Tamias striatus), meadow vole (Microtus pennsylvanicus), flying squirrel (Glaucomys sp.), masked shrew (Sorex cinereus), red squirrel (Tamiasciurus hudsonicus), and short-tailed weasel (Mustela erminea). Bowman, Jeff; Werden, Lisa; Barker, Ian K; Gonzales, Emily K; Leighton, Patrick A; Lindsay, L Robbin; Jardine, Claire M
2014|Comparative summary of assessment tools and methods that have been applied to regions of the US West coast. Katona, Steven K; Rosenberg, Andrew A; Longo, Catherine; Halpern, Benjamin S; Best, Benjamin D; Doney, Scott C; McLeod, Karen L; Samhouri, Jameal F; Hardy, Darren; Scarborough, Courtney
2012|Climate stabilization wedges revisited: can agricultural production and greenhouse-gas reduction goals be accomplished? Del Grosso, Stephen J.; Cavigelli, Michel A.
2010|ENVIRONMENTAL CHANGE AND THE MICROBIAL ECOLOGY OF ANOPHELES GAMBIAE Gilbreath, Thomas M., III; Kweka, Eliningaya; Yan, Guiyun
2010|Unitled Boddy, Lynne
2010|Experimental and Natural Recombination in Trypanosoma cruzi Lewis, Michael D.; Llewellyn, Martin S.; Yeo, Matthew; Miles, Michael A.
2007|The identification, population diversity and potential for cultivation of the medicinally important Rhodiola rosea (Crassulaceae) in northern Quebec Archambault, Mariannick; Cuerrier, Alain; Bruneau, Anne
2006|The change of micromycetes species diversity of the oil polluted soils during bioremediation Kireva, N. A.; Bakaeva, M. D.; Galimzyanova, N. F.
2003|Water, water everywhere... - Integrated Riparian research in the North Central Region Westphal, LM
2002|Governments enact land use policies developed by ecology and law students to protect aquatic biota Fowler, Laurie
1999|Biosafety regulations in Mexico with NAFTA - Facing the dilemma of biodiversity conservation and business development Galvez, A; Solleiro, JL; Gonzalez, RL
1997|Effects of fish stocking on lake ecosystems in China Zhang, Guohua; Cao, Wenxuan; Chen, Yiyu
1996|Economic transformations and loss of biodiversity: A long-term perspective Garcia Latorre, J.; Garcia Latorre, J.
1996|Water quality assessment along a restored scenic river: Comparison of EPT ratios and chemical indices Scheib, Catherine A.; Morgan, Charles R.
1995|ECONOMIC-DEVELOPMENT VS SUSTAINABLE SOCIETIES - REFLECTIONS ON THE PLAYERS IN A CRUCIAL CONTEST CLARK, JG
2017|Using call playbacks to investigate a population of non-native midwife toads Alytes obstetricans ( Laurenti, 1768) in Cambridge, UK Allain, Steven J. R.; Goodman, Mark J.
2016|Effect of soil properties, heavy metals and emerging contaminants in the soil nematodes diversity Gutierrez, Carmen; Fernandez, Carlos; Escuer, Miguel; Campos-Herrera, Raquel; Beltran Rodriguez, Ma Eulalia; Carbonell, Gregoria; Rodriguez Martin, Jose Antonio
2013|Nutrient stoichiometry, species traits, and regime shifts in freshwater ponds Mccann, M. J.
2013|INVASIVE SPECIES Klassen, Greg
2011|Linking livelihood and ecosystem vulnerability in Southern Africa: Consequences for conservation and development Shackleton, S.
2010|Bioremediation-can we characterize the whole community involved and establish its real degradative potential? Mackova, Martina; Uhlik, Ondrej; Musilova, Lucie; Stursa, Petr; Hroudova, Miluse; Macek, Tomas
2010|Do Fertilizers Help in Effective Bioremediation of Polycyclic Aromatic Hydrocarbons in Polar Soils? Delille, Daniel; Pelletier, Emilien; Coulon, Frederic
2008|A Critical Review of 2008 Environmental Performance Index: Validity and Reliability of EPI Model Cha, Yong-Jin
2007|Insects and other invertebrate predators Mogi, Motoyoshi
1997|The changing state of the Benguela Current Large Marine Ecosystem O'Toole, Michael J.
1995|Liming of surface waters in Sweden - A synthesis Henrikson, Lennart; Brodin, Y.-W.
2016|Tibetan wildlife hemmed in Ji, Weihong; Aryal, Achyut; Su, Junhu
2014|Stable isotope probing and imaging mass spectrometry to link identity and function of microbes in complex assemblages Mayali, Xavier
2014|Summarized results for a General Linear Model explaining the number of infectious diseases with epidemics (total, zoonotic and vector-borne) in Asia-Pacific. Jittapalapong, Sathaporn; Suputtamongkol, Yupin; Huan, Tan Boon; Abdullah, Mohd Tajuddin; Morand, Serge
2013|Improving Urban Ecosystems Resilience at a City Level. The Coimbra Case Study. Ferreira, Antonio J. D.; Pardal, Joao; Malta, Miguel; Ferreira, Carla S. S.; Soares, Daniel D. J.; Vilhena, Jose
2011|Towards the sustainable management of parthenium weed (Parthenium hysterophorus L.) under a changing climate: An international collaborative approach Adkins, W.; O'Donnell, C.; Khan, N.; Nguyen, T.; Khan, I.; Shabbir, A.; Dhileepan, K.; George, D.; Hanif, Z.; Toh, R.; Garcia, A. Belgeri; Navie, S.; Strathie, L.; McConnachie, A.; Nigatu, L.; Hassan, G.; Nasim, G.; Mersie, W.
2011|USING MACROALGAE TO TRACK ENVIRONMENTAL CHANGES IN THE GREAT BAY ESTUARINE SYSTEM Nettleton, J. C.; Neefus, C. D.; Mathieson, A. C.
2011|BAYOU-DIVERSITY Nature and People in the Louisiana Bayou Country EPILOGUE Ouchley, Kelby
2010|Compelling Science Saves a River Valley Hauer, F. Richard; Muhlfeld, Clint C.
2010|GeoChip-based Analysis of Groundwater Microbial Diversity in Norman Landfill Lu, Z.; He, Z.; Parisi, V.; Kang, S.; Deng, Y.; Van Nostrand, J. D.; Masoner, J.; Cozzarelli, I.; Suflita, J.; Zhou, J.
2009|ENVR 74-Impact of nanoscale zero-valent iron treatment on the geochemistry and microbial diversity of trichloroethylene contaminated aquifers Kirschling, Teresa L.; Minkley, Edwin G., Jr.; Lowry, Gregory V.; Tilton, Robert D.
1994|Predicting the fate of temperate species in response to human disturbance and global change Thompson, Ken
1993|PROBLEMS WITH BIOTIC INVASIVES - A BIOLOGISTS VIEWPOINT WAGNER, WH
1992|CHEMICAL PROSPECTING - HOPE FOR VANISHING ECOSYSTEMS ROBERTS, L
2015|Variations on a Theme Buckland, Stephen T.; Rexstad, Eric A.; Marques, Tiago A.; Oedekoven, Cornelia S.
2015|MICROALGAL BIOFILMS ON COMMON YEWNEEDLES IN RELATION TO ANTHROPOGENIC AIR POLLUTION IN URBAN PRAGUE, CZECH REPUBLIC Zelena, Radka; Neustupa, Jiri
2014|Overview of seven studies with at least 5,000 birds collected over at least five sampling events. Parmley, Jane; Hansbro, Phillip M; Leighton, Frederick; Gilbert, Martin; Soos, Catherine; Latorre-Margalef, Neus; Munster, Vincent; Joly, Damien; Hall, Jeffrey S; Olson, Sarah H
2009|Functional Genes Influenced by Applied Voltage and Startup Type in Microbial Electrolysis Cell (MEC) Liu, W.; Wang, A.; Cheng, S.; Logan, B. E.; Yu, H.; Wu, L.; He, Z.; Zhou, J.
2008|The taphonomist's corner Cruz, Isabel
2006|Recovery and sanitary selection of local vines of the Sardinia Prota, Vanda A.; Sechi, Aimone; Tolu, Giovanni; Garau, Raimondo; Prota, Ulisse
2004|Short term species dynamics and long term recolonization of soil in agroecosystems. Adl, Sina M.; David, Coleman C.
2004|Bacterial diversity in an oil-contaminated subarctic soil Garron, J. I.; Budsberg, K. J.; Braddock, J. F.
2004|Modeling land cover change from land use and landscape pattern in an urban environment. Hepinstall, Jeffrey A.; Alberti, Marina; Coe, Stefan E.
2004|Is there a species-area relationship for bacteria? Horner-Devine, M. Claire; Lage, Melissa D.; Bohannan, Brendan J. M.; Hughes, Jennifer B.
2000|Hydrological alterations and marine biogeochemistry: A silicate issue? Ittekkot, V; Humborg, C; Schafer, P
2015|Assessing the Impacts of Nitrogen Deposition on Plant Species Richness in Europe Hettelingh, Jean-Paul; Stevens, Carly J.; Posch, Maximilian; Bobbink, Roland; de Vries, Wim
2014|Comparisons of the Microbial Community Structure of Coffea arabica and C. canephora Seeds Gardener, B. McSpadden; Vaughan, M.
2013|Species loss on spatial patterns and composition of zoonotic parasites Harris, Nyeema C.; Dunn, Robert R.
2011|Diversity of vegetative compatibility groups in Michigan populations of the chestnut blight fungus, Cryphonectria parasitica, 1996 to 2009 Springer, J. C.; Chansler, M. T.; Baines, A. L. Davelos; Jarosz, A. M.
2011|WILDLIFE, HUNTING AND SOCIETY Soye, Yves le Floc'h
2010|Effect of dietary protein content on cecal microbial ecosystem and mortality of young rabbits Chamorro, S.; Carabano, R.; Garcia, J.; Badiola, I.; Mateos, G. G.; de Blas, C.
2009|Effects of Chromate on Soil Microbial Community Structure and Function Thieman, S. B.; McCarthy, A. T.; Rudisill, M. A.; Wickham, G. S.; Thompson, D. K.
2007|Do fungal mutualists alter dominance and invasibility of dune plant communities? Emery, Sarah M.; Rudgers, Jennifer A.; Thompson, Desiree
2006|Infinite nature Hull, R. Bruce
2003|[Current status and index of vulnerability of the Sainte-Croix area, Quebec, Canada.] Tomat, Stephane; Handani, Yvette; Jaouich, Alfred
2003|Diversity of benzene-degrading bacteria in a contaminated sandstone aquifer. Fahy, A.; Ball, A. S.; McGenity, T. J.; Hart, A. J.; Timmis, K. N.
1992|THE DILEMMA OF THE AMAZON RAIN FORESTS BIOLOGICAL RESERVE OR EXPLOITABLE RESOURCE? PRANCE G T
2014|Global citizenship is key to securing global health: The role of higher education Comment Stoner, Lee; Perry, Lane; Wadsworth, Daniel; Stoner, Krystina R.; Tarrant, Michael A.
