2016|Making ecosystem services part of business as usual in federal governance Polefka, Shiva; Sutton-Grier, Ariana E.
2014|Establishment of Priority Forest Areas Based on Hydrological Ecosystem Services in Northern Vietnam Kong,, In-hye; Lee, DongKun
2007|Ecosystem services: The promise and peril of the approach Daily, Gretchen C.
2014|Integrating ecosystem-service tradeoffs into environmental flows decisions for Baiyangdian Lake Yang, Wei; Yang, Zhifeng
2014|The use of ecosystem services information by the US national estuary programs Martin, Lawrence
2014|Data from: The relevance of ecological status to ecosystem functions and services in a large boreal lake Tolonen, Kimmo T; Hamalainen, Heikki; Lensu, Anssi; Merilainen, Jarmo J; Palomaki, Arja; Karjalainen, Juha
2013|The environmental impacts of megacities on the coast Bruns, Antje
2012|Data from: Temperature-dependent, behavioral, and transcriptional variability of a tritrophic interaction consisting of bean, herbivorous mite, and predator Ozawa, Rika; Nishimura, Osamu; Yazawa, Shigenobu; Muroi, Atsushi; Takabayashi, Junji; Arimura, Gen-Ichiro
2012|Ecosystem Services - What Are the Opportunities They Present for Forest Management and Research? Peyron, Jean-Luc
2012|The Architecture and Measurement of an Ecosystem Services Index Banzhaf, H. Spencer; Boyd, James
2012|The Changing Importance of Ecosystem Services across the Landscape Gradient Wolf, Kathleen L.
2008|Questioning the ecosystem services argument for biodiversity conservation Ridder, Ben
2003|Discussion on freshwater ecosystem service and its evaluation index system. Cai Qinghua; Tang Tao; Deng Hongbing
2017|Ecosystem services to enhance sustainable forest management in the US: moving from forest service national programmes to local projects in the Pacific Northwest Deal, Robert L.; Smith, Nikola; Gates, Joe
2015|ANALYSIS ON THE DYNAMIC CHANGES IN A REGIONAL ECOSYSTEM AND EVALUATION OF ITS SERVICE VALUES BASED ON REMOTE SENSING Wang, Shi-dong; Zhang, He-bing; Wang, Xin-chuang
2011|Participatory Scenario Planning for Protected Areas Management under the Ecosystem Services Framework: the Donana Social-Ecological System in Southwestern Spain Palomo, Ignacio; Martin-Lopez, Berta; Lopez-Santiago, Cesar; Montes, Carlos
2010|Applied (meta)community ecology: diversity and ecosystem services at the intersection of local and regional processes Bengtsson, Janne
2004|Value of the world's ecosystem services and natural capital datasets Costanza, Robert
2003|On the scarcity value of ecosystem services Batabyal, AA; Kahn, JR; O'Neill, RV
2002|How much to restore: Economics of ecosystem services Roughgarden, Joan E.
2012|Ecosystem Services - Old Wine in New Bottles or an Incentive for German Landscape Planning? Albert, Christian; von Haaren, Christina; Galler, Carolin
2016|Geospatial distribution of ecosystem services and biomass energy potential in eastern Japan Ooba, Makoto; Fujii, Minoru; Hayashi, Kiichiro
2016|Towards a consideration of diversity, institutional arrangements and practices in the analysis of payments for environmental services Froger, Geraldine; Meral, Philippe; Muradian, Roldan
2016|Bioenergy Crops: Delivering More Than Energy Negri, M. Cristina; Ssegane, Herbert
2015|Untitled van Oudenhoven, Alexander P. E.; Schroter, Matthias; de Groot, Rudolf
2015|galls and parasitoids Henri, Dominic C; Jones, Owen; Tsiattalos, Ariana; Thebault, Elisa; Seymour, Colleen L; Van Veen, Frank FJ
2015|Census (resub) Henri, Dominic C; Jones, Owen; Tsiattalos, Ariana; Thebault, Elisa; Seymour, Colleen L; Van Veen, Frank FJ
2015|Spatiotemporal data on multiple ecosystem services Renard, Delphine
2015|Scheper et al_J Appl Ecol_bee, flower & landscape data Scheper, Jeroen; Bommarco, Riccardo; Holzschuh, Andrea; Potts, Simon G; Riedinger, Verena; Roberts, Stuart PM; Rundlof, Maj; Smith, Henrik G; Steffan-Dewenter, Ingolf; Wickens, Jennifer B; Wickens, Victoria J; Kleijn, David
2015|Scheper et al_J Appl Ecol_red listed bees Scheper, Jeroen; Bommarco, Riccardo; Holzschuh, Andrea; Potts, Simon G; Riedinger, Verena; Roberts, Stuart PM; Rundlof, Maj; Smith, Henrik G; Steffan-Dewenter, Ingolf; Wickens, Jennifer B; Wickens, Victoria J; Kleijn, David
2014|Marine Historical Ecology Informing the Future by Learning from the Past Lotze, Heike K.; McClenachan, Loren
2013|trapnest landscape data Fabian, Yvonne; Sandau, Nadine; Bruggisser, Odile T; Aebi, Alexandre; Kehrli, Patrik; Rohr, Rudolf P; Naisbit, Russell E; Bersier, Louis-Felix
2013|Climate change and urban biodiversity vulnerability. Solecki, William; Marcotullio, Peter J.
2010|Assessment on Water Ecosystem Services in the Songhua River Basin by AHP Method Zi, Tang
2014|Valuing ecosystem services from Maryland forests using environmental accounting Campbell, Elliott T.; Tilley, David R.
2016|The Future of Ecosystem Services in Asia and the Pacific Kubiszewski, Ida; Anderson, Sharolyn J.; Costanza, Robert; Sutton, Paul C.
2015|Soil Biodiversity and the Environment Nielsen, Uffe N.; Wall, Diana H.; Six, Johan
2013|Variability in ecosystem service measurement: a pollination service case study Liss, Kate N.; Mitchell, Matthew G. E.; MacDonald, Graham K.; Mahajan, Shauna L.; Methot, Josee; Jacob, Aerin L.; Maguire, Dorothy Y.; Metson, Genevieve S.; Ziter, Carly; Dancose, Karine; Martins, Kyle; Terrado, Marta; Bennett, Elena M.
2013|Payments for ecosystem services and the fatal attraction of win-win solutions Muradian, R.; Arsel, M.; Pellegrini, L.; Adaman, F.; Aguilar, B.; Agarwal, B.; Corbera, E.; de Blas, D. Ezzine; Farley, J.; Froger, G.; Garcia-Frapolli, E.; Gomez-Baggethun, E.; Gowdy, J.; Kosoy, N.; Le Coq, J. F.; Leroy, P.; May, P.; Meral, P.; Mibielli, P.; Norgaard, R.; Ozkaynak, B.; Pascual, U.; Pengue, W.; Perez, M.; Pesche, D.; Pirard, R.; Ramos-Martin, J.; Rival, L.; Saenz, F.; Van Hecken, G.; Vatn, A.; Vira, B.; Urama, K.
2013|A Study on the Forest Classification for Ecosystem Services Valuation  - Focused on Forest Type Map and Landcover Map - Jeon, Seongwoo
2012|Variation in ecosystem services value in a typical mountain town, Liaohe watershed, China Zhao, Xiaofan; Zhang, Chao; Dai, Limin; Lian, Dongben; Wang, Ning
2016|Implications of land cover change on ecosystems services and people's dependency: A case study from the Koshi Tappu Wildlife Reserve, Nepal Chaudhary, Sunita; Chettri, Nakul; Uddin, Kabir; Khatri, Top B.; Dhakal, Maheshwar; Bajracharya, Birendra; Ning, Wu
2015|Digging Deeper: A Case Study of Farmer Conceptualization of Ecosystem Services in the American South Quinn, Courtney E.; Quinn, John E.; Halfacre, Angela C.
2014|Multiple ecosystem services, possible trade-offs and synergies in a temperate forest ecosystem in Mexico: a review Galicia, Leopoldo; Esmeralda Zarco-Arista, Alba
2014|Economic valuation of ecosystem services fails to capture biodiversity value of tropical forests Carrasco, L. R.; Nghiem, T. P. L.; Sunderland, T.; Koh, L. P.
2016|The state of legislation and policy protecting Australia's mangrove and salt marsh and their ecosystem services Rogers, Kerrylee; Boon, Paul I.; Branigan, Simon; Duke, Norman C.; Field, Colin D.; Fitzsimons, James A.; Kirkman, Hugh; Mackenzie, Jock R.; Saintilan, Neil
2013|Measuring ecosystem service change: A case study from a northwest Arkansas dairy farm Leh, Mansoor; Matlock, Marty; Cummings, Eric; Thoma, Greg; Cothren, Jackson
2012|Incorporating indirect ecosystem services into marine protected area planning and management Rees, Sian E.; Austen, Melanie C.; Attrill, Martin J.; Rodwell, Lynda D.
2015|Ecosystem Services Flows: Why Stakeholders' Power Relationships Matter Felipe-Lucia, Maria R.; Martin-Lopez, Berta; Lavorel, Sandra; Berraquero-Diaz, Luis; Escalera-Reyes, Javier; Comin, Francisco A.
2017|Integrating ecosystem services in terrestrial conservation planning Yuan, Mei-Hua; Lo, Shang-Lien; Yang, Chih-Kai
2016|Demand and supply of ecosystem services in a Mediterranean forest: Computing payment boundaries Gorriz-Mifsud, Elena; Varela, Elsa; Pique, Miriam; Prokofieva, Irina
2017|Data for manuscript "Spatial Planning for a Green Economy: National-level Hydrologic Ecosystem Services Priority Areas for Gabon" Goldstein, Joshua
2013|Climate change's impact on key ecosystem services and the human well-being they support in the US Nelson, Erik J.; Kareiva, Peter; Ruckelshaus, Mary; Arkema, Katie; Geller, Gary; Girvetz, Evan; Goodrich, Dave; Matzek, Virginia; Pinsky, Malin; Reid, Walt; Saunders, Martin; Semmens, Darius; Tallis, Heather
2018|People or place? Neighborhood opportunity influences community garden soil properties and soil-based ecosystem services (vol 14, pg 32, 2017) Egerer, M.; Philpott, S.; Liere, H.; Jha, S.; Bichier, P.; Lin, B.
2015|Trade-offs between supportive and provisioning ecosystem services of forage species in marine food webs (vol 24, pg 1543, 2014) Essington, T. E.; Munch, S. B.
2015|Education of herdsmen&#8217;s children. Zhang, Xinshi; Kang, Muyi; Dong, Xiaobin; Na, Risu; Dai, Guangshuo; Ulgiati, Sergio; Wang, Xuechao
2013|A blueprint for mapping and modelling ecosystem services Crossman, Neville D.; Burkhard, Benjamin; Nedkov, Stoyan; Willemen, Louise; Petz, Katalin; Palomo, Ignacio; Drakou, Evangelia G.; Martin-Lopez, Berta; McPhearson, Timon; Boyanova, Kremena; Alkemade, Rob; Egoh, Benis; Dunbar, Martha B.; Maes, Joachim
2013|Linking ecosystem processes and ecosystem services Fu, Bojie; Wang, Shuai; Su, Changhong; Forsius, Martin
2018|A framework for assessing urban greenery's effects and valuing its ecosystem services Andersson-Skold, Yvonne; Klingberg, Jenny; Gunnarsson, Bengt; Cullinane, Kevin; Gustafsson, Ingela; Hedblom, Marcus; Knez, Igor; Lindberg, Fredrik; Sang, Asa Ode; Pleijel, Hakan; Thorsson, Pontus; Thorsson, Sofia
2013|Assessment of Forest Ecosystem Services Value of the National and Provincical Nature Reserves in Yunnan Province Hua Chao-Lang; Yang Dong; Zhao Yuan-Fan; Wen Qing-Zhong; Tao Jing; Song Jin-Xin; Deng Xi-Qing; Bi Yan-Ling
2013|Ecosystem services, NDVI, and national reporting: matches and mismatches Pettorelli, Nathalie
2012|Environmental Impact Assessment, ecosystems services and the case of energy crops in England Coleby, Alastor M.; van der Horst, Dan; Hubacek, Klaus; Goodier, Chris; Burgess, Paul J.; Graves, Anil; Lord, Richard; Howard, David
2009|Eco-environmental effects of land use change in Changwu County of Shannxi Province Bian Liang; Hu Zhi-bin; Song Wei-dong
2017|Managing Multiple Catchment Demands for Sustainable Water Use and Ecosystem Service Provision Stosch, Kathleen C.; Quilliam, Richard S.; Bunnefeld, Nils; Oliver, David M.
2012|A Study on the Contexts of Ecosystem Services in the Policymaking Process Lee, DongKun; Jung, Tae-Yong
2015|Ecosystem services lost to oil and gas in North America Allred, Brady W.; Smith, W. Kolby; Twidwell, Dirac; Haggerty, Julia H.; Running, Steven W.; Naugle, David E.; Fuhlendorf, Samuel D.
2013|Synthesis van der Putten, Wim H.; Ritz, Karl
2012|Paying for Tibet's Environmental-Ecosystem Services Wang Qiang; Chen Xi; Yang Degang; Wang Changjian
2012|The Forest Owner or Manager Confronted with Payment for Ecosystem Services Roman-Amat, Bernard
2012|Ecosystem Services - Between Exploration of Ecosystem Functioning and Monetisation. Report from Workshop 1 Teyssedre, Anne; Landmann, Guy; Voreux, Christophe
2016|The challenges of implementing a legal framework for Payment for Ecosystem Services in Santa Catarina, Brazil Alarcon, Gisele Garcia; dos Santos de Freitas, Luis Antonio; da Fountoura, Glauber Oliveira; de Macedo, Carolina Ximenes; Ribeiro, Daniel Casarin
2016|MOESM5 of What evidence exists for the effectiveness of on-farm conservation land management strategies for preserving ecosystem services in developing countries? A systematic map Thorn, Jessica; Friedman, Rachel; Benz, David; Willis, Kathy; Petrokofsky, Gillian
2015|Climate change impacts on freshwater fish, coral reefs, and related ecosystem services in the United States (vol 131, pg 143, 2015) Lane, Diana; Jones, Russell; Mills, David; Wobus, Cameron; Ready, Richard C.; Buddemeier, Robert W.; English, Eric; Martinich, Jeremy; Shouse, Kate; Hosterman, Heather
2015|Reconceptualizing ecosystem services: Possibilities for cultivating and valuing the ethics and practices of care Jackson, Sue; Palmer, Lisa R.
2015|Towards ecosystem accounting: a comprehensive approach to modelling multiple hydrological ecosystem services Duku, C.; Rathjens, H.; Zwart, S. J.; Hein, L.
2014|A Classification of Landscape Services to Support Local Landscape Planning Valles-Planells, Maria; Galiana, Francisco; Van Eetvelde, Veerle
2013|A Methodology to Map Ecosystem Functions to Support Ecosystem Services Assessments Petter, Mik; Mooney, Shannon; Maynard, Simone M.; Davidson, Andrew; Cox, Melanie; Horosak, Ila
2013|Matrix showing the published assessments of marine and coastal ecosystem services (MCES) and the habitats where they were measured. Piroddi, Chiara; Katsanevakis, Stelios; Liquete, Camino; Drakou, Evangelia G; Gurney, Leigh; Charef, Aymen; Egoh, Benis
2011|Ecosystem services: Exploring a geographical perspective Potschin, Marion B.; Haines-Young, Roy H.
2011|The Role of Ecosystem Services in Contemporary Urban Planning Colding, Johan
2011|A review of the ecosystem services provided by broad-scale marine habitats in England's MPA network Fletcher, S.; Saunders, J.; Herbert, R. J. H.
2010|Social-ecological memory in urban gardens-Retaining the capacity for management of ecosystem services Barthel, Stephan; Folke, Carl; Colding, Johan
2016|Current overview and potential applications of the soil ecosystem services approach in Brazil Prado, Rachel Bardy; Cardoso Fidalgo, Elaine Cristina; Guimaraes Monteiro, Joyce Maria; Schuler, Azeneth Eufrausino; Vezzani, Fabiane Machado; Garcia, Junior Ruiz; de Oliveira, Aline Pacobayba; Moreira Viana, Joao Herbert; Carvalho Gomes Pedreira, Bernadete da Conceicao; Mendes, Leda de Carvalho; Reatto, Adriana; Parron, Lucilia Maria; Clemente, Eliane de Paula; Donagemma, Guilherme Kangussu; Dias Turetta, Ana Paula; Simoes, Margareth
2014|Forest fragments modulate the provision of multiple ecosystem services Mitchell, Matthew G. E.; Bennett, Elena M.; Gonzalez, Andrew
2016|The provision of ecosystem services in response to global change: Evidences and applications Lafortezza, Raffaele; Chen, Jiquan
2015|A background of forests functions as a part of ecosystem services systems Schneider, Jiri; Vyskot, Ilja; Lorencova, Helena; Lampartova, Ivana
2015|Evaluation of ecosystem services: A case study in the middle reach of the Heihe River Basin, Northwest China Li, Hongji; Li, Zhihui; Li, Zhaohua; Yu, Jing; Liu, Bing
2013|A spatially explicit method to examine the impact of urbanisation on natural ecosystem service values Li, Wenliang; Wu, Changshan
2017|A theoretical framework for researching cultural ecosystem service flows in urban agglomerations Lan Xiao; Tang Haiping; Liang Haoguang
2015|Measuring the economic value of pollination services: Principles, evidence and knowledge gaps Hanley, Nick; Breeze, Tom D.; Ellis, Ciaran; Goulson, David
2015|The manager dilemma: Optimal management of an ecosystem service in heterogeneous exploited landscapes Dubois, Laetitia; Mathieu, Jerome; Loeuille, Nicolas
2009|Evaluation of resource exploitation value and ecosystem service loss in Mentougou District of Beijing City Liu Xu-sheng; Li Feng; Zhao Dan; Wang Bei-bei
2013|Beyond monetary measurement: How to evaluate projects and policies using the ecosystem services framework Sijtsma, Frans J.; van der Heide, C. Martijn; van Hinsberg, Arjen
2011|Recommendation for land use impact assessment: first steps into framework, theory, and implementation Bare, Jane
2009|Ecosystem services and valuation of urban forests in China Jim, C. Y.; Chen, Wendy Y.
2006|Ecology for transformation Carpenter, Stephen R.; Folke, Carl
2017|THE IMPORTANCE OF MONEY AS A COMMON CURRENCY IN ECOSYSTEM SERVICE VALUATION-A COMMENT ON THE ROSKILDE WORKSHOP RECOMMENDATIONS FOR RISK ASSESSMENT Calow, Peter
2017|Ecosystem services can promote conservation over conversion and protect local biodiversity, but these local win-wins can be a regional disaster Faith, Daniel P.
2017|Conservation and development investments in the Corridor Ankeniheny-Zahamena (CAZ), Madagascar, 2007-2014 Tabor, K; Rasolohery, A; Ramanahadray, S; Rambeloson, A
2016|Effects of budget constraints on conservation network design for biodiversity and ecosystem services Remme, Roy P.; Schroeter, Matthias
2015|The Intergovernmental Platform on Biodiversity and Ecosystem Services gets profile (vol 24, pg 199, 2015) Zisenis, Marcus
2014|Introduction to the regional assessments: Climate change, wildfire, and forest ecosystem services in the USA Rocca, Monique E.; Miniat, Chelcy Ford; Mitchell, Robert J.
2013|[Application of ecosystem service value in land use change research: Bottlenecks and prospects]. Zhang, Zhou; Wu, Ci-Fang; Tan, Rong
2013|Influence on ecosystem service caused by soil and water conservation in Yanhe River Basin of the Loess Plateau, China Xie, Hongxia; Yang, Qinke; Li, Ri; Pang, Guowei; Duan, Jiannan; Zhou, Qing; Yuan, Hong
2012|The little things that run the world revisited: a review of ant-mediated ecosystem services and disservices (Hymenoptera: Formicidae) Del Toro, Israel; Ribbons, Relena R.; Pelini, Shannon L.
2007|Mapping and valuing ecosystem services: What do we know? What do we need to know? Polasky, Steve
2015|Ecosystem services provided by birds. Kazama, K.; Hino, T.
2015|Systematic review literature database Pascual, Marta; Giacomello, Eva; Perez-Minana, Elena
2013|Impacts of land change on biodiversity: making the link to ecosystem services Nagendra, Harini; Reyers, Belinda; Lavorel, Sandra
2017|Making research relevant? Ecological methods and the ecosystem services framework Root-Bernstein, Meredith; Jaksic, Fabian M.
2010|A framework for classifying and quantifying the natural capital and ecosystem services of soils Dominati, Estelle; Patterson, Murray; Mackay, Alec
2014|How good are tropical forest patches for ecosystem services provisioning? Ferraz, Silvio F. B.; Ferraz, Katia M. P. M. B.; Cassiano, Carla C.; Brancalion, Pedro Henrique S.; da Luz, Daniela T. A.; Azevedo, Thais N.; Tambosi, Leandro R.; Metzger, Jean Paul
2013|Spatial interactions among ecosystem services in an urbanizing agricultural watershed Qiu, Jiangxiao; Turner, Monica G.
2012|Managing ecosystem services and biodiversity conservation in agricultural landscapes: are the solutions the same? Macfadyen, Sarina; Cunningham, Saul A.; Costamagna, Alejandro C.; Schellhorn, Nancy A.
2009|Ecosystem service benefits of contrasting conservation strategies in a human-dominated region Eigenbrod, Felix; Anderson, Barbara J.; Armsworth, Paul R.; Heinemeyer, Andreas; Jackson, Sarah F.; Parnell, Mark; Thomas, Chris D.; Gaston, Kevin J.
2009|Conservation and the delivery of ecosystem services: a literature review. McAlpine, Kate G.; Wotton, Debra M.
2016|Ecosystem service status and changes of degraded natural reserves - A study from the Changbai Mountain Natural Reserve, China Yu, Dandan; Han, Shijie
2015|Valuing the ecosystem service changes from catchment restoration: A practical example from upland England Clarke, Stewart J.; Harlow, Julian; Scott, Alexandra; Phillips, Mark
2015|An Informatics Approach for Smart Evaluation of Water Quality Related Ecosystem Services Yan, Weigang; Hutchins, Mike; Loiselle, Steven; Hall, Charlotte
2013|Consequences of spatial heterogeneity for ecosystem services in changing forest landscapes: priorities for future research Turner, Monica G.; Donato, Daniel C.; Romme, William H.
2015|Marine ecosystem services: Perceptions of indispensability and pathways to engaging citizens in their sustainable use Blasiak, Robert; Yagi, Nobuyuki; Kurokura, Hisashi; Ichikawa, Kaoru; Wakita, Kazumi; Mori, Aimee
2013|Integrating Expert Knowledge into Mapping Ecosystem Services Trade-offs for Sustainable Forest Management Gret-Regamey, Adrienne; Brunner, Sibyl H.; Altwegg, Juerg; Christen, Marc; Bebi, Peter
2012|Public Participation GIS: A Method for Identifying Ecosystem Services Brown, Greg; Montag, Jessica M.; Lyon, Katie
2017|Brief history of the Brazilian Platform on Biodiversity and Ecosystem Services/BPBES Gorgulho Padgurschi, Maira de Campos; Joly, Carlos A.
2015|Self-Organising Map on ecosystem service distributions Crouzat, Emilie; Mouchet, Maud; Turkelboom, Francis; Byczek, Coline; Meersmans, Jeroen; Berger, Frederic; Verkerk, Pieter Johannes; Lavorel, Sandra
2014|Change of potential ecosystem services (decrease () and increase () greater than 10%) between practices in each category of grassland, for the drastic and local scenario (column D) and the intermittent and international scenario (column I) (data from [61]). Meyfroidt, Patrick; Lavorel, Sandra; Lamarque, Penelope; Nettier, Baptiste
2008|Sustainability, climate change and uncertainty Pijanowski, Bryan C.
2014|Trade-offs across value-domains in ecosystem services assessment Martin-Lopez, Berta; Gomez-Baggethun, Erik; Garcia-Llorente, Marina; Montes, Carlos
2000|Measuring the total economic value of restoring ecosystem services in an impaired river basin: results from a contingent valuation survey Loomis, J; Kent, P; Strange, L; Fausch, K; Covich, A
2015|Stakeholders' Preferences and Economic Value of Forest Ecosystem Services: an Example in the Italian Alps Grilli, Gianluca; Nikodinoska, Natasha; Paletto, Alessandro; De Meo, Isabella
2014|Land use changes and their effects on the value of ecosystem services in the small Sanjiang plain in China. Chen, Jing; Sun, Bo-Ming; Chen, Dan; Wu, Xin; Guo, Long-Zhu; Wang, Gang
2012|The ecosystem services agenda:bridging the worlds of natural science and economics, conservation and development, and public and private policy Braat, Leon C.; de Groot, Rudolf
2012|[Ecosystem service interactions and their affecting factors in Jinghe watershed at county level]. Pan, Ying; Zhen, Lin; Long, Xin; Cao, Xiao-Chang
2016|Linking soils to ecosystem services - A global review Adhikari, Kabindra; Hartemink, Alfred E.
2014|Multifunctionality and biodiversity: Ecosystem services in temperate rainforests of the Pacific Northwest, USA Brandt, Patric; Abson, David J.; DellaSala, Dominick A.; Feller, Robert; von Wehrden, Henrik
2005|Ecosystem service supply and vulnerability to global change in Europe Schroter, D; Cramer, W; Leemans, R; Prentice, IC; Araujo, MB; Arnell, NW; Bondeau, A; Bugmann, H; Carter, TR; Gracia, CA; de la Vega-Leinert, AC; Erhard, M; Ewert, F; Glendining, M; House, JI; Kankaanpaa, S; Klein, RJT; Lavorel, S; Lindner, M; Metzger, MJ; Meyer, J; Mitchell, TD; Reginster, I; Rounsevell, M; Sabate, S; Sitch, S; Smith, B; Smith, J; Smith, P; Sykes, MT; Thonicke, K; Thuiller, W; Tuck, G; Zaehle, S; Zierl, B
2017|Using Goal-Programming to Model the Effect of Stakeholder Determined Policy and Industry Changes on the Future Management of, and Ecosystem Services Provision by Ireland's Western Peatland Forests (vol 9, pg 11, 2017) Corrigan, E.; Nieuwenhuis, M.
2017|Opportunities for Smallholder Farmers to Benefit From Conservation Agricultural Practices Nhamo, Nhamo; Lungu, Olipa N.
2017|The simple but not-too-simple valuation of ecosystem services: basic principles and an illustrative example Simpson, R. David
2016|Trade-offs in water and carbon ecosystem services with land-use changes in grasslands (vol 26, pg 2769, 2016) Kim, John H.; Jobbagy, Esteban G.; Jackson, Robert B.
2016|Ecosystem Services and the Value of Places James, Simon P.
2015|Economics of ecosystem services: theoretical and methodological foundations Mishenin, Ye. V.; Degtyar, N. V.
2014|Ecosystem service measurements taken in three different grassland ecosystem types. Stein, Claudia; Suding, Katharine N; Hallett, Lauren M; Harpole, W Stanley
2013|EcoSummit 2012 and Ecohydrology & Hydrobiology Preface Mitsch, William J.
2012|Ethics of Species: An Introduction Sandler, RL
2011|Techniques for assessing the environmental outcomes of conservation practices applied to rangeland watersheds Weltz, Mark A.; Jolley, Leonard; Goodrich, Dave; Boykin, Ken; Nearing, Mark; Stone, Jeff; Guertin, Phil; Hernandez, Mariano; Spaeth, Ken; Pierson, Fred; Morris, Christo; Kepner, Bill
2011|Food webs and ecosystem services during soil transformations van Leeuwen, Jeroen P.; Hemerik, Lia; Bloem, Jaap; de Ruiter, Peter C.
2011|Putting ecosystem service models to work: conservation, management, and trade-offs Polasky, Stephen; Caldarone, Giorgio; Duarte, T. Ka'eo; Goldstein, Joshua; Hannahs, Neil; Ricketts, Taylor; Tallis, Heather
2016|Ecosystem Service Changes and Livelihood Impacts in the Maguri-Motapung Wetlands of Assam, India Bhatta, Laxmi D.; Chaudhary, Sunita; Pandit, Anju; Baral, Himlal; Das, Partha J.; Stork, Nigel E.
2017|CLASSIFICATION OF PUBLIC POLICIES RELATED WITH THE ECOSYSTEM SERVICES IN BRAZILIAN TERRITORY Benetti Leite, Michele; Martinez de Anguita, Pablo
2013|Linking ecosystem services to agri-environmental schemes through SEA: A case study from Northern Italy Rega, Carlo; Spaziante, Agata
2012|Ecosystem services: a useful concept for soil policy making! Breure, A. M.; De Deyn, G. B.; Dominati, E.; Eglin, T.; Hedlund, K.; Van Orshoven, J.; Posthuma, L.
2015|Estimating values of urban ecosystem services in Kladno Frelichova, J.; Partl, A.; Harmackova, Z.; Vackar, D.
2015|Benefit Transfer for Ecosystem Service Valuation: An Introduction to Theory and Methods Johnston, Robert J.; Wainger, Lisa A.
2016|Bayesian belief networks to analyse trade-offs among ecosystem services at the regional scale Landuyt, Dries; Broekx, Steven; Goethals, Peter L. M.
