2010|Ecosystem Services 
2008|Ecosystem services for sale [Anonymous]
1983|EXTINCTION, SUBSTITUTION, AND ECOSYSTEM SERVICES EHRLICH, PR; MOONEY, HA
2014|Ecosystem Services for Sustainability Quinn, Judy
2008|Ecosystem services for sale [Anonymous]
2013|Payment for ecosystem services Benjamin, A H
2002|Valuing ecosystem services Heal, G
2015|CAPACITY DEVELOPMENT Mueller, Eduard; Appleton, Michael R.; Ricci, Glenn; Valverde, Allan; Reynolds, David W.
2015|Ecosystem Service and Environmental Health. Spence, Porche L; Floyd, Minnjuan Flournoy; Howard, Joniqua; Simmons, Candice
1997|Valuing ecosystem services Salzman, J
2013|Insects and Sustainability of Ecosystem Services Schowalter, TD
2008|Ecosystem services - Does only count what costs? Daniel, Otto
2014|Payment for Ecosystem Services [Anonymous]
2001|Pricing biodiversity and ecosystem services Pimentel, D
2013|Soil Ecology and Ecosystem Services Mitchell, R.
1998|Ecosystem services and the law Salzman, J
2016|Political ecology of ecosystem services Daugeard, Marion
2017|Impact of Biological Invasions on Ecosystem Services 
2014|Valuing ecosystem services in macroeconomic settings Smith, Rodney B. W.; Gemma, Masahiko
2015|Data from: Historical dynamics of ecosystem services bundles Renard, Delphine; Rhemtulla, Jeanine M; Bennett, Elena M
2014|The Justices and Injustices of Ecosystem Services Morrow, Karen
2015|Spatiotemporal data on multiple ecosystem services Renard, Delphine
2014|Appendix S1 Moriniere, Jerome; Hendrich, Lars; Haszprunar, Gerhard; Hebert, Paul DN; Hausmann, Axel; Kohler, Frank; Balke, Michael
2013|Living Roofs and Ecosystem Services (c) Cooper, Zoe
2010|Indirect Use Value Primack, Richard B.
2009|Ecosystem services on the half-shell Pelley, Janet
2008|Ecosystem Services and the Green City Hirsch, Dennis D.
2013|Ecosystem services - essential but overlooked Ehrlich, Paul R.
2013|INSECTS and Sustainability of Ecosystem Services Preface Maser, Chris
2014|Agroforestry Systems in India: Livelihood Security & Ecosystem Services Preface Dagar, J. C.; Singh, A. K.; Arunachalam, A.
2014|Dataset Gaitan, Juan J; Bran, Donaldo; Oliva, Gabriel; Maestre, Fernando T; Aguiar, Martin R; Jobbagy, Esteban; Buono, Gustavo; Ferrante, Daniela; Nakamatsu, Viviana; Ciari, Georgina; Salomone, Jorge; Massara, Virginia
2011|Natural Capital: Theory & Practice of Mapping Ecosystem Services 
1998|Ecosystem services value, research needs, and policy relevance: a commentary Turner, RK; Adger, WN; Brouwer, R
2001|Pricing biodiversity and ecosystem services - Response Gatto, M; De Leo, G
2015|Ecosystem Services in Agricultural and Urban Landscapes Daigneault, Adam
2014|The justices and injustices of ecosystem services Lukasiewicz, Anna
2003|Forest ecosystem services as production inputs Pattanayak, SK; Butry, DT
2015|INTEGRATED GROUNDWATER RESOURCE MANAGEMENT Roumasset, James A.; Wada, Christopher A.
2013|Ecosystem Services. Concept, Methods and Case Studies Klink, Hans-Juergen
2011|Maintaining multifunctionality as landscapes provide ecosystem services Jarchow, Meghann E.; Liebman, Matt
2009|Ecosystem services - out of the wilderness? Ellison, Katherine
2010|Assessment of ecosystem services. Harrison, Paula A.; Luck, Gary W.; Feld, Christian K.; Sykes, Martin T.
2014|The Justices and Injustices of Ecosystem Services Kistenkas, Frederik H.
2016|Putting a Price on Ecosystem Services Simpson, R. David
2015|Ecosystem Services: From Concept to Practice 
1998|Introduction - Special section: Forum on valuation of ecosystem services - The value of ecosystem services Costanza, R
2017|Editorial - The future of Payments for Ecosystem Services in Cambodia. Simpson, Virginia; Souter, Nicholas J.
2013|Urban ecosystem services. Gomez-Baggethun, Erik; Gren, Asa; Barton, David N.; Langenmeyer, Johannes; McPhearson, Timon; O'Farrell, Patrick; Andersson, Erik; Hamstead, Zoe; Kremer, Peleg
2015|The classification of marine and coastal ecosystem services [2, 35, 36]. Chung, Min Gon; Kang, Hojeong; Choi, Sung-Uk
2014|Foreword: The importance of valuing ecosystem services Costanza, Robert
2014|Appendix S3 Moriniere, Jerome; Hendrich, Lars; Haszprunar, Gerhard; Hebert, Paul DN; Hausmann, Axel; Kohler, Frank; Balke, Michael
2016|Effects of bioenergy production on ecosystem services Clarke, Nicholas
2015|Editorial: Best practices for mapping ecosystem services Willemen, Louise; Burkhart, Benjamin; Crossman, Neville; Drakou, Evangelia G.; Palomo, Ignacio
2011|Quantitative approaches to ecosystem services assessment Scott, Marian; Smith, Ron; Dick, Jan
2006|Assessing ecosystem services to identify conservation priorities. Gross, Liza
2014|CO1-5P Alignments Moriniere, Jerome; Hendrich, Lars; Haszprunar, Gerhard; Hebert, Paul DN; Hausmann, Axel; Kohler, Frank; Balke, Michael
2014|Appendix S2 Moriniere, Jerome; Hendrich, Lars; Haszprunar, Gerhard; Hebert, Paul DN; Hausmann, Axel; Kohler, Frank; Balke, Michael
2012|ECOSYSTEM SERVICES Valuing ecosystems for climate Hungate, Bruce A.; Hampton, Haydee M.
1998|The value of ecosystem services: whose values? Opschoor, JB
1998|The value of ecosystem services: putting the issues in perspective Costanza, R; d'Arge, R; de Groot, R; Farber, S; Grasso, M; Hannon, B; Limburg, K; Naeem, S; O'Neill, RV; Paruelo, J; Raskin, RG; Sutton, P; van den Belt, M
2016|Ecosystem Services: From Biodiversity to Society, Pt 2 
2013|Nature's Wealth: The Economics of Ecosystem Services and Poverty 
2012|Solutions for sustaining natural capital and ecosystem services Burkhard, Benjamin; de Groot, Rudolf; Costanza, Robert; Seppelt, Ralf; Jorgensen, Sven Erik; Potschin, Marion
2009|Functional assessment of wetlands Towards evaluation of ecosystem services Foreword Maltby, Edward
2014|Can Ecosystem Services Thinking Help with Climate Change? Beardsley, Timothy M.
2014|Handbook on the Economics of Ecosystem Services and Biodiversity 
2016|Ethical issues Reid, Colin T.; Nsoh, Walters
2016|Integrating ecosystem service concepts into valuation and management decisions Hodges, Donald G.; Stirn, Lidija Zadnik; Grebner, Donald L.
2014|YESS - The network for Young Ecosystem Services Specialists Bohnke-Henrichs, Anne; Baulcomb, Corinne; Alam, Mahbubul; Rawlins, Maurice; Koss, Rebecca; Jobstvogt, Niels
2013|Urbanization forecasts, effects on land use, biodiversity and ecosystem services. Guneralp, Burak; McDonald, Robert I.; Fragkias, Michail; Goodness, Julie; Marcotullio, Peter J.; Seto, Karen C.
2010|Policies for Sustainable Governance of Global Ecosystem Services Patterson, Lynn M.
2017|Scientific Understanding of Ecosystem Services van den Belt, Marjan; Bernal, Patricio; Granek, Elise; Gaill, Francoise; Halpern, Benjamin; Thorndyke, Michael
2016|Ecosystem services in the Volta Basin Kizito, Fred; Balana, Bedru B.
2014|Ecosystem Services and Carbon Sequestration in the Biosphere Buckingham, S.
2013|Ecosystem services: climate change and policy impacts Editorial overview Fu, Bojie; Forsius, Martin; Liu, Jian
2016|Ecosystem Services now indexed in Thomson Reuters databases Braat, Leon C.
2015|Erratum: "Pollinator Power: Nutrition Security Benefits of an Ecosystem Service". [Anonymous]
2013|ECOSER 6th Volume: Special Issue on Payments for Ecosystem Services Braat, Leon C.
1999|The ecology of ecosystem services: introduction to the special issue Limburg, KE; Folke, C
2014|Agroforestry Systems in India: Livelihood Security & Ecosystem Services Foreword Nair, P. K. R.
2013|Editorial to the third volume of ecosystem services Braat, Leon C.
2015|MARINE CONSERVATION Notarbartolo-di-Sciara, Guiseppe
2002|Agriculture and ecosystem services Heal, GM; Small, AA
2013|Editorial to the fifth volume of ecosystem services Braat, Leon C.
2012|Eco-services and land-use policy Preface Viglizzo, Ernesto F.
2015|Ecosystem Services: From Biodiversity to Society, Pt 1 
2014|Financing water ecosystem services - Marta Echavarria and EcoDecision Henkel, Marianne; Lodemann, Justus
2005|Lyme disease: a case about ecosystem services Richmond, C; Ebert-May, D; Hodder, J
2016|Social valuation of ecosystem services in mountain regions Walz, Ariane; Gret-Regamey, Adrienne; Lavorel, Sandra
2012|Biodiversity and Ecosystem Services Have a Role in Climate Adaptation Andersen, Inger
2011|Research on fire and ecosystem services must incorporate climate realities Bartolome, James W.; Moritz, Max A.
2017|Physical and Economic Processes of Ecosystem Services Flows Su, Hongbo; Nagarajan, Sudhagar; Dong, Jinwei
2015|Ecosystem Services: What's Nature-Including Humans-Got to Offer? Krasny, Marianne E.; Tidball, Keith G.
2014|Environmental Policy and Issues in Nigeria Offiong, Offiong J.; Dibie, Robert
2010|Analytical Tools for the Environment-Economy Interaction Ekins, Paul
2010|Ecosystem services and poverty alleviation: assessing the constraints and opportunities Martin, Adrian; Blowers, Andrew; Boersema, Jan
2008|The theoretical model for quantifying the value of ecosystem services Zhao, Sheng; Wu, Changwen; Hong, Huasheng; Wang, Weiping
2014|Ecosystem services provided by mangroves sorted according to their mean economic values (2007 Int$/ha*yr). Dahdouh-Guebas, Farid; Sutherland, William J; Koedam, Nico; Mukherjee, Nibedita; Dicks, Lynn; Huge, Jean
2016|Alpine Ecosystem Services - mapping, maintenance and management (AlpES) [Anonymous]
2016|Ecosystem services provided by scavengers. DeVault, Travis L.; Beasley, James C.; Olson, Zachary H.; Moleon, Marcos; Carrete, Martina; Margalida, Antoni; Sanchez-Zapata, Jose Antonio
2015|Biodiversity offsets as market-based instruments for ecosystem services? Froger, Geraldine; Hrabanski, Marie
2015|Biodiversity and ecosystem services: Not all positive Sandbrook, Chris G.; Burgess, Neil D.
2015|Ecosystem Services: From Biodiversity to Society, Part 1 PREFACE Bohan, David; Pocock, Michael J. O.; Woodward, Guy
2014|Payment for ecosystem services for water - case of Cauvery Chandrakanth, M. G.; Nagaraja, M. G.
2010|Ecological Economics and Direct Use Values Primack, Richard B.
2015|Ecosystem Services: From Biodiversity to Society, Part 1. 
2016|NEW YORK CITY'S PAYMENT FOR ECOSYSTEM SERVICES Providing clean water for millions Purinton, Tim; LeGree, Marina
2015|GREENING THE OCEAN ECONOMY A progress report Pendleton, Linwood; Jungwiwattanaporn, Megan; Beaudoin, Yannick; Neumann, Christian; Solgaard, Anne; Cavaliere, Christina; Baker, Elaine
2014|Direct PCR Datasheet Wong, Wing Hing; Tay, Ywee Chieh; Puniamoorthy, Jayanthi; Balke, Michael; Cranston, Peter S; Meier, Rudolf
2010|Ecosystem Services and Conservation: a Reply to Skroch and Lopez-Hoffman Adams, William M.; Redford, Kent H.
2007|Linking ecosystem services to well-being: A case study of Aboriginal communities in northern Australia Kaur, Kamaijit
2017|DRIVERS AND SOCIAL CONTEXT Acreman, Mike; Jain, Sharad K.; McCartney, Matthew P.; Overton, Ian
2013|INSECTS and Sustainability of Ecosystem Services Series Preface Maser, Chris
2001|Ecological economic theory for managing ecosystem services Roughgarden, J; Armsworth, RR
2017|Why Birds Matter: Ecological Function and Ecosystem Services Holden, Madronna
2017|Impact of Biological Invasions on Ecosystem Services Preface Vila, Montserrat; Hulme, Philip E.
2009|SLR and ecosystem services: a response to Kirwan and Guntenspergen Craft, Christopher; Pennings, Steve; Clough, Jonathan; Park, Richard; Ehman, Jeff
2007|Comment on "Impacts of biodiversity loss on ocean ecosystem services" Jaenike, John
2011|Incorporating ecosystem services in decisions McKenzie, Emily; Irwin, Frances; Ranganathan, Janet; Hanson, Craig; Kousky, Carolyn; Bennett, Karen; Ruffo, Susan; Conte, Marc; Salzman, James; Paavola, Jouni
2014|The Ethics of Climate Change Mitigation Sandler, Ronald
2012|Commentary: Developing sustainable farming systems by valuing ecosystem services Goulding, Keith; Whitmore, Andy
2009|Functional assessment of wetlands Towards evaluation of ecosystem services Preface Maltby, Edward
2005|Ecosystem services provided by oyster reefs: An experimental assessment. [Anonymous]
2014|Overview of the ecosystem service datasets analysed in this study. Schulp, Catharina J E; Burkhard, Benjamin; Maes, Joachim; Van Vliet, Jasper; Verburg, Peter H
2016|Ecosystem Services: From Biodiversity to Society, Part 2 PREFACE Bohan, David A.; Pocock, Michael J. O.; Woodward, Guy
2014|Ecosystem service categories identified by the mangrove Delphi, grouped according to the Common International Classification of Ecosystem Services (CICES) v4.3 (http://cices.eu/). Dahdouh-Guebas, Farid; Sutherland, William J; Koedam, Nico; Mukherjee, Nibedita; Dicks, Lynn; Huge, Jean
2002|Forest ecosystem services and protection in Dayaoshan Luo Zhi-jun; Zheng Hong-bo
2014|Technocratic and Economic Ideals in the Ecosystem Services Discourse Turnhout, Esther; Waterton, Claire; Neves, Katja; Buizer, Marleen
2017|Greening Cities Forms and Functions Concluding Remarks Tan, Puay Yok; Jim, Chi Yung
2014|Valuing Ecosystem Services Methodological Issues and Case Studies Preface Ninan, K. N.
2012|The Ecosystem Services Partnership (ESP) 5th Annual Conference Costanza, Robert; Kubiszewski, Ida
2011|Incorporating Ecosystem Services Into Life Cycle Assessment Bakshi, Bhavik; Small, Mitchell J.
2006|Water crisis and multifunctionality/ecosystem services - meeting the challenge Hatcho, Nobumasa
2012|Studies analyzing social perceptions of ecosystem services. Oteros-Rozas, Elisa; Santos-Martin, Fernando; Palomo, Ignacio; Garcia-Llorente, Marina; Onaindia, Miren; Palacios-Agundez, Igone; Casado-Arzuaga, Izaskun; Martin-Lopez, Berta; Lopez-Santiago, Cesar; Willaarts, Barbara; Amo, David Garcia Del; Montes, Carlos; Iniesta-Arandia, Irene; Gonzalez, Jose A; Gomez-Baggethun, Erik
2013|Mapping and modelling ecosystem services for science, policy and practice Burkhard, Benjamin; Crossman, Neville; Nedkov, Stoyan; Petz, Katalin; Alkemade, Rob
2018|Assessing nature's contributions to people Diaz, Sandra; Pascual, Unai; Stenseke, Marie; Martin-Lopez, Berta; Watson, Robert T.; Molnar, Zsolt; Hill, Rosemary; Chan, Kai M. A.; Baste, Ivar A.; Brauman, Kate A.; Polasky, Stephen; Church, Andrew; Lonsdale, Mark; Larigauderie, Anne; Leadley, Paul W.; van Oudenhoven, Alexander P. E.; van der Plaat, Felice; Schroter, Matthias; Lavorel, Sandra; Aumeeruddy-Thomas, Yildiz; Bukvareva, Elena; Davies, Kirsten; Demissew, Sebsebe; Erpul, Gunay; Failler, Pierre; Guerra, Carlos A.; Hewitt, Chad L.; Keune, Hans; Lindley, Sarah; Shirayama, Yoshihisa
2017|Special Issue: "Maintaining Ecosystem Services to Support Urban Needs" Grunewald, Karsten; Bastian, Olaf
2014|Agroforestry Systems in India: Livelihood Security & Ecosystem Services 
2013|Urbanization and global trends in biodiversity and ecosystem services. McDonald, Robert I.; Marcotullio, Peter J.; Guneralp, Burak
2009|Functional assessment of wetlands Towards evaluation of ecosystem services Introduction Maltby, Edward
2014|Agreement between ecosystem service maps and independent maps. Schulp, Catharina J E; Burkhard, Benjamin; Maes, Joachim; Van Vliet, Jasper; Verburg, Peter H
2017|Why Birds Matter: Avian Ecological Function and Ecosystem Services Mainwaring, Mark C.
2017|Impact of Biological Invasions on Ecosystem Services Foreword Dias, Braulio Ferreira de Souza
2013|Breaking the ground El Serafy, Salah
2016|Guidance for the rapid assessment of cultural ecosystem services Anthem, Helen; Infield, Mark; Morse-Jones, Sian
2007|Comment on "Impacts of biodiversity loss on ocean ecosystem services" Wilberg, Michael J.; Miller, Thomas J.
2005|Nature for water: Ecosystem services and water management Enderlein, R; Bernardini, F
2017|Impact of Biological Invasions on Ecosystem Services Foreword Genovesi, Piero
2012|Theoretical perspectives on payment schemes for forest ecosystem services Liang, Dan
2006|Special feature on scenarios for ecosystem services Carpenter, Stephen R.; Bennett, Elena M.; Peterson, Garry D.
2013|Additional UK submission to the IPBES Catalogue of Assessments on Biodiversity and Ecosystem Services. Bowles-Newark, N.; Mapendembe, A.; Misrachi, M.; Tierney, M.; Wilson, L.; Brown, C.
2013|Special Issue on Ecosystem services in EIA and SEA, Ecosystem services in environmental impact assessment and strategic environmental assessment Geneletti, Davide
1999|All of Keynes horses ... : the need for end-goal driven assessment of ecosystem services Glasser, H; Craig, PP
2017|Handbook on biodiversity and ecosystem services in impact assessment Huge, Jean
2015|Urban ecosystem services and the assessment of their values Douglas, Ian; James, Philip
2014|Payment for ecosystem services in Brazil: between efficiency and equity de Oliveira Nusdeo, Ana Maria; Garcia Campos, Andana Luiza
2011|Valuing Ecosystem Services: The Case of Multi-functional Wetlands Cannon, Lauryn
2009|Environmental Markets: The Power of Regulation Response Palmer, Margaret A.; Filoso, Solange
2002|Nature and the marketplace: Capturing the value of ecosystem services. Squires, D
2016|National Ecosystem and Ecosystem Service Mapping Pilot for a Suite of Prioritised Services. Parker, Neil; Naumann, Elsa-Kristin; Medcalf, Katie; Haines-Young, Roy; Potschin, Marion; Kretsch, Conor; Parker, Jacqueline; Burkhard, Benjamin
2013|Urban governance of biodiversity and ecosystem services. Wilkinson, Cathy; Sendstad, Marte; Parnell, Susan; Schewenius, Maria
2015|Richness in ecosystem services Crouzat, Emilie; Mouchet, Maud; Turkelboom, Francis; Byczek, Coline; Meersmans, Jeroen; Berger, Frederic; Verkerk, Pieter Johannes; Lavorel, Sandra
2017|Impact of Biological Invasions on Ecosystem Services Foreword Roy, Helen E.
2014|Valuing Ecosystem Services Methodological Issues and Case Studies Introduction Ninan, K. N.
2017|Systematically designating conservation areas for protecting habitat quality and multiple ecosystem services Lin, Yu-Pin; Lin, Wei-Chih; Wang, Yung-Chieh; Lien, Wan-Yu; Huang, Tao; Hsu, Chih-Chen; Schmeller, Dirk S.; Crossman, Neville D.
2013|Ecosystem services. Guerry, Anne D.
2018|Scientifically assess impacts of sustainable investments Vorosmarty, C. J.; Osuna, V. Rodriguez; Koehler, D. A.; Klop, P.; Spengler, J. D.; Buonocore, J. J.; Cak, A. D.; Tessler, Z. D.; Corsi, F.; Green, P. A.; Sanchez, R.
2016|Can recognition of ecosystem services help biodiversity conservation? Cunningham, Saul
2015|Putting economic values on green infrastructure improvements Sunderland, Tim; Rolls, Sophie; Butterworth, Tom
2011|Natural Capital Theory and Practice of Mapping Ecosystem Services Leslie, Heather M.
2010|Giving Ecosystem Services Their Rightful Place in the World O'Riordan, Tim
2005|Economics and the living environment Tisdell, Clement A.
2015|ECOSYSTEM SERVICES (PAYMENTS FOR) Engel, Stefanie
2015|Key concepts related to ecosystem services and definitions. Felipe-Lucia, Maria R; Martin-Lopez, Berta; Berraquero-Diaz, Luis; Escalera-Reyes, Javier; Comin, Francisco A; Lavorel, Sandra
2013|A demand driven research agenda for ecosystem services Honey-Roses, Jordi; Pendleton, Linwood H.
2016|Bird ecosystem services. Economic ornithology for the 21st Century. Whelan, Christopher J.; Sekercioglu, Cagan H.; Wenny, Daniel G.
2008|MPA data on ecosystem services Halpern, Benjamin
2015|Ecosystem services maps Derkzen, Marthe L
2015|Ecosystem services and benefits from marine ecosystems Austen, Melanie; Hattam, Caroline; Boerger, Tobias
2016|Environment, extractivism and the delusions of nature as capital Bohm, Steffen; Misoczky, Maria Ceci
2015|Coffee Agroecology: A New Approach to Understanding Agricultural Biodiversity, Ecosystem Services and Sustainable Development Perfecto, I; Vandermeer, J
2012|Native Title and Ecology: Agreement-making in an Era of Market Environmentalism Godden, Lee
2015|Problems with the Gross Domestic Product Delang, Claudio O.; Yu, Yihang
2013|Local assessment of New York City: biodiversity, green space, and ecosystem services. McPhearson, Timon; Maddox, David; Gunther, Bram; Bragdon, David
2012|454 Transcriptome pyrosequencing (P. persimilis_contig) Ozawa, Rika; Nishimura, Osamu; Yazawa, Shigenobu; Muroi, Atsushi; Takabayashi, Junji; Arimura, Gen-Ichiro
2011|Dryad supplement info for MER. septosporum MER-10-0451.R1 Langrell, Stephen RH
2016|Dispersal of plants by waterbirds. Green, Andy J.; Soons, Merel; Brochet, Anne-Laure; Kleyheeg, Erik
1998|Ecosystem services, efficiency, sustainability and equity: South Africa's Working for Water Programme van Wilgen, BW; Le Maitre, DC; Cowling, RM
2014|Map comparison statistics of individual ecosystem services and bundles. Schulp, Catharina J E; Burkhard, Benjamin; Maes, Joachim; Van Vliet, Jasper; Verburg, Peter H
2010|Environment and Biodiversity Fuller, Richard A.; Tratalos, Jamie; Warren, Philip H.; Davies, Richard G.; Pepkowska, Aleksandra; Gaston, Kevin J.
2007|Lessons from the field: What we know about implementation of ecosystem service projects and payment for ecosystem services in the real world Tallis, Heather; Goldman, Rebecca; Daily, Gretchen; Kareiva, Peter; Ricketts, Taylor
2016|Leaf litter physicochemical properties Purahong, Witoon; Wubet, Tesfaye; Lentendu, Guillaume; Schloter, Michael; Pecyna, Marek; Kapturska, Danuta; Hofrichter, Martin; Kruger, Dirk; Buscot, Francois
2011|Review of Future Energy Supply and Targets for Climate Change: The Idea of Ecosystem Services Fongwa, Ernest; Onyango, Vincent; Gnauck, Albrecht
2016|Why birds matter: avian ecological function and ecosystem services. 
2012|Outbreaks and ecosystem services. Schowalter, Timothy D.
2015|Landscape Fragmentation and Ecosystem Services: A Reply to Andrieu et al. Mitchell, Matthew G. E.; Suarez-Castro, Andres F.; Martinez-Harms, Maria; Maron, Martine; McAlpine, Clive; Gaston, Kevin J.; Johansen, Kasper; Rhodes, Jonathan R.
2016|Research progress of ecosystem service flow Liu Hui-min; Fan Yu-long; Ding Sheng-yan
2015|Self-Organising Map on ecosystem service distributions Crouzat, Emilie; Mouchet, Maud; Turkelboom, Francis; Byczek, Coline; Meersmans, Jeroen; Berger, Frederic; Verkerk, Pieter Johannes; Lavorel, Sandra
2017|Towards a Threat Assessment Framework for Ecosystem Services Maron, Martine; Mitchell, Matthew G. E.; Runting, Rebecca K.; Rhodes, Jonathan R.; Mace, Georgina M.; Keith, David A.; Watson, James E. M.
2016|Traditional knowledge for sustainable forest management and provision of ecosystem services Parrotta, John; Yeo-Chang, Youn; Camacho, Leni D.
2004|Ecosystem services provided by freshwater benthos Covich, AR; Ewe, KC; Hall, RO; Giller, PS; Goedkoop, W; Merritt, DM
2016|Have Ecosystem Services Been Oversold? A Response to Silvertown Potschin, Marion B.; Primmer, Eeva; Furman, Eeva; Haines-Young, Roy H.
2016|Tropical Forests: The Challenges of Maintaining Ecosystem Services while Managing the Landscape 
2013|Synthesizing different perspectives on the value of urban ecosystem services Hubacek, Klaus; Kronenberg, Jakub
2009|Ecosystem Services and Management of Invasive Species in a Changing System: Response to Martin and Blossey Hershner, Carl; Havens, Kirk
2016|THE COLLISION OF ASPIRATION AND REALITY IN PAYMENTS FOR ECOSYSTEM SERVICES Salzman, James
2012|Payment schemes for forest ecosystem services in China: policy, practices and performance Preface Liang, Dan
2016|Good management of biodiversity and ecosystem services makes economic sense for farmers and agricultural supply chains Guimaraes, Joao; Lowe, Steven
2015|Advancing the frontier of urban ecosystem services research Kremer, Peleg; Andersson, Erik; Elmqvist, Thomas; McPhearson, Timon
2015|Looking forward: current concerns and the future of ecological economics Martinez-Alier, Joan; Muradian, Roldan
2014|Social Entrepreneurship in the Water Sector: Getting Things Done Sustainably Ziegler, R; Partzsch, L; Gebauer, J; Henkel, M; Lodemann, J; Mohaupt, F
2013|Editorial: Introduction to themed section-supporting ecosystem services with conservation agricultural approaches Franzluebbers, Alan J.
2011|Lozier_etal_BombusDataForDRYAD Lozier, Jeffrey D; Strange, James P; Stewart, Isaac J; Cameron, Sydney A
2008|Debating the ecosystem service rationale for conservation: Response to Kremen et al. Ghazoul, Jaboury
1999|Discussion paper 2 on leading indicators of ecosystem services and values Rowe, RD
2016|Estuaries: A Lifeline of Ecosystem Services in the Western Indian Ocean Preface Diop, Salif; Scheren, Peter; Machiwa, John; Ducrotoy, Jean-Paul
2015|Public-private partnerships and the governance of ecosystem services Mert, Aysem; Pattberg, Philipp
2015|Schaeckermann_et_al_data_JAPPL Schackermann, Jessica; Mandelik, Yael; Weiss, Noam; Von Wehrden, Henrik; Klein, Alexandra-Maria
2011|How much is urban nature worth? And for whom? Thoughts from ecological economics Chiesura, Anna; Martinez-Alier, Joan
2016|Trophic interacton networks and ecosystem services. Whelan, Christopher J.; Tomback, Diana F.; Kelly, Dave; Johnson, Matthew D.
2015|Governance of Ecosystem Services: Lessons learned for sustainable institutions Mann, Carsten; Loft, Lasse; Hansjuergens, Bernd
2012|Ecosystem Service: From Virtual Reality to Ground Truth (vol 46, pg 2492, 2012) Lu, Yihe; Liu, Shuguang; Fu, Bojie
2014|Ecosystem Service Valuations of Mangrove Ecosystems to Inform Decision Making and Future Valuation Exercises Mukherjee, Nibedita; Sutherland, William J; Dicks, Lynn; Huge, Jean; Koedam, Nico; Dahdouh-Guebas, Farid
2014|Further development of a spatial framework for mapping ecosystem services. Medcalf, K.; Small, N.; Finch, C.; Williams, J.; Blair, T.; Haines-Young, R.; Potschin, M.; Parker, J.
2013|Towards the legal recognition and governance of forest ecosystem services in Mozambique Norfolk, S; Cosijn, M
2006|Study on ecosystem services: Progress, limitation and basic paradigm Xie Gao-Di; Xiao Yu; Lu Chun-Xia
2015|Urban ecosystem services: A review Mao Qi-zheng; Huang Gan-lin; Wu Jian-guo
2017|Principles for Building Resilience - Sustaining Ecosystem Services in Social-Ecological Systems [Anonymous]
2014|Rebalancing the philosophy of river conservation Ormerod, S. J.
