2017|A novel deliberative multicriteria evaluation approach to ecosystem service valuation Mavrommati, Georgia; Borsuk, Mark E.; Howarth, Richard B.
2016|Spatial patterns of cultural ecosystem services provision in Southern Patagonia Martinez Pastur, Guillermo; Peri, Pablo L.; Lencinas, Maria V.; Garcia-Llorente, Marina; Martin-Lopez, Berta
2013|Urban ecosystem services assessment along a rural-urban gradient: A cross-analysis of European cities Larondelle, Neele; Haase, Dagmar
2017|Multi-Scenario Ecosystem Service Assessment of Wuma River Valley Based on CLUE-S and InVEST Models Lei Jun-cheng; Liu Ji-xin; Yong Fan; Liu Hui-ming; Wu Jun; Ding Hui; Wang Jin-mei; Wu Song-qin; Cheng Shi; Cui Peng
2017|Mainstreaming Payments for Ecosystem Services in the Global Water Discourse Henkel, Marianne
2017|Integration of stakeholder choices and multi-criteria analysis to support land use planning in semiarid areas Derak, Mchich; Cortina, Jordi; Taiqui, Lahcen
2016|Is economic valuation of ecosystem services useful to decision-makers? Lessons learned from Australian coastal and marine management Marre, Jean-Baptiste; Thebaud, Olivier; Pascoe, Sean; Jennings, Sarah; Boncoeur, Jean; Coglan, Louisa
2016|Plant diversity and ecosystem services in Amazonian homegardens of Ecuador Caballero-Serrano, Veronica; Onaindia, Miren; Alday, Josu G.; Caballero, David; Carlos Carrasco, Juan; McLaren, Brian; Amigo, Javier
2015|Adapting Scotland's forests to climate change using an action expiration chart Petr, M.; Boerboom, L. G. J.; Ray, D.; van der Veen, A.
2015|What can deliberative approaches bring to the monetary valuation of ecosystem services? A literature review Bunse, Lukas; Rendon, Olivia; Luque, Sandra
2012|Biodiversity, ecosystem functions and services in environmental risk assessment: Introduction to the special issue Schaefer, Ralf B.
2015|USING GOOGLE EARTH, A VIRTUAL-GLOBE IMAGING PLATFORM, FOR ECOSYSTEM SERVICES-BASED RIVER ASSESSMENT Large, A. R. G.; Gilvear, D. J.
2015|Land use efficiency: anticipating future demand for land-sector greenhouse gas emissions abatement and managing trade-offs with agriculture, water, and biodiversity Bryan, Brett A.; Crossman, Neville D.; Nolan, Martin; Li, Jing; Navarro, Javier; Connor, Jeffery D.
2012|Biodiversity and ecosystem services: a multilayered relationship Mace, Georgina M.; Norris, Ken; Fitter, Alastair H.
2009|Effects of River Impoundment on Ecosystem Services of Large Tropical Rivers: Embodied Energy and Market Value of Artisanal Fisheries Hoeinghaus, David J.; Agostinho, Angelo A.; Gomes, Luiz C.; Pelicice, Fernando M.; Okada, Edson K.; Latini, Joao D.; Kashiwaqui, Elaine A. L.; Winemiller, Kirk O.
2006|River ecosystem service function and dam-construction. Xiao Jianhong; Shi Guoqing; Mao Chunmei; Zhenxiang, Xing
2017|Ecosystem services response to urbanization in metropolitan areas: Thresholds identification Peng, Jian; Tian, Lu; Liu, Yanxu; Zhao, Mingyue; Hu, Yi'na; Wu, Jiansheng
2016|Drivers and barriers towards sustainable water and land management in the Olifants-Doorn Water Management Area, South Africa Knueppe, Kathrin; Meissner, Richard
2015|The role of benefit transfer in ecosystem service valuation Richardson, Leslie; Loomis, John; Kroeger, Timm; Casey, Frank
2013|Reaching for a sustainable, resilient urban future using the lens of ecosystem services Jansson, Asa
2017|New perspectives in ecology and conservation Metzger, Jean Paul; Loyola, Rafael; Felizola Diniz-Filho, Jose Alexandre; Pillar, Valerio D.
2015|Groundwater ecosystem services: a review Griebler, Christian; Avramov, Maria
2014|Simulation games that integrate research, entertainment, and learning around ecosystem services Costanza, Robert; Chichakly, Karim; Dale, Virginia; Farber, Steve; Finnigan, David; Grigg, Kat; Heckbert, Scott; Kubiszewski, Ida; Lee, Harry; Liu, Shuang; Magnuszewski, Piotr; Maynard, Simone; McDonald, Neal; Mills, Richard; Ogilvy, Sue; Pert, Petina L.; Renz, Jochen; Wainger, Lisa; Young, Mike; Ziegler, C. Richard
2014|Features, targets, fraction of targets to be achieved across the two zones (non-use and partial use), and contribution (effectiveness) of the partial zone in meeting respective targets. Schroter, Matthias; Barton, David N; Blumentrath, Stefan; Rusch, Graciela M; Norden, Bjorn
2013|Requirements for adaptive governance of groundwater ecosystem services: insights from Sandveld (South Africa), Upper Guadiana (Spain) and Spree (Germany) Knueppe, Kathrin; Pahl-Wostl, Claudia
2011|The geography of ecosystem service value The case of the Des Plaines and Cache River wetlands, Illinois Kozak, Justin; Lant, Christopher; Shaikh, Sabina; Wang, Guangxing
2008|The ecosystem service controversy: Is there sufficient evidence for a "pollination paradox"? Klein, Alexandra-Maria; Olschewski, Roland; Kremen, Claire
2006|Impacts of Biodiversity loss on ocean ecosystem services data Worm, Boris
2016|Identifying and mapping the tourists' perception of cultural ecosystem services: A case study from an Alpine region Zoderer, Brenda Maria; Tasser, Erich; Erb, Karl-Heinz; Stanghellini, Paola Sabina Lupo; Tappeiner, Ulrike
2017|Ecosystem services of collectively managed urban gardens: Exploring factors affecting synergies and trade-offs at the site level Dennis, Matthew; James, Philip
2017|Designing protected area systems in the Qinling Mountains based on biodiversity and ecosystem service evaluation. Fang Zhi; Xu Weihua; Zhang Jingjing; Xiao Yi; Zhang Lu
2017|Design Strategies to Enhance Resilience of Ecosystem Services in Urban Wetland 
2016|Adaptive management of ecosystem services across different land use regimes Ruhl, J. B.
2009|Restoration of Ecosystem Services for Environmental Markets Palmer, Margaret A.; Filoso, Solange
2015|Analysis of the farmers' knowledge on the ecosystem services of trees in the Molawin-Dampalit Watershed, Makiling Forest Reserve, Philippines Paelmo, Roselyn F.; Visco, Roberto G.; Landicho, Leila D.; Cabahug, Rowena D.; Baliton, Romnick S.; Espaldon, Marya Laya O.; Lasco, Rodel D.
2018|Evaluating the net value of ecosystem services to support ecological engineering: Framework and a case study of the Beijing Plains afforestation project Yu, Zhongqi; Liu, Xu; Zhang, Junze; Xu, Duanyang; Cao, Shixiong
2017|Achieving sustainability goals for urban coasts in the US Northeast: research needs and challenges Close, Sarah L.; Montalto, Franco; Orton, Philip; Antoine, Adrienne; Peters, Danielle; Jones, Hunter; Parris, Adam; Blumberg, Alan
2016|Reprint: Examiningtheecosystemserviceofnutrientremovalina coastal watershed Berg, Chelsea E.; Mineau, Madeleine M.; Rogers, Shannon H.
2016|Advancing Sustainability through Urban Green Space: Cultural Ecosystem Services, Equity, and Social Determinants of Health Jennings, Viniece; Larson, Lincoln; Yun, Jessica
2006|Research advance in ecosystem services valuation Zong Wenjun; Jiang Deming; Lamusa, A.
2005|Research on the effects of Land use change on ecosystem services value of Loess Plateau - a case study of Longxi County Liu, GH; Dong, SC; Peng, H; Zhang, XJ
2017|Ecosystem services in infrastructure planning - a case study of the projected deepening of the Lower Weser river in Germany Droste, Nils; Meya, Jasper N.
2015|Rapid Assessment of Ecosystem Services Provided by Two Mineral Extraction Sites Restored for Nature Conservation in an Agricultural Landscape in Eastern England Balmford, Andrew; Field, Rob H; Macdonald, Michael A; Bradbury, Richard B; Peh, Kelvin S-H; Jia, Li; Blaen, Phillip J
2017|Impacts of forestry on boreal forests: An ecosystem services perspective Pohjanmies, Tahti; Trivino, Maria; Le Tortorec, Eric; Mazziotta, Adriano; Snall, Tord; Monkkonen, Mikko
2017|Rapid Assessment of Wetland Ecosystem Services (RAWES): An example from Colombo, Sri Lanka McInnes, R. J.; Everard, M.
2017|Perspectives for environmental conservation and ecosystem services on coupled rural-urban systems Bicudo da Silva, Ramon Felipe; Alves Rodrigues, Marjorie Delgado; Vieira, Simone Aparecida; Batistella, Mateus; Farinaci, Juliana
2016|Coastal Biodiversity and Ecosystem Service Sustainability (CBESS) standing crop biomass on salt marsh sites at Morecambe Bay and Essex Ford, H; Garbutt, A; Skov, M
2014|Issues and challenges in spatio-temporal application of an ecosystem services framework to UK seas Hull, Steve; Dickie, Ian; Tinch, Rob; Saunders, Justine
2011|Temperate Grasslands in Catchment Systems: the Role of Scale, Connectivity and Thresholds in the Provision and Regulation of Water Quality and Quantity Macleod, Christopher J. A.; Ferrier, Robert C.
2017|Mining Site Reclamation Planning Based on Land Suitability Analysis and Ecosystem Services Evaluation: A Case Study in Liaoning Province, China Wang, Jiali; Zhao, Fuqiang; Yang, Jian; Li, Xiaoshu
2013|Comparing land-use alternatives: Using the ecosystem services concept to define a multi-criteria decision analysis Fontana, Veronika; Radtke, Anna; Fedrigotti, Valerie Bossi; Tappeiner, Ulrike; Tasser, Erich; Zerbe, Stefan; Buchholz, Thomas
2012|An analysis of the spatial and temporal changes in Chinese terrestrial ecosystem service functions Shi Yao; Wang RuSong; Huang JinLou; Yang WenRui
2008|Assessment of the management of organizations supplying ecosystem services from tropical forests Koellner, Thomas; Sell, Joachim; Gaehwiler, Manuela; Scholz, Roland W.
2017|Plant Functional Traits: Soil and Ecosystem Services Faucon, Michel-Pierre; Houben, David; Lambers, Hans
2016|Function, restoration, and ecosystem services of riverine wetlands in the temperate zone Yang, Tian-Xue; Sheng, Lian-Xi; Zhuang, Jie; Lv, Xian-Guo; Cai, Yan-Peng
2015|Betting against Human Ingenuity: The Perils of the Economic Valuation of Nature's Services Kronenberg, Jakub
2013|Adjusting for Cultural Differences in International Benefit Transfer Hynes, Stephen; Norton, Daniel; Hanley, Nick
2013|Ecosystem services and international water law: towards a more effective determination and implementation of equity? Rieu-Clarke, A; Spray, C
2006|Soil invertebrates and ecosystem services Lavelle, P.; Decaens, T.; Aubert, M.; Barot, S.; Blouin, M.; Bureau, F.; Margerie, P.; Mora, P.; Rossi, J. -P.
2017|Biodiversity and Ecosystem Services Knowledge in the Colombian Caribbean: Progress and Challenges Aldana-Dominguez, Juanita; Montes, Carlos; Martinez, Maria; Medina, Nicolas; Hahn, Joachim; Duque, Maritza
2017|Payments for Ecosystem Services and Wealth Distribution Wang, Pu; Poe, Gregory L.; Wolf, Steven A.
2016|A Collaborative Approach for Scoping Ecosystem Services with Stakeholders: The Case of Arrabida Natural Park Lopes, Rita; Videira, Nuno
2013|Crediting uncertain ecosystem services in a market Springborn, Michael; Yeo, Boon-Ling; Lee, Juhwan; Six, Johan
2017|Mapping of the ecosystem services in Zabaikalskiy National Park Istomina, E.A.; Luzhkova, N.M.
2016|Transformative agenda, or lost in the translation? A review of top-cited articles in the first four years of Ecosystem Services van den Belt, Marjan; Stevens, Sharon M.
2016|Mining undermining Brazil's environment El Bizri, Hani Rocha; Bausch Macedo, Jonathan Christopher; Paglia, Adriano Pereira; Morcatty, Thais Queiroz
2016|Sample means for various respondent characteristics. Eppink, Florian V; Winden, Matthew; Wright, Will CC; Greenhalgh, Suzie
2016|Custom R Spatial autoregressive model (SAR) functions Mitchell, Matthew GE; Wu, Dan; Johansen, Kasper; Maron, Martine; McAlpine, Clive; Rhodes, Jonathan R
2016|MAPPING OF URBAN GREEN SPACES USING SENTINEL-2A DATA: METHODICAL ASPECTS Rosina, Konstantin; Kopecka, Monika
2016|Specification of quantitative echo sounder, KCE-300 with T182 transducer (Sonic Co.). Sonoki, Shiori; Shao, Huamei; Morita, Yuka; Minami, Kenji; Shoji, Jun; Hori, Masakazu; Miyashita, Kazushi
2016|Vulnerability and Adaptation to Natural Disasters Yang, Wu; Vina, Andres; Dietz, Thomas; Hull, Vanessa; Kramer, Daniel; Ouyang, Zhiyun; Liu, Jianguo
2014|Biodiversity and key ecosystem services as protection goal for agro-ecosystems in Europe Brock, Theo C. M.; Schoonjans, Reinhilde
2013|WILD FOODS King, Nicola J.; Lake, Robin J.; Kerr, Geoffrey N.
2011|The Analysis of Ecosystem Service Value's Change in Yueqing Bay Wetland Based on RS and GIS Song, Guoli; Fu, Chunlei; E, Yong
2010|Minimum-data analysis of ecosystem service supply in semi-subsistence agricultural systems Antle, John M.; Diagana, Bocar; Stoorvogel, Jetse J.; Valdivia, Roberto O.
2009|Human choices and policies' impacts on ecosystem services Improving evaluations of payment and park effects on conservation and carbon Pfaff, Alexander; Robalino, Juan
2007|Environmental and Resource Valuation with Revealed Preferences: A Theoretical Guide to Empirical Models Bockstael, NE; McConnell, K
2005|Creating markets for ecosystem services: Notes from the field Salzman, J
2016|A conceptual framework for assessing the ecosystem service of waste remediation: In the marine environment Watson, Stephen C. L.; Paterson, David M.; Queiros, Ana M.; Rees, Andrew P.; Stephens, Nicholas; Widdicombe, Stephen; Beaumont, Nicola J.
2016|A systematic map of ecosystem services assessments around European agroforestry Fagerholm, Nora; Torralba, Mario; Burgess, Paul J.; Plieninger, Tobias
2015|Effects of Land Use and Land Cover Change on Ecosystem Services in Ecological Preservation Development Districts of Beijing Liu, Xiaona; Li, Hong; Zhang, Weiwei
2017|Changes in ecosystem services associated with planting structures of cropland: A case study in Minle County in China Liu, Yaqun; Song, Wei; Mu, Fengyun
2017|When to Pay? Adjusting the Timing of Payments in PES Design to the Needs of Poor Land-users Randrianarison, Henintsoa; Ramiaramanana, Jeannot; Waetzold, Frank
2010|An Assessment of Ecosystem Services and Biodiversity in Europe Fitter, Alastair; Elmqvist, Thomas; Haines-Young, Roy; Potschin, Marion; Rinaldo, Andrea; Setala, Heikki; Stoll-Kleemann, Susanna; Zobel, Martin; Murlis, John
2016|A local-scale spatial analysis of ecosystem services and ecosystem service bundles in the upper Hun River catchment, China Yao, Jing; He, Xingyuan; Chen, Wei; Ye, Yin; Guo, Ruichao; Yu, Lizhong
2015|Harnessing reforestation to achieve greater biodiversity gains: Interview with David Lamb Lamb, David; McDonald, Tein
2014|Regression analysis between ecosystem service values (ESVs) and landscape patterns (n&#8202;=&#8202;36). Han, Ruiming; Fang, Xuan; Tang, Guoan; Li, Bicheng
2012|Market-based instruments for biodiversity and ecosystem services: A lexicon Pirard, Romain
2010|Influences of alien species Spartina alterniflora Invasion on Ecosystem Services of Coastal Wetland and Its Countermeasures Li Jia-lin; Yang Xiao-ping
2014|Ecosystem services as substitute inputs: Basic results and important implications for conservation policy Simpson, R. David
2011|Social preferences regarding the delivery of ecosystem services in a semiarid Mediterranean region Castro, A. J.; Martin-Lopez, B.; Garcia-LLorente, M.; Aguilera, P. A.; Lopez, E.; Cabello, J.
2017|Applicability of economic instruments for protecting ecosystem services from cultural agrarian landscapes in Donana, SW Spain Gaitan-Cremaschi, Daniel; Palomo, Ignacio; Baraibar Molina, Sergio; De Groot, Rudolf; Gomez-Baggethun, Erik
2012|Are investments to promote biodiversity conservation and ecosystem services aligned? Polasky, Stephen; Johnson, Kris; Keeler, Bonnie; Kovacs, Kent; Nelson, Erik; Pennington, Derric; Plantinga, Andrew J.; Withey, John
2016|Assessment of the social values of ecosystem services based on SolVES model: A case study of Wusong Paotaiwan Wetland Forest Park, Shanghai, China. Wang Yu; Fu Bi-tian; Lyu Yong-peng; Yang Kai; Che Yue
2016|Tropical Forests: The Challenges of Maintaining Ecosystem Services while Managing the Landscape 
2015|Integrating methods for ecosystem service assessment and valuation: Mixed methods or mixed messages? Hattam, Caroline; Bohnke-Henrichs, Anne; Boerger, Tobias; Burdon, Daryl; Hadjimichael, Maria; Delaney, Alyne; Atkins, Jonathan P.; Garrard, Samantha; Austen, Melanie C.
2015|Mapping ecosystem services demand: A review of current research and future perspectives Wolff, S.; Schulp, C. J. E.; Verburg, P. H.
2015|Ecological Functions and Functionings: Towards a Senian Analysis of Ecosystem Services Forsyth, Tim
2014|On the Value of Soil Resources in the Context of Natural Capital and Ecosystem Service Delivery Robinson, D. A.; Fraser, I.; Dominati, E. J.; Davidsdottir, B.; Jonsson, J. O. G.; Jones, L.; Jones, S. B.; Tuller, M.; Lebron, I.; Bristow, K. L.; Souza, D. M.; Banwart, S.; Clothier, B. E.
2014|Firm-level ecosystem service valuation using mechanistic biogeochemical modeling and functional substitutability Comello, Stephen D.; Maltais-Landry, Gabriel; Schwegler, Benedict R.; Lepech, Michael D.
2013|Valuing nature in a general equilibrium Carbone, Jared C.; Smith, V. Kerry
2018|A Decision Support System for trade-off analysis and dynamic evaluation of forest ecosystem services Sacchelli, Sandro
2018|Food, money and lobsters: Valuing ecosystem services to align environmental management with Sustainable Development Goals Ward, Michelle; Possingham, Hugh; Rhodes, Jonathan R.; Mumby, Peter
2017|Aligning Land Use with Land Potential: The Role of Integrated Agriculture Liebig, M. A.; Herrick, J. E.; Archer, D. W.; Dobrowolski, J.; Duiker, S. W.; Franzluebbers, A. J.; Hendrickson, J. R.; Mitchell, R.; Mohamed, A.; Russell, J.; Strickland, T. C.
2017|Some issues in the assessment of eutrophication of river waters as a consequence of the construction of a storage reservoir (on the example of the Bystrzyca River) (vol 9, pg 175, 2009) Chmiel, Stanislaw; Glowacki, Slawomir; Michalczyk, Zdzislaw; Sposob, Joanna
2016|Perceptions of the ecosystem services in Frontino-Urrao paramo complex, Department of Antioquia, Colombia. Alvarez-Salas, Lizeth M.; Gomez-Aguirre, Ana M.; Cano-Lopez, Wilmar A.
2016|Factors influencing the perception of ecosystem services in Ecuadorian tropical dry forests Briceno, J.; Iniguez-Gallardo, V.; Ravera, F.
2016|Silene dioica seed count (phytometer experiment) Orford, Katherine A; Memmott, Jane; Vaughan, Ian P; Murray, Phil J
2016|Farm plant data 2012 Orford, Katherine A; Memmott, Jane; Vaughan, Ian P; Murray, Phil J
2015|galls and parasitoids Henri, Dominic C; Jones, Owen; Tsiattalos, Ariana; Thebault, Elisa; Seymour, Colleen L; Van Veen, F J Frank
2015|Carbon Sequestration of Different Types of Floodplain Forests in the Maros River Valley (Hungary) Kiss, Marton; Cseh, Viktoria; Tanacs, Eszter
2014|NINJA: AN AUTOMATED CALCULATION SYSTEM FOR NEMATODE-BASED BIOLOGICAL MONITORING. Sieriebriennikov, B.; Ferris, H.; de Goede, R. G. M.
2014|Understanding the use of ecosystem service knowledge in decision making: lessons from international experiences of spatial planning McKenzie, Emily; Posner, Stephen; Tillmann, Patricia; Bernhardt, Joanna R.; Howard, Kirsten; Rosenthal, Amy
2013|Perceptions of river-based "ecosystem services" and conflict potential in the case of the "river landscape Enns" Boeck, Kerstin; Muhar, Andreas; Oberdiek, Jan; Muhar, Susanne
2010|A Soil Scientist's Perspective on Ecosystem Services and Sustainability Hammer, R. David
2008|Agendas for sustainable farmland management Fish, R.; Seymour, S.; Watkins, C.; Steven, M.
2014|How may REDD plus affect the practical, legal and institutional framework for 'Payment for ecosystem services' in Costa Rica? Rosendal, G. Kristin; Schei, Peter Johan
2014|A Methodology for Adaptable and Robust Ecosystem Services Assessment Villa, Ferdinando; Bagstad, Kenneth J.; Voigt, Brian; Johnson, Gary W.; Portela, Rosimeiry; Honzak, Miroslav; Batker, David
2013|Payments for ecosystem services in Vietnam: market-based incentives or state control of resources? Suhardiman, Diana; Wichelns, Dennis; Lestrelin, Guillaume; Hoanh, Chu Thai
2012|A Regional, Interactive, Economic Model for Assessing Ecosystem Services Provided by Bats Amelon, Sybill; Godsey, Larry
2012|Vegetation of the clinics of the Dr Kenneth Kaunda District Municipality, North West Province Pretorius, C.; Prinsloo, E.; Powrie, L.; Theunissen, M.; Cilliers, Sarel S.
2012|Ecosystem service trends in basin-scale restoration initiatives: A review Trabucchi, Mattia; Ntshotsho, Phumza; O'Farrell, Patrick; Comin, Francisco A.
2015|Criteria and indicators for sustainable forestry under Mediterranean conditions applicable in Spain at the forest management unit scale Valls-Donderis, Pablo; Valles, Maria C.; Galiana, Francisco
2010|Why and how much are firms willing to invest in ecosystem services from tropical forests? A comparison of international and Costa Rican firms Koellner, Thomas; Sell, Joachim; Navarro, Guillermo
2017|Economic value of ecosystem services, minerals and oil in a melting Arctic: A preliminary assessment O'Garra, Tanya
2017|Expert data for ranks, mode comparison, and interval comparison Singh, Gerald G; Sinner, Jim; Ellis, Joanne; Kandlikar, Milind; Halpern, Benjamin S; Satterfield, Terre; Chan, Kai
2016|Quantification and assessment of changes in ecosystem service in the Three-River Headwaters Region, China as a result of climate variability and land cover change Jiang, Chong; Li, Daiqing; Wang, Dewang; Zhang, Linbo
2013|Relationships of overstory trees and shrubs with forage species portray ecosystem service interactions in smallholder fallows Sircely, Jason; Naeem, Shahid
2013|Biodiversity tradeoffs and offsets in impact assessment and decision making: can we stop the loss? Brownlie, Susie; King, Nicholas; Treweek, Jo
2013|Ecosystem Services Provided by the Soil Biota Brussaard, Lijbert
2010|A framework for assessing ecological quality based on ecosystem services Paetzold, Achim; Warren, Philip H.; Maltby, Lorraine L.
2014|The ecosystem service cascade: Further developing the metaphor. Integrating societal processes to accommodate social processes and planning, and the case of bioenergy Spangenberg, Joachim H.; von Haaren, Christina; Settele, Josef
2018|Reasons for Adoption and Advocacy of the Ecosystem Services Concept in UK Forestry Raum, Susanne
2017|Incorporating threat in hotspots and coldspots of biodiversity and ecosystem services Schrotter, Matthias; Kraemer, Roland; Ceausu, Silvia; Rusch, Graciela M.
2017|Assessing ecosystem services in Neotropical dry forests: a systematic review Calvo-Rodriguez, Sofia; Sanchez-Azofeifa, Arturo G.; Duran, Sandra M.; Espirito-Santo, Mario M.
2016|Ecosystem services assessments in local municipal decision making in South Africa: justification for the use of a business-based approach Jorgensen, P. W.; Trotter, D. C.; Hill, T. R.
2015|Ecosystem Services Assessment Using InVEST as a Tool to Support Decision Making Process: Critical Issues and Opportunities Arcidiacono, Andrea; Ronchi, Silvia; Salata, Stefano
2006|Organizing a public ecosystem service economy for sustaining biodiversity Gatzweiler, Franz W.
2016|Payments discourage coordination in ecosystem services provision: evidence from behavioral experiments in Southeast Asia Bell, Andrew; Zhang, Wei
2011|Broad-scale ecosystem services of European wetlands-overview of the current situation and future perspectives under different climate and water management scenarios Okruszko, Tomasz; Duel, Harm; Acreman, Mike; Grygoruk, Mateusz; Floerke, Martina; Schneider, Christof
2017|Mapping and Monitoring Urban Ecosystem Services Using Multitemporal High-Resolution Satellite Data Haas, Jan; Ban, Yifang
2017|Ecosystem Service Valuation on Groundwater Storage Capacity by Biotope Type 
2014|Urban vacancy and land use legacies: A frontier for urban ecological research, design, and planning Nassauer, Joan Iverson; Raskin, Julia
2014|Urban and agricultural soils: conflicts and trade-offs in the optimization of ecosystem services Setala, H.; Bardgett, R. D.; Birkhofer, K.; Brady, M.; Byrne, L.; de Ruiter, P. C.; de Vries, F. T.; Gardi, C.; Hedlund, K.; Hemerik, L.; Hotes, S.; Liiri, M.; Mortimer, S. R.; Pavao-Zuckerman, M.; Pouyat, R.; Tsiafouli, M.; van der Putten, W. H.
2016|Trade-offs in water and carbon ecosystem services with land-use changes in grasslands Kim, John H.; Jobbygy, Esteban G.; Jackson, Robert B.
2015|"We are the city lungs": Payments for ecosystem services in the outskirts of Mexico City Caro-Borrero, Angela; Corbera, Esteve; Christoph Neitzel, Kurt; Almeida-Lenero, Lucia
2013|Co-benefits and trade-offs between biodiversity, carbon storage and water flow regulation Onaindia, Miren; Fernandez de Manuel, Beatriz; Madariaga, Iosu; Rodriguez-Loinaz, Gloria
2017|An ecosystem services perspective for classifying and valuing the environmental impacts of geothermal power projects Cook, David; Daviosdottir, Brynhildur; Kristofersson, Daoi Mar
2011|Applying the ecosystem service concept to air quality management in the UK: a case study for ammonia Smart, James C. R.; Hicks, Kevin; Morrissey, Tim; Heinemeyer, Andreas; Sutton, Mark A.; Ashmore, Mike
2017|Valuation of Ecosystem Services in Wuyishan City Gong Xi; Cao Ming-chang; Sun Xiao-ping; Le Zhi-fang; Li Shuang; Xu Hai-gen
2016|Assessing water ecosystem services for water resource management Grizzetti, B.; Lanzanova, D.; Liquete, C.; Reynaud, A.; Cardoso, A. C.
2015|The social distribution of provisioning forest ecosystem services: Evidence and insights from Odisha, India Lakerveld, Roan P.; Lele, S.; Crane, T. A.; Fortuin, K. P. J.; Springate-Baginski, O.
2016|Trade-offs among ecosystem services in a typical Karst watershed, SW China Tian, Yichao; Wang, Shijie; Bai, Xiaoyong; Luo, Guangjie; Xu, Yan
2017|Forests and water in South America Jones, Julia; Almeida, Auro; Cisneros, Felipe; Iroume, Andres; Jobbagy, Esteban; Lara, Antonio; Lima, Walter de Paula; Little, Christian; Llerena, Carlos; Silveira, Luis; Camilo Villegas, Juan
2017|Evaluation of a dairy agri-environmental programme for restoring woody green infrastructure McWilliam, Wendy; Fukuda, Yuki; Moller, Henrik; Smith, Des
