|Computer-readable storage medium for establishing direct communication between health-presence units in health presence system, has set of instructions for communicating data indicating current statuses to one health-presence unit RAGHAVENDRAN V; HEMMADY S G; YANG S H
|Asexual propagation of haplometrotic castor-oil plant by transplanting the entire haplometrotic castor-oil plant material into hibernation-type plastic tents for storing, and rooting the branch of castor-oil plant in the seedling bed HUANG J; HUANG Q; HUANG X
|Portable soaking and bath pan for treating patient's perineal wounds has bottom portion defining bottom surface to be supported on surface of bed and with sides defining treatment area in which thighs and buttocks are received WING B G; WING A J; WING T N
2017|Pathological findings in the red fox (Vulpes vulpes), stone marten (Martes foina) and raccoon dog (Nyctereutes procyonoides), with special emphasis on infectious and zoonotic agents in Northern Germany Lempp, Charlotte; Jungwirth, Nicole; Grilo, Miguel L; Reckendorf, Anja; Ulrich, Arlena; Van Neer, Abbo; Bodewes, Rogier; Pfankuche, Vanessa M; Bauer, Christian; Osterhaus, Albert DME; Baumgartner, Wolfgang; Siebert, Ursula
2016|[Primary care in the United Kingdom]. Sanchez-Sagrado, T
2016|Demographics, referral patterns and management of patients accessing the Welsh Eye Care Service. McAlinden, Colm; Corson, Helen; Sheen, Nik; Garwood, Peter
2015|First Detection of Borrelia burgdorferi sensu lato DNA in Serum of the Wild Boar (Sus scrofa) in Northern Portugal by Nested-PCR Faria, Ana S.; Paiva-Cardoso, Maria das Neves; Nunes, Monica; Carreira, Teresa; Vale-Goncalves, Helia M.; Veloso, Octavia; Coelho, Catarina; Cabral, Joao A.; Vieira-Pinto, Madalena; Vieira, Maria L.
2015|Serological Evidence of Rift Valley Fever Virus Circulation in Domestic Cattle and African Buffalo in Northern Botswana (2010-2011). Jori, Ferran; Alexander, Kathleen A; Mokopasetso, Mokganedi; Munstermann, Suzanne; Moagabo, Keabetswe; Paweska, Janusz T
2011|Occupational Risk Factors among Primary Health Care Workers in Mersin, Turkey Kurt, Ahmet Oner; Oner, Seva; Yapici, Gulcin; Sasmaz, Tayyar; Bugdayci, Resul
2009|Decolonisation of patients with wounds colonised by MRSA Ruef, C.; Ruef, S. A.; Senn, G.; Cathomas, A.; Imhof, A.
2005|A review of the use of CAM therapy and the sources of accurate and reliable information. McHughes, Mary; Timmermann, Barbara N
2004|The age at menopause and associated factors at the health center area in Ankara, Turkey Ozdemir, O; Col, M
2017|Zero-inflated model to identify risk factors of human Crimean-Congo hemorrhagic fever in Pakistan Abbas, Tariq; Riaz, Muhammad Tahir
2016|Drivers for emerging issues in animal and plant health. Richardson, J.; Lockhart, C.; Pongolini, S.; Karesh, W. B.; Baylis, M.; Goldberg, T.; Slingenbergh, J.; Gale, P.; Venturini, T.; Catchpole, M.; Balogh, K. de; Pautasso, M.; Broglia, A.; Berthe, F.; Schans, J.; Poppy, G.
2014|Financial costs of Mama-SASHA &#151; a project to improve health and nutrition through an integrated orange flesh sweet potato production and health service delivery model Self, Julie; Kedera, Ellah; Grant, Frederick; Wamalwa, Moses; Hu, Jia; Low, Jan; Cole, Donald; Girard, Amy Webb; Levin, Carol
2014|Social support, satisfaction with physician-patient relationship, couple satisfaction, body satisfaction, optimism as predictors of life satisfaction in people having a current perceived health problem Cornel, Mincu L.; Avram, E.
2013|Treating Cattle to Protect People? Impact of Footbath Insecticide Treatment on Tsetse Density in Chad Ndeledje, Noel; Bouyer, Jeremy; Stachurski, Frederic; Grimaud, Patrice; Belem, Adrien Marie Gaston; Mbaindingatoloum, Fidele Molele; Bengaly, Zakaria; Alfaroukh, Idriss Oumar; Cecchi, Guiliano; Lancelot, Renaud
2018|Comparing performance of mothers using simplified mid-upper arm circumference (MUAC) classification devices with an improved MUAC insertion tape in Isiolo County, Kenya Grant, Angeline; Njiru, James; Okoth, Edgar; Awino, Imelda; Briend, Andre; Murage, Samuel; Abdirahman, Saida; Myatt, Mark
2016|Turtle-Associated Salmonellosis, United States, 2006-2014 Bosch, Stacey; Tauxe, Robert V.; Behravesh, Casey Barton
2016|Conservation value, history and legal status of non-native white-tailed deer (Odocoileus virginianus) on the Caribbean island of St. Kitts Keehner, Jon R.; Cruz-Martinez, Luis; Knobel, Darryn
2016|Uncovering the Pathogenic Landscape of Helminth (Opisthorchis viverrini) Infections: A Cross-Sectional Study on Contributions of Physical and Social Environment and Healthcare Interventions Ong, Xueyuan; Wang, Yi-Chen; Sithithaworn, Paiboon; Namsanor, Jutamas; Taylor, David; Laithavewat, Luxana
2013|[The need for health consultation services and related factors among non-users of health consultation services residing in urban public apartment complexes]. Fukui, Sakiko; Otoguro, Chizuru; Ishikawa, Takako; Fujita, Junko; Akiyama, Masako
2013|Risk management for foodborne prions Van Dyck, Koen; Plantady, Martial; Schneegans, Fabien
2005|Quality of life assessment in Thai patients with allergic rhinoconjunctivitis using the SF-36 questionnaire (Thai version) Bunnag, C; Leurmarnkul, W; Jareoncharsri, P; Tunsuriyawong, P; Assanasen, P; Pawankar, R
2004|Immediate steps toward patient safety. Johnson, Van R; Hummel, John; Kinninger, Terance; Lewis, Russell R
1993|Health centres. Involving the community. Tumwine, J
2017|Whole genome sequencing of ESBL-producing Escherichia coli isolated from patients, farm waste and canals in Thailand Runcharoen, Chakkaphan; Raven, Kathy E.; Reuter, Sandra; Kallonen, Teemu; Paksanont, Suporn; Thammachote, Jeeranan; Anun, Suthatip; Blane, Beth; Parkhill, Julian; Peacock, Sharon J.; Chantratita, Narisara
2015|Animal Reservoirs of Zoonotic Tungiasis in Endemic Rural Villages of Uganda Mutebi, Francis; Kruecken, Juergen; Feldmeier, Hermann; Waiswa, Charles; Mencke, Norbert; Sentongo, Elizabeth; von Samson-Himmelstjerna, Georg
2011|Prognostic impact of atrial fibrillation progression in a community study: AFBAR Study (Atrial Fibrillation in the Barbanza Area Study) Garcia-Castelo, Alberto; Garcia-Seara, Javier; Otero-Ravina, Fernando; Lado, Manuel; Vizcaya, Andres; Vidal, Juan M.; Lafuente, Ramon; Bouza, David; Lear, Pamela V.; Gonzalez-Juanatey, Jose R.
2005|Economic evaluation of a policy change from single-agent treatment for suspected malaria to artesunate-amodiaquine for microscopically confirmed uncomplicated falciparum malaria in the Oussouye District of south-western Senegal Agnamey, P; Brasseur, P; Cisse, M; Gaye, O; Dumoulin, J; Rigal, J; Taylor, WRJ; Olliaro, P
2013|Importance of identification and typing of Brucellae from West African cattle: A review Sanogo, Moussa; Abatih, Emmanuel; Thys, Eric; Fretin, David; Berkvens, Dirk; Saegerman, Claude
2018|Animal and human tungiasis-related knowledge and treatment practices among animal keeping households in Bugiri District, South-Eastern Uganda Mutebi, Francis; Kruecken, Juergen; von Samson-Himmelstjerna, Georg; Waiswa, Charles; Mencke, Norbert; Eneku, Wilfred; Andrew, Tamale; Feldmeier, Hermann
2016|Optimal frequency of rabies vaccination campaigns in Sub-Saharan Africa Bilinski, Alyssa M.; Fitzpatrick, Meagan C.; Rupprecht, Charles E.; Paltiel, A. David; Galvani, Alison P.
2016|Coexistence of mcr-1 and bla(NDM-1) in Escherichia coli from Venezuela Delgado-Blas, Jose F.; Ovejero, Cristina M.; Abadia-Patino, Lorena; Gonzalez-Zorn, Bruno
2016|Prioritization of Zoonotic Diseases in Kenya, 2015 Munyua, Peninah; Bitek, Austine; Osoro, Eric; Pieracci, Emily G.; Muema, Josephat; Mwatondo, Athman; Kungu, Mathew; Nanyingi, Mark; Gharpure, Radhika; Njenga, Kariuki; Thumbi, Samuel M.
2016|Access to effective antimicrobials: a worldwide challenge Laxminarayan, Ramanan; Matsoso, Precious; Pant, Suraj; Brower, Charles; Rottingen, John-Ame; Klugman, Keith; Davies, Sally
2015|One health, one literature: Weaving together veterinary and medical research Christopher, Mary M.
2011|Needs and preferences regarding health care delivery as perceived by patients with systemic sclerosis Schouffoer, Anne A.; Zirkzee, Elisabeth J. M.; Henquet, Stella M.; Caljouw, Monique A. A.; Steup-Beekman, Gerda M.; van Laar, Jacob M.; Vlieland, Theodora P. M. Vliet
2006|Health service staff attitudes to community representatives on committees. Nathan, Sally; Harris, Elizabeth; Kemp, Lynn; Harris-Roxas, Ben
2016|Impact of a Reference Center on Leprosy Control under a Decentralized Public Health Care Policy in Brazil Barbieri, Raquel Rodrigues; Sales, Anna Maria; Hacker, Mariana Andrea; da Costa Nery, Jose Augusto; Duppre, Nadia Cristina; Machado, Alice de Miranda; Moraes, Milton Ozorio; Sarno, Euzenir Nunes
2013|It is Possible: Availability of Lymphedema Case Management in each Health Facility in Togo. Program Description, Evaluation, and Lessons Learned Mathieu, Els; Dorkenoo, Ameyo M.; Datagni, Michael; Cantey, Paul T.; Morgah, Kodjo; Harvey, Kira; Ziperstein, Joshua; Drexler, Naomi; Chapleau, Gina; Sodahlon, Yao
2009|Public Health for the Twenty-First Century: What Role Do Veterinarians in Clinical Practice Play? Trevejo, Rosalie T.
2006|Conceptual models used by nurses working in coronary care units--a discussion paper. Timmins, Fiona
2017|Breaking bad news in assisted reproductive technology: a proposal for guidelines Leone, Daniela; Menichetti, Julia; Barusi, Lorenzo; Chelo, Elisabetta; Costa, Mauro; De lauretis, Luciana; Ferraretti, Anna Pia; Livi, Claudia; Luehwink, Arne; Tomasi, Giovanna; Vegni, Elena
2015|Leptospirosis in Rio Grande do Sul, Brazil: An Ecosystem Approach in the Animal-Human Interface Schneider, Maria Cristina; Najera, Patricia; Pereira, Martha M.; Machado, Gustavo; dos Anjos, Celso B.; Rodrigues, Rogerio O.; Cavagni, Gabriela M.; Munoz-Zanzi, Claudia; Corbellini, Luis G.; Leone, Mariana; Buss, Daniel F.; Aldighieri, Sylvain; Espinal, Marcos A.
2015|Staphylococcus aureus nasal carriage among outpatients attending primary health care centers: a comparative study of two cities in Saudi Arabia and Egypt. Abou Shady, Hala M; Bakr, Alaa Eldin A; Hashad, Mahmoud E; Alzohairy, Mohammad A
2014|Surveillance-response systems: the key to elimination of tropical diseases Tambo, Ernest; Ai, Lin; Zhou, Xia; Chen, Jun-Hu; Hu, Wei; Bergquist, Robert; Guo, Jia-Gang; Utzinger, Juerg; Tanner, Marcel; Zhou, Xiao-Nong
2013|Are low income patients receiving the benefits of electronic health records? A statewide survey Butler, Matthew J.; Harootunian, Gevork; Johnson, William G.
2011|Decomposing the Intergenerational Disparity in Income and Obesity Zhang, Qi; Zheng, Buhong; Zhang, Ning; Wang, Youfa
1986|ARE MALARIA FILMS REQUESTED APPROPRIATELY - A STUDY OF ALL FILM REQUESTS IN ONE HEALTH DISTRICT COHEN, DL; DESOUSA, EA
2017|Rational use of antimicrobials in animal production: a prerequisite to stem the tide of antimicrobial resistance Thakur, Sidharath Dev; Panda, A. K.
2017|ECDC/EFSA/EMA second joint report on the integrated analysis of the consumption of antimicrobial agents and occurrence of antimicrobial resistance in bacteria from humans and food-producing animals: Joint Interagency Antimicrobial Consumption and Resistance Analysis (JIACRA) Report 
2015|Willingness to Consult a Veterinarian on Physician's Advice for Zoonotic Diseases: A Formal Role for Veterinarians in Medicine? Speare, Rick; Mendez, Diana; Judd, Jenni; Reid, Simon; Tzipori, Saul; Massey, Peter D.
2014|The Implications of the Recent American College of Cardiology/American Heart Association Guidelines for the Treatment of Blood Cholesterol on a Rural Community: The Heart of New Ulm Project Miedema, Michael D.; Sidebottom, Abbey C.; Sillah, Arthur; Benson, Gretchen; Boucher, Jackie; Knicklebine, Tom; VanWormer, Jeffrey J.
2013|On Not Knowing Zoonotic Diseases: Pastoralists' Ethnoveterinary Knowledge in the Far North Region of Cameroon Moritz, Mark; Ewing, Daniel; Garabed, Rebecca B.
2004|Rewarding results: Improving the quality of treatment for people with alcohol and drug problems. [Anonymous]
1997|The opinions of nursing documentation held by district nurses and by nurses at primary health care centres. Tornkvist, L; Gardulf, A; Strender, L E
1980|A PEDIATRIC HOME THERAPY PROGRAM FOR DEVELOPMENTAL PROGRESS IN SEVERELY HANDICAPPED INFANTS CARLYLE, MJ
2017|Intensifying poultry production systems and the emergence of avian influenza in China: a 'One Health/Ecohealth' epitome Gilbert, Marius; Xiao, Xiangming; Robinson, Timothy P.
2016|Efficacy and Safety of a Permethrin-Fipronil Spot-On Solution (Effitix (R)) in Dogs Naturally Infested by Ticks in Europe Navarro, Christelle; Reymond, Nadege; Crastes, Nolwenn; Bonneau, Stephane
2015|Malaria policies versus practices, a reality check from Kinshasa, the capital of the Democratic Republic of Congo Mavoko, Hypolite Muhindo; Ilombe, Gillon; da Luz, Raquel Inocencio; Kutekemeni, Albert; Van Geertruyden, Jean-Pierre; Lutumba, Pascal
2011|One Health: Zoonoses in the Exotic Animal Practice. Souza, Marcy J.
2001|[Examination, treatment and follow-up of ovarian cancer in Norway]. Paulsen, T; Kjaerheim, K; Kaern, J; Norstein, J; Onsrud, M
1995|Perceived family stress as a predictor of health-related outcomes. Parkerson, G R Jr; Broadhead, W E; Tse, C K
2013|Sustaining a regional emerging infectious disease research network: a trust-based approach. Silkavute, Pornpit; Tung, Dinh Xuan; Jongudomsuk, Pongpisut
2017|Knowledge, attitudes, and practices regarding cystic echinococcosis and sheep herding in Peru: a mixed-methods approach Merino, Veronika; Westgard, Christopher M.; Bayer, Angela M.; Garcia, Patricia J.
2014|Comparative microbiological features of Bartonella henselae infection in a dog with fever of unknown origin and granulomatous lymphadenitis Drut, Amandine; Bublot, Isabelle; Breitschwerdt, Edward B.; Chabanne, Luc; Vayssier-Taussat, Muriel; Cadore, Jean-Luc
2017|Seroprevalence and risk factors of glanders in working equines - Findings of a cross-sectional study in Punjab province of Pakistan Ghori, Muhammad Taslim; Khan, Muhammad Sarwar; Khan, Jawaria Ali; Rabbani, Masood; Shabbir, Muhammad Zubair; Chaudhry, Haroon Rashid; Ali, Muhammad Asad; Muhammad, Javed; Elschner, Mandy Carolina; Jayarao, Bhushan M.
2017|Assessment of biosecurity and control measures to prevent incursion and to limit spread of emerging transboundary animal diseases in Europe: An expert survey Leger, Anais; De Nardi, Marco; Simons, Robin; Adkin, Amie; Ru, Giuseppe; Estrada-Pena, Agustin; Stark, Katharina D. C.
2015|A Lentiviral Vector Expressing Japanese Encephalitis Virus-like Particles Elicits Broad Neutralizing Antibody Response in Pigs de Wispelaere, Melissanne; Ricklin, Meret; Souque, Philippe; Frenkiel, Marie-Pascale; Paulous, Sylvie; Garcia-Nicolas, Obdulio; Summerfield, Artur; Charneau, Pierre; Despres, Philippe
2017|Differences in chronic back pain and joint disorders among health insurance funds. Results of a cross-sectional study based on the data of the Socioeconomic Panel from 2013 Ramos, A. Luque; Hoffmann, F.
2016|Free-Ranging Frigates (Fregata magnificens) of the Southeast Coast of Brazil Harbor Extraintestinal Pathogenic Escherichia coli Resistant to Antimicrobials Saviolli, Juliana Yuri; Vieira Cunha, Marcos Paulo; Lopes Guerra, Maria Flavia; Irino, Kinue; Catao-Dias, Jose Luiz; de Carvalho, Vania Maria
2017|Epidemiology of brucellosis, Q Fever and Rift Valley Fever at the human and livestock interface in northern Cote d'Ivoire Kanoute, Youssouf B.; Gragnon, Biego G.; Schindler, Christian; Bonfoh, Bassirou; Schelling, Esther
2015|Staphylococcus aureus nasal carriage among outpatients attending primary health care centers: a comparative study of two cities in Saudi Arabia and Egypt Abou Shady, Hala M.; Bakr, Alaa Eldin A.; Hashad, Mahmoud E.; Alzohairy, Mohammad A.
1996|Using an alternative data source to examine randomization in the Canadian National Breast Screening Study Cohen, MM; Kaufert, PA; MacWilliam, L; Tate, RB
2017|The efficacy of Protected Mealtimes in hospitalised patients: a stepped wedge cluster randomised controlled trial Porter, Judi; Haines, Terry P.; Truby, Helen
2016|The Annual September Peak in Asthma Exacerbation Rates Still a Reality? Larsen, Kristian; Zhu, Jingqin; Feldman, Laura Y.; Simatovic, Jacqueline; Dell, Sharon; Gershon, Andrea S.; To, Teresa
2013|WILDLIFE DISEASE AND RISK PERCEPTION Hanisch-Kirkbride, Shauna L.; Riley, Shawn J.; Gore, Meredith L.
2005|Non-adherence among patients initiating antiretroviral therapy: a challenge for health professionals in Brazil Bonolo, PD; Cesar, CC; Acurcio, FA; Ceccato, MDB; de Padua, CAM; Alvares, J; Campos, LN; Carmo, RA; Guimaraes, MDC
2004|Cognitive abilities and genotype in a population-based sample of people with Prader-Willi syndrome Whittington, J; Holland, A; Webb, T; Butler, J; Clarke, D; Boer, H
2018|Prevalence of intestinal parasites in companion dogs with diarrhea in Beijing, China, and genetic characteristics of Giardia and Cryptosporidium species Yu, Zhongjia; Ruan, Yang; Zhou, Mengjie; Chen, Siyuan; Zhang, Yinxin; Wang, Liya; Zhu, Guan; Yu, Yonglan
2012|User satisfaction with the Family Health Program in Vespasiano, Minas Gerais, Brazil Mues, Katherine E.; Resende, Joana C.; dos Santos, Otavio C.; Perez, Lilian G.; Ferreira, Jose A.; Leon, Juan S.
2000|Asthma-like symptoms in wood product plant workers exposed to methylene diphenyl diisocyanate Petsonk, EL; Wang, ML; Lewis, DM; Siegel, PD; Husberg, BJ
2013|Completeness and diagnostic validity of recording acute myocardial infarction events in primary care, hospital care, disease registry, and national mortality records: cohort study Herrett, Emily; Shah, Anoop Dinesh; Boggon, Rachael; Denaxas, Spiros; Smeeth, Liam; van Staa, Tjeerd; Timmis, Adam; Hemingway, Harry
2009|The Impact of the Extended Parallel Process Model on Stroke Awareness Pilot Results From a Novel Study Davis, Stephen M.; Martinelli, Diana; Braxton, Brian; Kutrovac, Kyle; Crocco, Todd
2009|Common Health Hazards in French Pilgrims During the Hajj of 2007: A Prospective Cohort Study Gautret, Philippe; Soula, Georges; Delmont, Jean; Parola, Philippe; Brouqui, Philippe
2001|Preventing drug interactions by online prescription screening in community pharmacies and medical practices Halkin, H; Katzir, I; Kurman, I; Jan, J; Malkin, BBO
2018|Cross-sectional survey of brucellosis and associated risk factors in the livestock-wildlife interface area of Nechisar National Park, Ethiopia. Chaka, Hassen; Aboset, Gezahegn; Garoma, Abebe; Gumi, Balako; Thys, Eric
2017|Reformulations of well-known active ingredients in the topical treatment of psoriasis vulgaris can improve clinical outcomes for patients Iversen, L.; Dauden, E.; Segaert, S.; Freeman, K.; Magina, S.; Rigopoulos, D.; Thaci, D.
2015|Back problems, comorbidities, and their association with wealth Schofield, Deborah J.; Callander, Emily J.; Shrestha, Rupendra N.; Passey, Megan E.; Kelly, Simon J.; Percival, Richard
2013|Epidemiology, geographical distribution, and economic consequences of swine zoonoses: a narrative review Khan, Salah Uddin; Atanasova, Kalina R.; Krueger, Whitney S.; Ramirez, Alejandro; Gray, Gregory C.
2017|"We need people to collaborate together against this disease": A qualitative exploration of perceptions of dengue fever control in caregivers' of children under 5 years, in the Peruvian Amazon. Frank, Amy L; Beales, Emily R; de Wildt, Gilles; Meza Sanchez, Graciela; Jones, Laura L
2014|The Use of Radiology in Bowel Screening Wales: 3 Years Data Brown, Chris; Robinson, Mark; Williams, Gethin
2014|Training and service in public health, Nigeria Field Epidemiology and Laboratory Training, 2008 - 2014. Nguku, Patrick; Oyemakinde, Akin; Sabitu, Kabir; Olayinka, Adebola; Ajayi, Ikeoluwapo; Fawole, Olufunmilayo; Babirye, Rebecca; Gitta, Sheba; Mukanga, David; Waziri, Ndadilnasiya; Gidado, Saheed; Biya, Oladayo; Gana, Chinyere; Ajumobi, Olufemi; Abubakar, Aisha; Sani-Gwarzo, Nasir; Ngobua, Samuel; Oleribe, Obinna; Poggensee, Gabriele; Nsubuga, Peter; Nyager, Joseph; Nasidi, Abdulsalami
2018|Rates and risk factors for human cutaneous anthrax in the country of Georgia: National surveillance data, 2008-2015 Kasradze, Ana; Echeverria, Diana; Zakhashvili, Khatuna; Bautista, Christian; Heyer, Nicholas; Imnadze, Paata; Mitrskhulava, Veriko
2018|Prevalence of physical conditions and multimorbidity in a cohort of adults with intellectual disabilities with and without Down syndrome: cross-sectional study. Kinnear, Deborah; Morrison, Jill; Allan, Linda; Henderson, Angela; Smiley, Elita; Cooper, Sally-Ann
2017|A systematic review of zoonotic enteric parasitic diseases among nomadic and pastoral people Barnes, Amber N.; Davaasuren, Anu; Baasandagva, Uyanga; Gray, Gregory C.
2017|Identification of candidate transmission-blocking antigen genes in Theileria annulata and related vector-borne apicomplexan parasites Lempereur, Laetitia; Larcombe, Stephen D.; Durrani, Zeeshan; Karagenc, Tulin; Bilgic, Huseyin Bilgin; Bakirci, Serkan; Hacilarlioglu, Selin; Kinnaird, Jane; Thompson, Joanne; Weir, William; Shiels, Brian
2016|Knowledge, attitudes and practices towards spotted fever group rickettsioses and Q fever in Laikipia and Maasai Mara, Kenya Ndeereh, David; Muchemi, Gerald; Thaiyah, Andrew
2015|Helicobacter Pylori Infection is Positively Associated with Metabolic Syndrome in Taiwanese Adults: a Cross-Sectional Study Chen, Tsung-Po; Hung, Hui-Fang; Chen, Meng-Kan; Lai, Ho-Hsien; Hsu, Wen-Feng; Huang, Kuo-Chin; Yang, Kuen-Cheh
2015|Beyond Fences: Wildlife, Livestock and Land Use in Southern Africa Cumming, David H. M.; Osofsky, Steven A.; Atkinson, Shirley J.; Atkinson, Mark W.
2014|Though not Reservoirs, Dogs might Transmit Leptospira in New Caledonia Gay, Noellie; Soupe-Gilbert, Marie-Estelle; Goarant, Cyrille
2012|Limited PSA Testing in Indigent Men in South Texas: An Appropriate Care or Missing a Prevention Opportunity? Liang, Yuanyuan; Du, Fei; Thompson, Ian M.; Turner, Barbara J.
1997|[Daily functioning and health care utilization among persons 85 years old and older]. Bootsma-van der Wiel, A; Westendorp, R G; Knook, D L
1981|ESTIMATING THE COTS REQUIRED FOR NEONATAL INTENSIVE-CARE SIMPSON, H; WALKER, G
2016|Moving from talk to action: a socio-technical discussion of the key issues and hurdles related to legume use Duru, M.
2016|Impact of a Reference Center on Leprosy Control under a Decentralized Public Health Care Policy in Brazil Barbieri, Raquel Rodrigues; Sales, Anna Maria; Hacker, Mariana Andrea; Nery, Jose Augusto Da Costa; Duppre, Nadia Cristina; Machado, Alice De Miranda; Moraes, Milton Ozorio; Sarno, Euzenir Nunes
2015|Cost analysis of one of the first outpatient wound clinics in the Netherlands. Rondas, A A L M; Schols, J M G; Halfens, R J G; Hull, H R; Stobberingh, E E; Evers, S M A A
2014|Control of canine rabies in developing countries: key features and animal welfare implications. Arechiga Ceballos, N; Karunaratna, D; Aguilar Setien, A
2009|Relationship Between Exercise, Body Fatness and Metabolic Syndrome 
2002|Fatigue and physical function after orthotopic liver transplantation Aadahl, M; Hansen, BA; Kirkegaard, P; Groenvold, M
2017|Determinants of participating in life after spinal cord injury - advice for health professionals arising from an examination of shared narratives. Amsters, Delena; Duncan, James; Field, Victoria; Smales, Alastair; Zillmann, Leanne; Kendall, Melissa; Kuipers, Pim
2016|Microbiological quality and pathogen persistence in probiotic amended recycled sand bedding in dairy barns. Wilson, W.; Warriner, K.; Kelton, D.
2014|Emerging respiratory tract infections 2 Emerging infectious diseases and pandemic potential: status quo and reducing risk of global spread McCloskey, Brian; Dar, Osman; Zumla, Alimuddin; Heymann, David L.
2014|Risk factors for MRSA infection in companion animals: Results from a case-control study within Germany Vincze, Szilvia; Brandenburg, Anja G.; Espelage, Werner; Stamm, Ivonne; Wieler, Lothar H.; Kopp, Peter A.; Luebke-Becker, Antina; Walther, Birgit
2014|Disease Prediction Models and Operational Readiness Hartley, David M; Rabinowitz, Peter M; Corley, Courtney D; Pullum, Laura L; Benedum, Corey; Noonan, Christine; Lancaster, Mary J
2011|Quantifying Quality of Life and Disability of Patients with Advanced Schistosomiasis Japonica Jia, Tie-Wu; Utzinger, Juerg; Deng, Yao; Yang, Kun; Li, Yi-Yi; Zhu, Jin-Huan; King, Charles H.; Zhou, Xiao-Nong
2007|What Changes When Incentives Change in Primary Medical Care, 2005-2006. Guthrie, B; Huby, G; Davies, HTO
2007|Cesarean section deliveries in one health insurance hospital in Alexandria. Labib, N Y; Mortada, M M; Guirguis, W W; Abd El-Aziz, H M
1996|The impact of age, drugs and disease on sexual activity in European men Hamdy, FC; Carretero, P; Perrin, P
2017|Database documentation of marine mammal stranding and mortality: current status review and future prospects Chan, Derek K. P.; Tsui, Henry C. L.; Kot, Brian C. W.
2017|Qualitative Research to Design Sustainable Community-Based Surveillance for Rabies in Northern Australia and Papua New Guinea. Brookes, Victoria J; Kennedy, Emma; Dhagapan, Phillipa; Ward, Michael P
2016|Nutrition and health claims on healthy and less-healthy packaged food products in New Zealand Al-Ani, Haya H.; Devi, Anandita; Eyles, Helen; Swinburn, Boyd; Vandevijvere, Stefanie
2016|Leptospirosis: risk factors and management challenges in developing countries Goarant, Cyrille
2015|Antimicrobial stewardship: what is it, and how does it work? Turnidge, J.
2014|TAZAMA Health and Demographic Surveillance System, 1994-2012 Changalucha, John
2014|Scientific opinion on the evaluation of molecular typing methods for major food-borne microbiological hazards and their use for attribution modelling, outbreak investigation and scanning surveillance: part 2 (surveillance and data management activities). 
