2015|Metacommunity and phylogenetic structure determine wildlife and zoonotic infectious disease patterns in time and space Suzan, Gerardo; Garcia-Pena, Gabriel E.; Castro-Arellano, Ivan; Rico, Oscar; Rubio, Andre V.; Tolsa, Maria J.; Roche, Benjamin; Hosseini, Parviez R.; Rizzoli, Annapaola; Murray, Kris A.; Zambrana-Torrelio, Carlos; Vittecoq, Marion; Bailly, Xavier; Aguirre, A. Alonso; Daszak, Peter; Prieur-Richard, Anne-Helene; Mills, James N.; Guegan, Jean-Francois
2017|Views from many worlds: unsettling categories in interdisciplinary research on endemic zoonotic diseases MacGregor, Hayley; Waldman, Linda
1992|THE USAGE OF PREGNANCY TESTS IN ONE HEALTH DISTRICT VOSS, S
|Changshuning capsule and its preparation method from Chinese medicinal materials, useful for relaxing bowel ZHOU D; WANG Y; XU S
|Physiotherapeutic rod 'Jianeryin' DIAN Y
2017|People, Patches, and Parasites: The Case of Trypanosomiasis in Zimbabwe Scoones, Ian; Dzingirai, V.; Anderson, N.; MacLeod, E.; Mangwanya, L.; Matawa, F.; Murwira, A.; Nyakupinda, L.; Shereni, W.; Welburn, S. C.
|Health haw nectar-comprises haw, gypsum, cane sugar and essence PAN G
2009|Zoonoses and vector-borne diseases in Croatia - a multidisciplinary approach Markotic, Alemka; Krajinovic, Lidija Cvetko; Margaletic, Josip; Turk, Nenad; Miletic-Medved, Marica; Zmak, Ljiljana; Jankovic, Mateja; Kurolt, Ivan-Christian; Soprek, Silvija; Rode, Oktavija Dakovic; Milas, Zoran; Puljiz, Ivan; Ledina, Dragan; Hukic, Mirsada; Kuzman, Ilija
|Inflating type foot circulation improving instrument MA Y
|Active aloe wine is compounded with fresh aloe leaf, aloe root, Lycium chinense, Saussurea involucrate, honey, crystal sugar and grains spirit, and through soaking WANG S
|Salted seafood composition added with medicinal herb extracts and manufacturing method KIM B S
2018|One-health pathogens in the Aspergillus viridinutans complex Talbot, Jessica J.; Barrs, Vanessa R.
|Portable constitution identification and health card SHI J
|Health food recipe using shallot bulb as main material and processing method CHEN W
|Preparation of fresh crataegus pinnatifida and its preparing process SUO R; YIN Y; LI G; LI W; LI Z; SUO Y
|Multiflower knotweed tuber tea, comprises components including fleeceflower root, black bean and rehmannia root LI C
|Health desk lamp FU J; LI J
2017|Integron Digestive Carriage in Human and Cattle: A "One Health" Cultivation-Independent Approach Chainier, Delphine; Barraud, Olivier; Masson, Geoffrey; Couve-Deacon, Elodie; Francois, Bruno; Couquet, Claude-Yves; Ploy, Marie-Cecile
|Wine bottle has bottle cover that is arranged in wine bottle main portion and is provided with built-in bubble device CHEN Z
|Capsulized walnut-vegetable oil food is produced by using walnut kernel as material and through squeezing, centrifugal separation, filtering, capsulizing, disinfection and packing HONG Z; CHENG X
2017|Obesity and Associated Comorbidities in People and Companion Animals: A One Health Perspective Chandler, M.; Cunningham, S.; Lund, E. M.; Khanna, C.; Naramore, R.; Patel, A.; Day, M. J.
2017|Rationale and support for a One Health program for canine vaccination as the most cost-effective means of controlling zoonotic rabies in endemic settings Lavan, Robert P.; King, Alasdair I. MacG.; Sutton, David J.; Tunceli, Kaan
2018|Occurrence of Staphylococcus aureus in swine and swine workplace environments on industrial and antibiotic-free hog operations in North Carolina, USA: A One Health pilot study. Davis, Meghan F; Pisanic, Nora; Rhodes, Sarah M; Brown, Alexis; Keller, Haley; Nadimpalli, Maya; Christ, Andrea; Ludwig, Shanna; Ordak, Carly; Spicer, Kristoffer; Love, David C; Larsen, Jesper; Wright, Asher; Blacklin, Sarah; Flowers, Billy; Stewart, Jill; Sexton, Kenneth G; Rule, Ana M; Heaney, Christopher D
2016|Eyeworm infections in dogs and in a human patient in Serbia: A One Health approach is needed Tasic-Otasevic, Suzana; Gabrielli, Simona; Trenkic-Bozinovic, Marija; Petrovic, Aleksandar; Gajic, Bojan; Colella, Vito; Momcilovic, Stefan; Cancrini, Gabriella; Otranto, Domenico
2014|Practice of One Health approaches: Bridges and barriers in Tanzania Kayunze, Kim A.; Kiwara, Angwara; Lyamuya, Eligius; Kambarage, Dominic M.; Rushton, Jonathan; Coker, Richard; Kock, Richard
2014|New canine models of copper toxicosis: diagnosis, treatment, and genetics Fieten, Hille; Penning, Louis C.; Leegwater, Peter A. J.; Rothuizen, Jan
2014|Controlling parasites, understanding practices: The biosocial complexity of a One Health intervention for neglected zoonotic helminths in northern Lao PDR Bardosh, Kevin; Inthavong, Phouth; Xayaheuang, Sivilai; Okello, Anna L.
2015|A framework to promote collective action within the One Health community of practice: Using participatory modelling to enable interdisciplinary, cross-sectoral and multi-level integration. Binot, Aurelie; Duboz, Raphael; Promburom, Panomsak; Phimpraphai, Waraphon; Cappelle, Julien; Lajaunie, Claire; Goutard, Flavie Luce; Pinyopummintr, Tanu; Figuie, Muriel; Roger, Francois Louis
2012|Factors influencing diagnostic sample submission by food animal veterinarians in Mississippi Robinson, Philip A.; Epperson, William B.; Huston, Carla L.; Pace, Lanny W.; Wills, Robert W.; Cosby, Arthur G.
2017|Rethinking Human-Nonhuman Primate Contact and Pathogenic Disease Spillover Narat, Victor; Alcayna-Stevens, Lys; Rupp, Stephanie; Giles-Vernick, Tamara
2012|Improving food safety through a one health approach. Workshop summary. Choffnes, E. R.; Relman, D. A.; Olsen, L. A.; Hutton, R.; Mack, A.
2013|A Canadian Application of One Health: Integration of Salmonella Data from Various Canadian Surveillance Programs (2005-2010) Parmley, Elizabeth Jane; Pintar, Katarina; Majowicz, Shannon; Avery, Brent; Cook, Angela; Jokinen, Cassandra; Gannon, Vic; Lapen, David R.; Topp, Ed; Edge, Tom A.; Gilmour, Matthew; Pollari, Frank; Reid-Smith, Richard; Irwin, Rebecca
2016|Blood transcriptomes reveal novel parasitic zoonoses circulating in Madagascar's lemurs Larsen, Peter A.; Hayes, Corinne E.; Williams, Cathy V.; Junge, Randall E.; Razafindramanana, Josia; Mass, Vanessa; Rakotondrainibe, Hajanirina; Yoder, Anne D.
2001|Technology-based disease management - A low-cost, high-value solution for the management of chronic disease Gomaa, WH; Morrow, T; Muntendam, P
2015|One Health and Cyanobacteria in Freshwater Systems: Animal Illnesses and Deaths Are Sentinel Events for Human Health Risks Hilborn, Elizabeth D.; Beasley, Val R.
2001|Mediated computer search services relative to instruction services: A survey of one health sciences library Barnett, Linda; Cmor, Dianne; Morgan, Pamela
2018|Expansion of the 'Antibiotic Guardian' one health behavioural campaign across Europe to tackle antibiotic resistance: pilot phase and analysis of AMR knowledge. Newitt, Sophie; Anthierens, Sibyl; Coenen, Samuel; Lo Fo Wong, Danilo; Salvi, Cristiana; Puleston, Richard; Ashiru-Oredope, Diane
2015|What needs to be done to control the spread of Middle East respiratory syndrome coronavirus? Edelstein, Michael; Heymann, David L.
2007|Sea otters in a dirty ocean Jessup, David A.; Miller, Melissa A.; Kreuder-Johnson, Chris; Conrad, Patricia A.; Tinker, M. Timothy; Estes, James; Mazet, Jorma A. K.
1998|Child mental health services. Side by side. Neira-Munoz, E; Ward, D
1993|WHY PAY EXTRA FOR CESAREAN-SECTION DELIVERIES FINKLER, MD; WIRTSCHAFTER, DD
2015|The global condition of epidemics: Panoramas in A (H1N1) influenza and their consequences for One World One Health programme Tirado, Francisco; Gomez, Andres; Rocamora, Veronica
2013|Development of a One Health National Capacity in Africa The Southern African Centre for Infectious Disease Surveillance (SACIDS) One Health Virtual Centre Model Rweyemamu, Mark; Kambarage, Dominic; Karimuribo, Esron; Wambura, Philemon; Matee, Mecky; Kayembe, Jean-Marie; Mweene, Aaron; Neves, Luis; Masumu, Justin; Kasanga, Christopher; Hang'ombe, Bernard; Kayunze, Kim; Misinzo, Gerald; Simuunza, Martin; Paweska, Janusz T.
2014|One Health and the food chain: maintaining safety in a globalised industry Wall, Patrick
2014|EIGHT CRITICAL QUESTIONS FOR PANDEMIC PREDICTION Allen, Toph; Murray, Kris; Olival, Kevin J.; Daszak, Peter
2011|The University of California Global Health Institute Opportunities and Challenges Debas, Haile T.; Coates, Thomas J.
2005|In search of financial viability: hospital-based v. freestanding home care. Laff, Pat; Steding, Pam
1993|Neonatal hypoglycaemia: changing attitudes in the Northern Region. Wariyar, U; Platt, M W
1989|CONTINUING-EDUCATION - A SURVEY AMONG GENERAL-PRACTITIONERS FORREST, JM; MCKENNA, M; STANLEY, IM; BOADEN, NT; WOODCOCK, GT
1983|GENERAL-PRACTITIONERS SATISFACTION WITH A PRIMARY CARE CLINICAL-PSYCHOLOGY SERVICE JERROM, DWA; SIMPSON, RJ; BARBER, JH; PEMBERTON, DA
2015|KNOWLEDGE MANAGEMENT SYSTEM FOR NEGLECTED ZOONOTIC DISEASES IN PERU: A PROPOSAL FOR A ONE HEALTH APPROACH Castillo-Neyra, Ricardo; Naquira, Cesar; Levy, Michael Z.
2014|A Global, Multi-Disciplinary, Multi-Sectorial Initiative to Combat Leptospirosis: Global Leptospirosis Environmental Action Network (GLEAN) Durski, Kara N.; Jancloes, Michel; Chowdhary, Tej; Bertherat, Eric
2014|Ecosystem of Electronic Health Record Databases in Venezuela Clotet, R.; Hernandez, E.; Huerta, M.; Rivas, D.
2013|The history and achievements of the South African Veterinary Association. Cameron, Colin M
2010|Measuring and improving ambulatory surgery patients' satisfaction. Farber, Janice
2010|The effect of double coverage on health care utilization of children Zimmer, David M.
1996|Managed care's true values Appleby, C
1984|MANAGEMENT OF CHILDHOOD URINARY-TRACT INFECTION IN FAMILY-PRACTICE MCALOON, J; JENKINS, J; LIM, J
2015|One Health: a concept led by Africa, with global benefits Kamani, Titus Mlengeya; Kazwala, Rudovick; Mfinanga, Sayoki; Haydon, Dan; Keyyu, Julius; Lankester, Felix; Buza, Joram
2009|[Cost-effectiveness analyses: what doctors should know]. Auer, Reto; Rodondi, Nicolas; Wasserfallen, Jean-Blaise; Aujesky, Drahomir; Cornuz, Jacques
1994|WOMENS HEALTH-CARE CENTERS - MULTIPLE DEFINITIONS LUNDY, M; MASON, S
1985|PSYCHOLOGICAL-FACTORS ASSOCIATED WITH MAINTENANCE OF IMPROVED HEALTH BEHAVIORS IN POSTCORONARY PATIENTS FINNEGAN, DL; SULER, JR
2018|Recent advances in viral vectors in veterinary vaccinology. Baron, Michael D; Iqbal, Munir; Nair, Venugopal
2016|'One Health' for the people of Hong Kong and the world Kok, Kin-Hang; Tang, Hei-Man Vincent; Jin, Dong-Yan
2014|Exploring the interface between diagnostics and maps of neglected parasitic diseases Rinaldi, Laura; Cringoli, Giuseppe
2014|Public Health Disease Surveillance Networks. Morse, Stephen S
2013|Expectation management for public sector organizations Luoma-aho, Vilma; Olkkonen, Laura; Lahteenmaki, Marko
2012|Tuberculosis cross-species transmission in Tanzania: Towards a One-Health concept Mbugi, Erasto V.; Katale, Bugwesa Z.; Kendall, Sharon; Good, Liam; Kibiki, Gibson S.; Keyyu, Julius D.; Godfrey-Faussett, Peter; van Helden, Paul; Matee, Mecky I.
2009|A HEALTHY HEART, HEALTHY SOUL (AND VICE VERSA) Marusic, Dorian; Marusic, Andrej; Temnik, Sanja
2004|Clinical alarm systems testing--a program assessment model. Richardson, Wesley
1996|Multidrug-resistant tuberculosis outbreak on an HIV ward--Madrid, Spain, 1991-1995. 
2016|Melioidosis: a greater threat than previously suspected? Kelser, Erin Archer
2015|Quality of immunization data in children aged 0 to 11 months in Cote d'Ivoire Bi, Joseph Vroh Benie; Noufe, Souhaliou; Tiembre, Issaka; Bogui, Theodule Yessoh; Lepri, Nicaise Aka; Yohou, Kevin Sylvestre; Walley-Goli, Corine; N'Cho, Simplice Dagnan; Saracino, Janine Tagliante
2004|Absence of socioeconomic variation in survival from colorectal cancer in patients receiving surgical treatment in one health district: cohort study. Lyratzopoulos, G; Sheridan, G F; Michie, H R; McElduff, P; Hobbiss, J H
2003|Consumer choice of social health insurance in managed competition. Kerssens, Jan J; Groenewegen, Peter P
1996|The School Enrollment-Based Health Insurance program: Socioeconomic factors in enrollees' use of health services Shenkman, E; Pendergast, J; Reiss, J; Walther, E; Bucciarelli, R; Freedman, S
2017|The one-health way Kahn, Laura H.
2017|The Rise of Non-native Vectors and Reservoirs of Human Diseases Rabitsch, Wolfgang; Essl, Franz; Schindler, Stefan
2001|The evaluation of the Maternity and Infant Clinic on the Net Kouri, P; Saarikoski, S; Wuorisalo, J
2018|Craniomaxillofacial Disorders and Solutions in Humans and Animals. Arzi, B; Moshaverinia, A; Verstraete, F J M; Fiani, N; Nishimura, I
2018|Rodents as natural hosts of zoonotic Schistosoma species and hybrids: an epidemiological and evolutionary perspective from West Africa. Catalano, Stefano; Sene, Mariama; Diouf, Nicolas D; Fall, Cheikh B; Borlase, Anna; Leger, Elsa; Ba, Khalilou; Webster, Joanne P
2012|Cross-disciplinary university engagement in Southeast Asia: the establishment of a One Health university network in Southeast Asia (SEAOHUN) Fenwick, S.
2009|A baby presenting with failure to thrive in primary care: a case report. Hoare, Karen J
2000|Assessment - The first step in creating a more integrated system-wide approach to nursing practice Koloroutis, M; Moe, JK
1996|Violence and the older adult: the role of the acute care nurse practitioner. Greenberg, E M
2017|Preventive effect of nasal lavage with physiologic saline on the colonization with MRSA after working in porcine stable. Heinemann, C.; Schmithausen, R. M.; Sib, E.; Meyer, I.; Petersen, B.; Steinhoff-Wagner, J.
2016|The Design and Partial Implementation of the Dementia-Aid Monitoring System Based on Sensor Network and Cloud Computing Platform Li, Dingkun; Park, Hyun Woo; Piao, Minghao; Ryu, Keun Ho
2016|Transgender, Mental Health, and Older People: An Appreciative Approach Towards Working Together Page, Sean; Burgess, Jenny; Davies-Abbott, Ian; Roberts, Debbie; Molderson, Jaanika
2013|[Together more durable]. Cornet, Tjeu
2007|Health promotion in clubhouse programs: Needs, barriers, and current and planned activities McKay, Colleen E.; Pelletier, John R.
2002|The chest pain center strategy for delivering community heart attack care by shifting the paradigm of heart attack care to earlier detection and treatment. Bahr, Raymond D
2001|A collaborative program for cardiovascular patient follow-up. Deaton, C; Kurtz, S; Weintraub, W S
1998|Clinical integration: one health-care system's experience. Croushore, S
1981|The economics of specialist and general practitioner maternity units. Gray, A M; Steele, R
1944|Results of a Survey Undertaken in a Rural Area in Bengal in Maternity and Child Welfare. Ghosh, Leila; Sekar, C Chandra
2016|Emerging Fungal Infections in the Pacific Northwest: The Unrecognized Burden and Geographic Range of Cryptococcus gattii and Coccidioides immitis. Lockhart, Shawn R; McCotter, Orion Z; Chiller, Tom M
2015|Clinical and Translational Mycology on the southern shores: perspective from the Australia and New Zealand Mycoses Interest Group Slavin, Monica A.; Chen, Sharon C-A
2015|Governing the health risks of climate change: towards multi-sector responses Bowen, Kathryn J.; Ebi, Kristie L.
2013|The Pandemic H1N1 Influenza Experience Richt, Juergen A.; Webby, Richard J.; Kahn, Robert E.
2011|Smart Surveillance: Analyzing Environmental Drivers of Emergence to Predict and Prevent Pandemics Daszak, Peter
2006|Research on health monitoring of Harbin Sifangtai Bridge in China Zhao, X. F.; Tian, S. Z.; Li, H.; Hou, L. Q.; Ou, J. P.
2002|Experiencing "change" from within: situating the transition to primary health care in a remote Australian context. Lockhart, Chris
1997|Reflections on performance. Northcott, N
2015|Public health ethics and more-than-human solidarity Rock, Melanie J.; Degeling, Chris
2014|Toward One Health: are public health stakeholders aware of the field of animal health? Dorea, Fernanda C.; Dupuy, Celine; Vial, Flavie; Reynolds, Tera L.; Akkina, Judy E.
2013|The history and achievements of the South African Veterinary Association Cameron, Colin M.
2002|When a client considers surrogacy. Storch, Janet
2002|Monitoring the progress of system integration. Lukas, Carol VanDeusen; Meterko, Mark; Lowcock, Susan; Donaldson-Parlier, Renee; Blakely, Michelle; Davies, Michael; Petzel, Robert A
2001|Drug use and barriers to use of health care services McCoy, CB; Metsch, LR; Chitwood, DD; Miles, C
1998|Becoming customer-driven: one health system's story. Bagnell, A
2017|Flying-fox species and Hendra virus spillover risk: comment on "Factors explaining the dispersal of Hendra virus disease in South-East Queensland' by Burnham and Chong (2016) Field, Hume; Edson, Dan; Smith, Craig
2011|The need for veterinary nursing in Nigeria Okanlawon, Funmilayo A.; Emikpe, Benjamin O.
2001|Deconstructing the ailment: One health care professional's experience as the patient Dornhoefer, JD
2016|EditorialOne Health Special IssueParasite Immunology Mulcahy, G.
2014|One Health approach to use of veterinary pharmaceuticals Margalida, A.; Bogliani, G.; Bowden, C. G. R.; Donazar, J. A.; Genero, F.; Gilbert, M.; Karesh, W. B.; Kock, R.; Lubroth, J.; Manteca, X.; Naidoo, V.; Neimanis, A.; Sanchez-Zapata, J. A.; Taggart, M. A.; Vaarten, J.; Yon, L.; Kuiken, T.; Green, R. E.
2017|Rabies elimination research: juxtaposing optimism, pragmatism and realism Cleaveland, Sarah; Hampson, Katie
2017|A Comparison of Three Holistic Approaches to Health: One Health, EcoHealth, and Planetary Health. Lerner, Henrik; Berg, Charlotte
2016|Responding to a Public Health Objection to Vaccinating the Great Apes Capps, Benjamin; Lederman, Zohar
2013|Molecules to modeling: Toxoplasma gondii oocysts at the human-animal-environment interface VanWormer, Elizabeth; Fritz, Heather; Shapiro, Karen; Mazet, Jonna A. K.; Conrad, Patricia A.
2017|Positioning Animal Welfare in the One Health Concept through Evaluation of an Animal Welfare Center in Skopje, Macedonia. Radeski, Miroslav; O'Shea, Helen; De Meneghi, Daniele; Ilieski, Vlatko
2016|Limited Knowledge About Hydatidosis Among Farmers in Northwest Portugal: A Pressing Need for a One Health Approach Mateus, Teresa Letra; Niza-Ribeiro, Joao; Castro, Antonio; Vieira-Pinto, Madalena
2017|One Health and its practical implications for surveillance of endemic zoonotic diseases in resource limited settings Hattendorf, Jan; Bardosh, Kevin Louis; Zinsstag, Jakob
2013|Climate Change and Human Health: A One Health Approach Patz, Jonathan A.; Hahn, Micah B.
|Analysis of health care claims records for enrolled population-assessing quality of care received by enrollees with specified health care condition and making recommendation to improve care LEATHERMAN S
2013|One Health in Mongolia Batsukh, Zayat; Tsolmon, B.; Otgonbaatar, Dashdavaa; Undraa, Baatar; Dolgorkhand, Adyadorj; Ariuntuya, Ochirpurev
|Multi-functional health care insole structure, has insole main body formed with air vent and provided with massage heave and magnet, and upper cover whose outside surface is provided with round heave part LIU C
2009|Assessing Caregivers for Team Interventions (ACT): A New Paradigm for Comprehensive Hospice Quality Care Demiris, George; Oliver, Debra Parker; Wittenberg-Lyles, Elaine
1992|THE ROLE OF THE SPECIALIST IN COMMUNITY NURSING - PERCEPTIONS OF SPECIALIST AND DISTRICT NURSES HASTE, FH; MACDONALD, LD
2017|One Health, emerging infectious diseases and wildlife: two decades of progress? Cunningham, Andrew A.; Daszak, Peter; Wood, James L. N.
|Pharmaceutical composition useful for treating at least one health problem (e.g. irregular plasma lipid levels) comprises fatty acid oil mixture comprising eicosapentaenoic acid and docosahexaenoic acid and at least one salicylate BERGE G; OLESEN P H; HUSTVEDT S O; MUELLERTZ A; KLAVENESS J E J
1995|OFFENDING BY ADULTS WITH LEARNING-DISABILITIES - IDENTIFYING NEED IN ONE HEALTH DISTRICT LYALL, I; HOLLAND, AJ; COLLINS, S
2015|Applying Science: Opportunities to Inform Disease Management Policy with Cooperative Research within a One Health Framework. Blackburn, Jason K; Kracalik, Ian T; Fair, Jeanne Marie
2005|Outbreak of extended spectrum beta-lactamase-producing Klebsiella pneumoniae infection in a neonatal intensive care unit related to onychomycosis in a health care worker Boszczowski, I; Nicoletti, C; Puccini, DMT; Pinheiro, M; Soares, RE; Van Der Heijden, IM; Costa, SF; Barone, AA; Levin, AS
|Wind power converter health state real time monitoring system, has main control module provided with main control processor and storage unit, where main control processor is connected with collecting board card and display module JI H; YANG Q; LONG F
|Multifunction health care body-building device, has upright post fixed with upper surface part of base part, hand pull belt fixed with back cushion part, and foot pad fixed with cushion part and back massage part SUN J
2017|Perspectives and Outcomes of the Activity of a Reference Laboratory for Brucellosis. Banai, Menachem; Itin, Rita; Bardenstein, Svetlana
2003|Clinical comparability of schizophrenia patients at two public mental health systems Ascher-Svanum, H; Zhu, BJ; Stensland, MD; Sterling, K
1999|The cost-effectiveness of home birth Anderson, RE; Anderson, DA
1988|BREAST SELF-EXAMINATION FOR THE EARLY DETECTION OF BREAST-CANCER CASELDINE, J; DOWLE, CS; HINTON, CP; MANHIRE, AR; TODD, JH; ELSTON, CW; BLAMEY, RW
|Health monitoring system used with humans and animals, comprises remote monitor for health parameter and transmitter for conveying data to central monitoring unit GORDNER S O S; HELTAND J
|High elastic health care insole for high elastic force one health care shoe, has high elastic hose covered with high elastic deformation layer, where size of high elastic deformation layer is proportional to that of valley and elastic hose NE X; ZHANG H
2011|Contrasting Features and Opportunities for 'One health' Infectious Diseases Surveillance System in Tanzania Karimuribo, Esron; Wambura, Philemon; Mounier-Jack, Sandra; Sonoiya, Stanley; Short, Nick; Aanensen, David; Mboera, Leonard; Rushton, Jonathan; Coker, Richard; Rweyemamu, Mark
2010|One health, one medicine: Tackling the challenge of emerging diseases Ahmed, J. S.; Sparagano, O.; Seitzer, U.
2006|Handoffs in care - Can we make them safer? Streitenberger, Kim; Breen-Reid, Karen; Harris, Cheryl
1992|DOCTORS UNDERSTANDING OF THE SPECIALTY OF PUBLIC-HEALTH MEDICINE - A SURVEY OF GENERAL-PRACTITIONERS AND JUNIOR HOSPITAL DOCTORS VOSS, S
1992|THE POSSESSIONS OWNED BY LONG-STAY PSYCHOGERIATRIC PATIENTS MOUNTAIN, G; BOWIE, P
1990|A SURVEY OF THE MANAGEMENT OF BREAST-CANCER AND ATTITUDES TO IT IN ONE HEALTH DISTRICT LESLIE, M; MAHER, EJ; SHOREY, B; ASHBY, J
1988|MEASURING GENERAL-PRACTITIONER REFERRALS - PATIENT, WORKLOAD AND LIST SIZE EFFECTS ARMSTRONG, D; BRITTEN, N; GRACE, J
1985|Smoking: the number one health problem. Brandt, E N Jr
2016|Satisfaction and Repurchase Intentions for Health Insurance Marketplaces: Evidence from a Partnership State Fitzgerald, M. Paula; Bias, Thomas K.
2007|Health service integration: a case study in change management Allen, Connie; Stevens, Stella
2017|Competition among Czech Health Insurance Companies from Patients' Point of View Pavlik, Marek
1984|AN OUTBREAK OF MENINGOCOCCAL DISEASE - IMPLICATIONS FOR COMMUNITY-MEDICINE BUCHAN, H; LEVY, L; MCLEOD, JW; SAY, J
2017|History and Current Use of Antimicrobial Drugs in Veterinary Medicine. Prescott, John F
2017|Supporting graduate nurse transition to practice through a quality assurance feedback loop Phillips, Craig; Kenny, Amanda; Esterman, Adrian
2015|Food Security, Nutrition and the One Health Nexus Mahamat, Mahamat Bechir; Crump, Lisa; Tidjani, Abdessalam; Jaeger, Fabienne; Ibrahim, Abderahim; Bonfoh, Bassirou
2012|Performance of small cluster surveys and the clustered LQAS design to estimate local-level vaccination coverage in Mali. Minetti, Andrea; Riera-Montes, Margarita; Nackers, Fabienne; Roederer, Thomas; Koudika, Marie Hortense; Sekkenes, Johanne; Taconet, Aurore; Fermon, Florence; Toure, Albouhary; Grais, Rebecca F; Checchi, Francesco
2007|Psychological factors associated with orofacial pains. Carlson, Charles R
2001|Issues and trends in care of the hypertensive client. Jones, R A; Stephens, R
2001|Using variance tracking to improve outcomes and reduce costs. Benson, L M; Bowes, J; Cheesebro, K; Stasa, C; Horst, T; Blyskal, S; Hoenig, N M; Wolf, M; Hanson, C; Bangel, L; Bergman, K; Cyphers, N K; Duncan, P
1990|THE ELECTROCARDIOGRAM IN GENERAL-PRACTICE - ITS USE AND ITS INTERPRETATION MACALLAN, DC; BELL, JA; BRADDICK, M; ENDERSBY, K; RIZZONAUDI, J
2016|Brazilian Spotted Fever with an Approach in Veterinary Medicine and One Health Perspective. Campos, Sabrina Destri Emmerick; da Cunha, Nathalie Costa; Almosny, Nadia Regina Pereira
2015|Developing a Library Systematic Review Service: A Case Study Ludeman, Emilie; Downton, Katherine; Shipper, Andrea Goldstein; Fu, Yunting
2014|The complex issue of dog bites Bailey, David; Leicester, Lucy
2013|Bird flu biopower: Strategies for multispecies coexistence in Viet Nam Porter, Natalie
2011|Shifting from Emergency Response to Prevention of Pandemic Disease Threats at Source Heymann, David L.
2004|[The effectiveness of health promotion in France: comments from a round table of French experts]. Brodin, Marc; Chambaud, Laurent; Dab, William; Jourdain, Alain; Lopez, Alain; Mansour, Zina
1996|How to organize and implement health care ergonomics teams. Weinstein, S A; Flaherty, U; Soslow, A
1996|Under scrutiny Bilchik, GS
1990|PSYCHIATRISTS IN PRIMARY CARE - WOULD GENERAL-PRACTITIONERS WELCOME THEM BROWN, LM; TOWER, JEC
1984|Marketing public health services. Marsden, G; Peterfreund, N
1981|Consumer participation and influence in a Health Systems Agency. Steckler, A; Dawson, L; Dellinger, N; Williams, A
