2016|Ethical Promises and Pitfalls of OneHealth Verweij, Marcel; Bovenkerk, Bernice
2010|Promoting one health [Anonymous]
2014|One health in action Larkin, Malinda
2016|One Health CPD [Anonymous]
2014|Two diseases, one health [Anonymous]
2011|One health, one flu? Capua, I.; Cattoli, G.
2008|One-health wonders Cima, Greg
2012|Thinking beyond one health [Anonymous]
2009|One-health wonders Nolen, R. Scott; Monath, Thomas P.
2015|'ONE HEALTH'-CONGRESS [Anonymous]
2009|'ONE HEALTH' and parasitology Kaplan, Bruce; Kahn, Laura H.; Monath, Thomas P.; Woodall, Jack
2008|One-health wonders Nolen, R. Scott
2015|Video celebrates One Health [Anonymous]
2010|WSAVA embraces 'one health' [Anonymous]
2016|ONE HEALTH IN BRABANT [Anonymous]
2014|One Health, One Art [Anonymous]
2008|One-health wonders Nolen, R. Scott; Kahn, Laura H.
2008|One health wonders Burns, Katie
2017|One Health travel fellowships [Anonymous]
2016|One Health day [Anonymous]
2009|One-health wonders Nolen, R. Scott; Ksiazek, Thomas G.
2014|Developing One Health [Anonymous]
2017|Emphasizing one health Kelly, Alan M.; Galligan, David; Salman, Mo D.; Osburn, Bennie; Marshak, Robert
2009|One-health wonders Kahler, Susan C.; Kaplan, Bruce
2009|One-health wonders Cima, Greg
2008|One-health wonders Osborne, Malinda; Franz, David
2008|One-health wonders Nolen, R. Scott; Steele, James H.
2012|Resistance and one health [Anonymous]
2013|Support for One Health [Anonymous]
2009|One-health wonders Osborne, Malinda
2017|Progress report - One Health Waters, Adele
2013|Collaborating on one health Reeve-Johnson, Lloyd
2017|Emphasizing one health Reply Nielsen, N. Ole; Eyre, Peter
2008|One-health Web site debuts [Anonymous]
2012|MSc One Health Analytical Epidemiology Simuunza, M.C.
2012|One Health - 'joining the dots' Dockrell, Hazel M
2009|'One health' for mountain gorillas [Anonymous]
2011|A win for One Health Bolton, Jennifer
2014|Getting together on One Health [Anonymous]
2012|Pets, vets and one health [Anonymous]
2016|One Health: exploring One Health and expanded circumpolar collaborations Parkinson, Alan
2018|Ecological roles in one health Bryan, Sara; Deem, Sharon L.; Palmer, Jamie
2016|One Health challenges in Greenland Brandt, Asbjorn
2007|AMA adopts one-health policy Nolen, R. Scott
2016|The Alaska One Health Group Brubaker, Mike
2017|One-Health: condemnation or collaboration? Burkgren, Tom
2011|Sharing knowledge on 'one health' [Anonymous]
2012|First International One Health congress Jeggo, Martyn H.
2015|One Health and a world of opportunity Reeve-Johnson, Lloyd
2014|Wildlife - an integral part of One Health [Anonymous]
2012|One Health and its importance to wildlife [Anonymous]
1984|NIGHT WORKLOAD IN ONE HEALTH DISTRICT ARCHER, DPM
2012|The KNMvD - One Health and more! Hellebrekers, Ludo J.
2017|Toxocariasis in Africa: A One Health perspective Hartnack, Sonja; Alobo, Grace; Kankya, Clovice
2017|2016 One Health and Ecohealth Congress Sodhi, Nidhi
2016|One Health in the real world [Anonymous]
2016|International EcoHealth One Health Congress 2016. [Anonymous]
2017|One Health pioneer Lord Soulsby dies [Anonymous]
2017|One Health approach to controlling disease. Richards, Iain
2008|Board further commits to one health initiative [Anonymous]
1984|NIGHT WORKLOAD IN ONE HEALTH DISTRICT BUDD, JD; GREIG, DNH
2009|New commission to promote 'one health' [Anonymous]
2011|Kudos on One Health Commission move McCulloch, William F.
2016|Nov 3 is One Health Day Osterhaus, Ab
2009|Vets and One World One Health Vallis, Rhyll
1984|NIGHT WORKLOAD IN ONE HEALTH DISTRICT HESTER, NWS
2016|Nov 3 is One Health Day [Anonymous]
2014|One Health: WSAVA plans its next step [Anonymous]
2012|MSc In One Health Molecular Biology Wambura, P.
2017|Advancing one health in our communities Meyer, Thomas F.
2012|Convergence of Ecohealth and One Health [Anonymous]
2007|Task force to study one-health initiative [Anonymous]
2016|Welfare and waves, One Health and Hendra Jackson, Anne
2013|One Health: a call to environmental managers Ross, Helen; Carter, R. W. (Bill)
1984|NIGHT WORKLOAD IN ONE HEALTH DISTRICT HOBDAY, PJ
2017|One Health perspective of antimicrobial resistance. Briyne, Nancy De
2016|Strong one-health foundation at Midwestern Larkin, Malinda
2006|One world, one health, one medicine Rezendes, Allison
2010|Investigating the history of 'one health' [Anonymous]
2015|'One Health is voor dierenarts heel gewoon' Swormink, Berrie Klein
2011|Edinburgh to launch 'One health' MSc [Anonymous]
2007|First step in the one-health initiative Kahler, Susan C.
2008|Board further commits to one health initiative [Anonymous]
2016|AVMA, pediatrics academy collaborate toward one health [Anonymous]
2016|The 'One Health' journal: Filling a niche. Osterhaus, Ab; MacKenzie, John
2017|The need for European OneHealth/EcoHealth networks Keune, Hans; Flandroy, Lucette; Thys, Severine; De Regge, Nick; Mori, Marcella; Antoine-Moussiaux, Nicolas; Vanhove, Maarten P. M.; Rebolledo, Javiera; Van Gucht, Steven; Deblauwe, Isra; Hiemstra, Wim; Hasler, Barbara; Binot, Aurelie; Savic, Sara; Ruegg, Simon R.; De Vries, Sjerp; Garnier, Julie; van den Berg, Thierry
2015|The Network for Evaluation of One Health: evidence-based added value of One Health. Haxton, Eva; Sinigoj, Spela; Riviere-Cinnamond, Ana
2015|One Health: The Theory and Practice of Integrated Health Approaches 
2015|'One Health' on practice level requires change in mentality Haneveld, Johan Klein
1953|One health department fights polio. SAWYER, L; GUIDRY, L
2016|MINISTER SCHIPPERS OPENS NETHERLAND'S CENTRE FOR ONE HEALTH [Anonymous]
2017|ONE HEALTH APPROACH TO COST-EFFECTIVE RABIES CONTROL IN INDIA Fitzpatrick, Meagan C.; Shah, Hiral A.; Bilinski, Alyssa M.; Kakkar, Manish; Clark, Andrew D.; Townsend, Jeffrey P.; Abbas, Syed S.; Galvani, Alison P.
2016|Ketamine: a 'One Health' issue for us all White, K.
2014|Introducing 'One Health' as an overlooked concept in Iran. Sharifi, Hamid; Karamouzian, Mohammad
2018|One health and a new Canadian vet school? Gyles, Carlton
2017|Referral practice and children's hospital form One Health partnership [Anonymous]
2012|One health high on the agenda at world congress [Anonymous]
2010|Humans, Animals-It's One Health. Or Is It? [Anonymous]
2009|Rockefeller Foundation funding creation of One Health Commission [Anonymous]
2016|Welcome to the EcoHealth One Health Congress 2016 Jeggo, Martyn H.; Mackenzie, John S.
2016|Antimicrobial resistance: UN endorses a One Health approach [Anonymous]
2015|Veterinary and medical associations mark a One Health milestone [Anonymous]
2012|'One health, one medicine' and critical public health Green, Judith
2014|ONE HEALTH Ebola and One Health Moore, Peter
2018|One health and preventing disease associated with animals Response Daly, Russell F.; House, Jennifer; Mathewson, Abigail; Pride, Kerry; Stanek, Danielle; Stobierski, Mary Grace
2017|One health and a new Canadian vet school? Gyles, Carlton
2008|Grant aids Cummings' one-health efforts in Indonesia [Anonymous]
2017|One Health and the Politics of Antimicrobial Resistance Patel, Jean B.
1999|Good nutrition just one health obstacle for the institutionalized elderly Jackobs, MK
2017|Collaborating on One Health and veterinary public health education 
2013|Collaborating on One Health. Reeve-Johnson, Lloyd
2017|Marking the life of a One Health champion [Anonymous]
2016|One Health and the International Fund for Agriculture Development. Seifman, Richard; Katz, Rebecca
2016|One Health in the Canadian North - priorities, perceptions, and programs Jenkins, Emily; Schurer, Janna; Simon, Audrey; Bachand, Nicholas; Stephen, Craig
2017|Marking the life of a One Health champion. [Anonymous]
2015|Vets and doctors pledge to cooperate on One Health [Anonymous]
2014|Buy-in needed for one health concept to work Wittnich, Carin; Belanger, Michael
2008|Grant aids Cummings' one-health efforts in Indonesia [Anonymous]
2017|One Health Commission, EPA launch pet health survey [Anonymous]
2015|"One Health"-Symposium in Honor of Prof. Dieter Grossklaus [Anonymous]
2017|Incorporation of "One Health" Into Obstetrics and Gynecology Jasani, Sona; Fuchs, Ashley; Jasani, Sona; Bergmann, Jonathan; Spencer, Brint; Bachmann, Gloria
2016|Inaugural 'One Health Day' organised on 3 November 2016 
2013|One Health: The Human-Animal-Environment Interfaces in Emerging Infectious Diseases: The Concept and Examples of a One Health Approach 
2017|Perspective: The One Health Concept - the Aztec empire and beyond. Puente, Jose Luis; Calva, Edmundo
2014|ONE HEALTH Encouraging owners to walk their dogs [Anonymous]
2015|Spirometry Utilization in COPD; One Health System's Experience Pichurko, Bohdan; McCarthy, Kevin
2017|Applications open for One Health travelling fellowship awards Molyneux, Jacqui
2017|EC consults on One Health actions to tackle antimicrobial resistance [Anonymous]
2016|Antimicrobial resistance: UN endorses a One Health approach [Anonymous]
2013|Control of neglected zoonoses using a one health approach Johansen, M. V.; Magnussen, P.; Mejer, H.; Braae, U.; Trevisan, C.; Saarnak, C.
2016|Mission Rabies founder to receive WSAVA's One Health Award [Anonymous]
2015|'One Health'- approach to quickly respond to new zoonoses Haneveld, Johan Klein
2014|Professional separation and the re-emergence of One Health [Anonymous]
2010|One Health Summit and study setting stage for policies, initiatives [Anonymous]
2015|One Health approach to exploring what drives zoonoses [Anonymous]
2016|Raising awareness of the need for One Health interactions [Anonymous]
2017|One Health: Earning our seat on the lifeboat! Charbonneau, George
2017|Applications open for One Health travelling fellowship awards. Molyneux, Jacqui
2010|World Veterinary Day to center on 'One World, One Health' [Anonymous]
2018|Why the antibiotic resistance crisis requires a One Health approach Van Puyvelde, Sandra; Deborggraeve, Stijn; Jacobs, Jan
2018|One health and preventing disease associated with animals Kaplan, Bruce
2015|A Review of Patient Mortality in One Health Board Williams, A.; Cox, R.; Woodward, A.
2012|Towards one Africa, one health: The Southern African Centre for Infectious Disease Surveillance One Health focus on infectious diseases Rweyemamu, Mark M.; Paweska, Janusz; Kambarage, Dominic; Namuba, Filomena
2009|The brewing storm Kaplan, Bruce; Kahn, Laura H.; Monath, Thomas P.
2017|Posthumanist critique and human health: how nonhumans (could) figure in public health research Friese, Carrie; Nuyts, Nathalie
2011|1st International One Health Congress Mackenzie, John S.; Jeggo, Martyn H.
2013|Brucellosis: recent developments towards 'One Health' Plumb, Glenn E.
2008|One health initiative Pappaioanou, Marguerite; Spencer, Harrison
1987|ONE HEALTH-PROFESSIONALS EXPERIENCE WITH SELF-HELP ROUSE, SD
2017|The One Health path to infectious disease prevention and resilience Heymann, David L.; Jay, Jonathan; Kock, Richard
2016|DirecTalk: Musings From the 10th Floor: One Health Dyjack, David
2017|One Health approach to tackle antimicrobial resistance in South East Asia. [Anonymous]
2013|One Health: The Human-Animal-Environment Interfaces in Emerging Infectious Diseases: Food Safety and Security, and International and National Plans for Implementation of One Health Activities 
2014|Epidemiology of Coxiella burnetii Infection in Africa: A OneHealth Systematic Review Crump, John A; Reddy, Elizabeth A; Cleaveland, Sarah; Rubach, Matthew P; Vanderburg, Sky; Halliday, Jo EB
2016|Antibiotic resistance is the quintessential One Health issue Robinson, T. P.; Bu, D. P.; Carrique-Mas, J.; Fevre, E. M.; Gilbert, M.; Grace, D.; Hay, S. I.; Jiwakanon, J.; Kakkar, M.; Kariuki, S.; Laxminarayan, R.; Lubroth, J.; Magnusson, U.; Ngoc, P. Thi; Van Boeckel, T. P.; Woolhouse, M. E. J.
2009|European event advocates one health, prevention Continent celebrates first veterinary week [Anonymous]
2013|One Health: The Human-Animal-Environment Interfaces in Emerging Infectious Diseases Food Safety and Security, and International and National Plans for Implementation of One Health Activities Preface 
2014|One Health Preface Vallat, Bernard
2009|[ "One medicine - one health" and the veterinary medicine in Switzerland]. Zinsstag, Jakob; Schelling, Esther; Tanner, Marcel
2014|Grand challenges in cellular biochemistry: the "next-gen" biochemistry Giulivi, Cecilia
2013|One Health: The Human-Animal-Environment Interfaces in Emerging Infectious Diseases The Concept and Examples of a One Health Approach Preface 
2017|One Health and the expansion of veterinary education and practice in Canada. Nielsen, N Ole
2017|Erratum to: The One Health path to infectious disease prevention and resilience. [Anonymous]
2017|COMMENT ON: ZIKA IN SINGAPORE: INSIGHTS FROM ONE HEALTH AND SOCIAL MEDICINE REPLY Lysaght, Tamra; Lederman, Zohar; Tambyah, Paul Anantharajah
2015|Advancing integrative "one-health" approaches to global health through multidisciplinary, faculty-led global health field courses Olsen, C.; Conway, J.; DiPrete-Brown, L.; Hutchins, F.; Poulsen, K.; Solheim, K.; Kraus, C.; Gaus, D.; Silawan, T.
2015|One Health The Theory and Practice of Integrated Health Approaches OIE Foreword Vallat, Bernard
2017|One Health strategies for rabies control in rural areas of China Tan, Jimin; Wang, Ruyi; Ji, Senlin; Su, Shuo; Zhou, Jiyong
2017|IDENTIFYING CHALLENGES AND OPPORTUNITIES FOR ONE HEALTH SYSTEMS STRENGTHENING IN GUINEA Standley, Claire J.; Carlin, Ellen; Sorrell, Erin M.; Barry, Alpha M.; Diakite, Aboubacar S.; Koivogui, Lamine; Keita, Mamady S.; Mane, Seny; Martel, Lise; Katz, Rebecca L.
2016|The 2nd World Veterinary Association-World Medical Association Global Conference on One Health. 
2013|One health approach for control of neglected parasitic zoonoses - an African perspective Mukaratirwa, S.
1998|One health, one earth, one sun - Nietzsche's respect for natural science Leiter, B
2017|Transmission of ESBL-producing Escherichia coli between humans and poultry - A one-health study from Ghana Eibach, D.; Imirzalioglu, C.; Hogan, B.; Krumkamp, R.; Falgenhauer, L.; Danquah, C.; Poppert, S.; Sarpong, N.; Owusu-Dabo, E.; May, J.
2017|One Health to enhance the health status of nomadic pastoralists and their livestock Villanucci, A.; Fascendini, M.; Cristofori, E. I.; Demarchi, A.; Pecchioni, V.; Salza, A.
2017|Conference charts one-health approach to addressing obesity in pets, people Burns, Katie
2012|Convergence of EcoHealth and One Health. Zinsstag, Jakob
2015|One Health and dentistry. Williams, Larry
2018|One Health and the expansion of veterinary education and practice in Canada Nielsen, N. Ole
2017|West Nile surveillance and response in Italy: a one health approach Parodi, P.; Rizzo, C.; Albonico, M.; Calzolari, M.; Chiari, M.; Capelli, G.; Casalone, C.; Angelini, P.; Monaco, F.; Maraglino, F.
2014|Three Sides of the Same Coin: Aquatic Animals-One Health-Ecosystem Health Faisal, Mohamed
2012|One Medicine, One Health: Human and Veterinary Medicine Pharmacovigilance Node in the University Network in Uruguay Dib, A. R.; Romero, M. R.
2008|ONE HEALTH INITIATIVE: AVMA, AMA (Reprinted from Equine Health Report, Fall/Winter, 2007) [Anonymous]
2017|Mapping One health curriculum for better disease prevention and control: what and why Jiang, L.; Qui, Q. H. Nguyen; Simpson, G.; Quesada, F.; Artama, W. T.; Joseph, J.; Thys, S.
2017|Clinical photography using a mobile smartphone application: The dermatology experience at one health care enterprise Wyatt, Kirk; Willaert, Brian; Pallagi, Peter; Uribe, Richard; Yiannias, James; Hellmich, Thomas
2012|Towards One Health Knowledge Networks: A Southern African Centre of Infectious Disease Surveillance case study Beda, Eric
2018|A roadmap for zoonotic tuberculosis: a One Health approach to ending tuberculosis Dean, Anna S.; Forcella, Simona; Olea-Popelka, Francisco; El Idrissi, Ahmed; Glaziou, Philippe; Benyahia, Amina; Mumford, Elizabeth; Erlacher-Vindel, Elisabeth; Gifford, Glen; Lubroth, Juan; Raviglione, Mario; Fujiwara, Paula
2017|Rabies-what is necessary to achieve 'zero by 30'? Durrheim, David N; Blumberg, Lucille
2015|Indigenous One Health in the Arctic, a Systematic Literature Review of Circumpolar Zoonoses. Nelson, C. M.; Romain, S. J.; Davis, M. F.
2015|Tuberculosis and One Health - What is in a Name? Sternberg Lewerin, Susanna
2018|Responses to emerging and re-emerging infectious diseases: One world, One health Xu, Jianqing; Xu, Jianguo
2017|Antibiotic Resistance: the Role of Patients in the One Health Approach [Anonymous]
2015|Bowel Screening Wales - Analysis of the First Four Years in one Health Board Williams, A.; Cox, R.; Woodward, A.
2014|Acknowledgments and the Way Forward: The Social Dimensions of One Health Williams, James Herbert
2012|Cardiovascular health and stroke strategic clinical network: a "one-health system" innovation for improved patient care O'Neill, B. J.; Riches, P.; Joyce, A.
1996|Variations in the management of acute myocardial infarction in one health region. Khandekar, S; Murphy, JJ
1985|RAISE YOUR FOOT FOR A HEALTHY BACK - HOW ONTARIO-HYDRO TACKLES A NUMBER ONE HEALTH PROBLEM TURNBULL, A
2015|Successful VSF-Suisse-Conference: The One-Health-Concept with the Example of Ebola Bolomey, Daniel
2014|THE ISLE OF WIGHT SUICIDE STUDY: A CASE STUDY OF 68 SUICIDES IN ONE HEALTH DISTRICT Shahpesandy, H.; van Heeswijck, A. Ad; Oakes, M.
2011|One health for 7 billion [Anonymous]
2008|Guideline will help to verify comparability of patient results within one health care system Lehman, Christopher M.; Bennett, Sterling T.
1955|How one health department helps the handicapped. GRANT, M
2016|Operationalizing One Health in the Arctic: towards a regional operational norm Glasser, Joshua
2015|One Health The Theory and Practice of Integrated Health Approaches WHO Foreword Abela-Ridder, Bernadette
2015|HOW BIOSECURITY REFRAMES ANIMAL SURVEILLANCE Fortane, Nicolas; Keck, Frederic
2008|Draws attention to early one-health wonder Haas, Kenneth B.
2017|What do pets in New Mexico have to do with one health? Topper, Michael J.
2012|One Health: Towards safeguarding the health, food security and economic welfare of communities Nabarro, David
2018|Emergence of azole resistant Aspergillus fumigatus and One Health: time to implement environmental stewardship. Chowdhary, Anuradha; Meis, Jacques F
2017|Experience of a Peruvian University using the "One Health (UnaSalud)" concept Ormea, V. C.; Mejia, F. A.; Gotuzzo, E.
2013|WSAVA's one health committee looks forward to its next phase [Anonymous]
2009|European event advocates one health, prevention Continent celebrates first veterinary week [Anonymous]
2015|[Minutes of international symposium for One Health research in China]. Huang, Jiawei; Zhang, Yingtao; Lu, Jiahai
2015|One Health The Theory and Practice of Integrated Health Approaches Editors' Preface Zinsstag, Jakob; Schelling, Esther; Waltner-Toews, David; Whittaker, Maxine; Tanner, Marcel
2014|ONE HEALTH Veterinary and medical students challenged to raise awareness of rabies [Anonymous]
2014|Developing One Health Mahr, Roger K.
2000|Nursing: the number one health resource. Oulton, J A
2016|WVA sets out its position on antimicrobial use and One Health [Anonymous]
2013|A 'one health' approach to ethics Morris, Arianwen
2007|Strategies from Salzburg - Urgency of actualizing one-health concepts emphasized at global conference Kahler, Susan C.
1976|Lifelong education: one health-care institution's approach. Linton, C B
2017|ONE HEALTH WORLDWIDE: EMERGING INFECTIOUS DISEASES, GLOBAL HEALTH VETERINARIANS, AND ZOONOTIC SURVEILLANCE Holder, Kali; Tunseth, Devin; Vodzak, Megan; Norton, Benjamin; Murray, Suzan
2017|One Health approach to tackle antimicrobial resistance in South East Asia Singh, Poonam
2010|One World, One Health - What's in it for animal agriculture? Snelson, Harry
2016|The implementation of the One health concept is it a reality in Africa ? Vroh, Joseph Benie Bi; Seck, Ibrahima
2017|A one health approach to Taenia Solium control in subSaharan Africa Johansen, M. V.; Braae, U. C.; Trevisan, C.; Lekule, F.; Magnussen, P.; Ngowi, H.
2016|EMS Routing for Endovascular Patients-One Health Care Systems Successful Model Martin, Coleman O.; Hawkins, Angela M.; Olds, Karin; Akhtar, Naveed; Holloway, William; King, Shelleen; McClintick, Jay
2014|[Adopting and implementing a One Health approach for solving complex health problems]. Xiao, Zheng; Lu, Jiahai; White, Sarah K; Tara, Sabo-Attwood; Gray, Gregory C
2015|Senators, academics, others embrace one-health approach Burns, Katie
2015|Livestock seromonitoring and human brucellosis in central Mongolia: applying the one health approach Ariunaa, S.; Oyunaa, L.; Schelling, E.; Amarsanaa, L.
2015|Success of VSF-Suisse conference: the One Health concept using the example of Ebola Bolomey, Daniel
2014|One Health: collaboration on all levels is key, concludes joint meeting [Anonymous]
2012|Thinking beyond one health. [Anonymous]
2017|The One Health path to infectious disease prevention and resilience (vol 111, pg 233, 2017) Heymann, David L.; Jay, Jonathan; Kock, Richard
2015|One Health The Theory and Practice of Integrated Health Approaches FAO Foreword Lubroth, Juan
2016|A One Health overview, facilitating advances in comparative medicine and translational research. Stroud, Cheryl; Dmitriev, Igor; Kashentseva, Elena; Bryan, Jeffrey N; Curiel, David T; Rindt, Hans; Reinero, Carol; Henry, Carolyn J; Bergman, Philip J; Mason, Nicola J; Gnanandarajah, Josephine S; Engiles, Julie B; Gray, Falon; Laughlin, Danielle; Gaurnier-Hausser, Anita; Wallecha, Anu; Huebner, Margie; Paterson, Yvonne; O'Connor, Daniel; Treml, Laura S; Stannard, James P; Cook, James L; Jacobs, Marc; Wyckoff, Gerald J; Likins, Lee; Sabbagh, Ubadah; Skaff, Andrew; Guloy, Amado S; Hays, Harlen D; LeBlanc, Amy K; Coates, Joan R; Katz, Martin L; Lyons, Leslie A; Johnson, Gayle C; Johnson, Gary S; O'Brien, Dennis P; Duan, Dongsheng; Calvet, James P; Gandolfi, Barbara; Baron, David A; Weiss, Mark L; Webster, Debra A; Karanu, Francis N; Robb, Edward J; Harman, Robert J
2009|One Health continuing medical education: an avenue for advancing interdisciplinary communication on One Health issues Gates, Maureen Carolyn
2009|Great 21st century physician 'One Health' leader dies Ronald M. Davis Davis, Ronald M.
2016|The 4th International One Health Congress and 6th Biennial Congress of the International Association for Ecology and Health 2016 [Anonymous]
2015|Vets and doctors pledge to cooperate on One Health. [Anonymous]
2011|One Health: much more than a slogan. Hall, Robert; Durrheim, David N
2016|The contribution of biomedical informatics to one health Steward, Duane A.; Krecek, Rosina C.; Chaddock, Harry M.; Green, Julie M.; Conti, Lisa A.
2017|Editorial: Biological Engagement Programs: Reducing Threats and Strengthening Global Health Security Through Scientific Collaboration Fair, Jeanne M.
2011|Incorporating the one-health concept into undergraduate education Farone, Tracy S.
2015|Public policies, one health, and veterinary medicine Kelly, Alan M.; Marshak, Robert; Galligan, David; Ferguson, James
2015|Epidemiology of Leptospirosis in Africa: a systematic review of a neglected zoonosis and a paradigm for One Health in Africa Allan, Kathryn J; Biggs, Holly M; Halliday, Jo EB; Kazwala, Rudovick R; Maro, Venance P; Cleaveland, Sarah; Crump, John A
1994|Selecting one health care reform plan is not an easy choice. Avery, L H
2014|Integrative Health Thinking and the One Health Concept: Is Social Work All for 'One' or 'One' for All? Hanrahan, Cassandra
2012|Educating undergraduates on one health Kahn, Laura H.
2011|One Health: the 21st century challenge Welburn, Sue
2017|Editorial: Towards Elimination of Dog Mediated Human Rabies. Durr, Salome; Fahrion, Anna S; Knopf, Lea; Taylor, Louise H
2014|Translating one health into practice Buttke, Danielle E.; Castle, Kevin; Wild, Margaret; Wong, David; Higgins, Charles; Hilaire, Larry; Sorhage, Faye; Cherry, Bryan
2015|It is time to implement One Health approach to address health complex challenges! Nzietchueng, Serge
2017|Animal assisted intervention (AAI) for children in either research, practice or policy from a One Health perspective Pirrone, Federica
2014|Defining the Future of One Health. Jeggo, Martyn; Mackenzie, John S
2017|You and your FFF (furry fat friend): a One Health approach to obesity Sodhi, Nidhi
2009|One-health wonders by. Interview Susan C. Kahler. Kaplan, Bruce
2007|Delta Society identifies with one-health concept McCulloch, William E.; Norvell, Lawrence J.
2017|A One Health team to improve Monkeypox virus outbreak response: an example from the Democratic Republic of the Congo Laudisoit, A.; Verheyen, E.; Baelo, P.; Akonda, I.; Nebesse, C.; Ngoy, S.; Gembu, G.; Tepage, F.; Muyembe, J. J.; Alworonga, O.; Mande, D.; Angotolwa, Z.; Leirs, H.; Ngbonda, D.; Colebunders, R.
2015|Sustainability and One Health Capper, Judith L.
2009|One world - one health Karesh, William B.; Cook, Robert A.
2016|The 4th International One Health Congress and 6th Biennial Congress of the International Association for Ecology and Health 2016. [Anonymous]
2013|One Health = one great issue! Kahn, Laura H
2015|Specialty Grand Challenge in Veterinary Surgery and Anesthesiology. Byron, Christopher R
2015|Blood on the Ice: the Need for Culturally Inclusive One Health Surveillance of Anthropozoonoses in the Arctic. Romain, S. J.; Nelson, C. M.; Davis, M. F.
2012|Toxicology and "one health": opportunities for multidisciplinary collaborations. Rumbeiha, Wilson K
2015|The One Health approach for the management of an imported case of rabies in mainland Spain in 2013 Perez de Diego, A. C.; Vigo, M.; Monsalve, J.; Escudero, A.
2014|Buy-in needed for one health concept to work. Wittnich, Karin; Belanger, Michael
2015|Summary and Outlook for Practical Use of One Health Zinsstag, Jakob; Tanner, Marcel
2015|Ectoparasitic diseases: A good example of the concept "one world one health'' Chosidow, O.
