2016|Midwives as drivers of reproductive health commodity security in Kaduna State, Nigeria Alayande, Audu; Mamman-Daura, Fatima; Adedeji, Olanike; Muhammad, Ado Zakari
2012|Targeted Support and Telecare in Staffed Housing for People with Intellectual Disabilities: Impact on Staffing Levels and Objective Lifestyle Indicators Perry, Jonathan; Firth, Caroline; Puppa, Michael; Wilson, Rick; Felce, David
2009|Strategies for sustainability and equity of prepayment health schemes in Uganda. Kyomugisha, E L; Buregyeya, E; Ekirapa, E; Mugisha, J F; Bazeyo, W
2009|Leveraging human capital to reduce maternal mortality in India: enhanced public health system or public-private partnership? Krupp, Karl; Madhivanan, Purnima
2008|"The Red Man and the White Plague": Rethinking race, tuberculosis, and American Indians, ca. 1890-1950 McMillen, Christian W.
2004|Reviewing emergency care systems I: insights from system dynamics modelling Lattimer, V; Brailsford, S; Turnbull, J; Tarnaras, P; Smith, H; George, S; Gerard, K; Maslin-Protero, S
2003|Information system concepts for quality measurement James, B
1999|Action research: a useful method of promoting change in primary care? Hampshire, A; Blair, M; Crown, N; Avery, A; Williams, I
1997|Nurses use of health status data to plan for patient care: Implications for the development of a computer-based outcomes infrastructure Lush, MT; Henry, SB
2016|Secular trends and evaluation of complex interventions: the rising tide phenomenon Chen, Yen-Fu; Hemming, Karla; Stevens, Andrew J.; Lilford, Richard J.
2016|Agreement Between HEDIS Performance Assessments in the VA and Medicare Advantage: Is Quality in the Eye of the Beholder? Trivedi, Amal N; Wilson, Ira B; Charlton, Mary E; Kizer, Kenneth W
2014|High Reinfection Rate after Preventive Chemotherapy for Fishborne Zoonotic Trematodes in Vietnam Lier, Tore; Johansen, Maria Vang; Dalsgaard, Anders; Do, Dung Trung; Nguyen, Thi Hop; Asfeldt, Anne Mette
2014|Risk factors for visual impairment and blindness amongst black adult diabetics receiving treatment at Government healthcare facilities in Mopani District, Limpopo province, South Africa. Mabaso, Raymond G; Oduntan, Olalekan A
2012|Analysing 'cultural safety' in mental health policy reform: lessons from British Columbia, Canada Josewski, Viviane
2001|Resourcefulness and health practices of diabetic women Zauszniewski, JA; Chung, CW
1999|The strategy for prevention and intervention of developmental problems in early adulthood by the developmental risk screening Hanaoka, Mayuki
2016|Motivation in caring labor: Implications for the well-being and employment outcomes of nurses Dill, Janette; Erickson, Rebecca J.; Diefendorff, James M.
2014|mHealth Tools for the Pediatric Patient-Centered Medical Home Slaper, Michael R.; Conkol, Kimberly
2013|What are the barriers faced by patients using insulin? A qualitative study of Malaysian health care professionals' views Lee, Yew Kong; Ng, Chirk Jenn; Lee, Ping Yein; Khoo, Ee Ming; Abdullah, Khatijah Lim; Low, Wah Yun; Samad, Azah Abdul; Chen, Wei Seng
2012|Attitudes of Health Care Professionals to Opioid Prescribing in End-of-Life Care: A Qualitative Focus Group Study Gardiner, Clare; Gott, Merryn; Ingleton, Christine; Hughes, Philippa; Winslow, Michelle; Bennett, Michael I.
2009|Breaking the Silence: Exploring the Potential Effects of Explicit Instructions on Incorporating Income and Leisure in TTO Exercises Krol, Marieke; Sendi, Pedram; Brouwer, Werner
2005|Use of cervical cancer screening among insured women: the extent of missed opportunities Chattopadhyay, SK; Ebrahim, SH; Tao, GY; McKenna, MT
2003|Older men's experiences of living with severe visual impairment Moore, LW; Miller, M
1994|METALLOTHIONEIN IN CARCINOGENESIS AND CANCER-CHEMOTHERAPY EBADI, M; IVERSEN, PL
2017|Risk factors for patient-reported errors during cancer follow-up: Results from a national survey in Denmark Christiansen, Anne Hjollund; Lipczak, Henriette; Knudsen, Janne Lehmann; Kejs, Anne Mette Tranberg
2015|Cost analysis of one of the first outpatient wound clinics in the Netherlands Rondas, A. A. L. M.; Schols, J. M. G.; Halfens, R. J. G.; Hull, H. R.; Stobberingh, E. E.; Evers, S. M. A. A.
2015|Predictors of patients' satisfaction with health care services in three balkan countries (macedonia, bulgaria and serbia): a cross country survey. Lazarevik, Vladimir; Kasapinov, Blasko
2014|An Anthropological Approach to Teaching Health Sciences Students Cultural Competency in a Field School Program Hutchins, Frank T.; Brown, Lori DiPrete; Poulsen, Keith P.
2013|Factors Impacting the Control of Rabies. Nel, Louis H
2013|Managing between the agendas: implementing health care reform policy in an acute care hospital. Sorensen, Roslyn; Paull, Glenn; Magann, Linda; Davis, JanMaree
2012|Process Indicators of Quality Clinical Pharmacy Services During Transitions of Care Kirwin, Jennifer; Canales, Ann E.; Bentley, Michael L.; Bungay, Kathy; Chan, Tammy; Dobson, Erica; Holder, Renee M.; Johnson, Daniel; Lilliston, Andrea; Mohammad, Rima A.; Spinler, Sarah A.
2012|Health-Related Behaviors: A Study Among Former Young Caregivers Shifren, Kim; Chong, Alexandra
2012|[On general practitioners' care of patients with asthma]. Von Voshaar, T; Behr, J; Bruggenjurgen, B; Deimling, A; Kruger, M; Virchow, C; Wiens, C
2009|Integrating the issues of world animal health and world public health into the veterinary curriculum: a Southeast Asian perspective Zamri-Saad, M.; Romziah, S.; Kunavongkrit, A.; Valdez, C. A.; Thien, M.
2003|Anemia in pregnancy in Mali: prevalence and etiology. Ayoya, M A.; Garza, C; Stoltzfus, Rebecca J.; Spiekermann-Brouwer, G; Traore, A K.
2002|The evolution of quality management in state Medicaid agencies: a national survey of states with comprehensive managed care programs. Landon, Bruce E; Huskamp, Haiden A; Tobias, Carol; Epstein, Arnold M
1998|Emerging technologies and knowledge work: The case of Fletcher Allen Health Care's telemedicine initiative Guinan, PJ; Gogan, JL
1989|Health and development. Damiba, P C
1979|IMPORTANCE OF COEXISTING SYPHILITIC, CHLAMYDIAL, MYCOPLASMAL, AND TRICHOMONAL INFECTIONS IN THE TREATMENT OF GONORRHEA JUDSON, FN
2018|Assessing the public acceptability of proposed policy interventions to reduce the misuse of antibiotics in Australia: A report on two community juries Degeling, Chris; Johnson, Jane; Iredell, Jon; Ky-Anh Nguyen; Norris, Jacqueline M.; Turnidge, John D.; Dawson, Angus; Carter, Stacy M.; Gilbert, Gwendolyn L.
2015|Disrupted seasonal biology impacts health, food security and ecosystems Stevenson, T. J.; Visser, M. E.; Arnold, W.; Barrett, P.; Biello, S.; Dawson, A.; Denlinger, D. L.; Dominoni, D.; Ebling, F. J.; Elton, S.; Evans, N.; Ferguson, H. M.; Foster, R. G.; Hau, M.; Haydon, D. T.; Hazlerigg, D. G.; Heideman, P.; Hopcraft, J. G. C.; Jonsson, N. N.; Kronfeld-Schor, N.; Kumar, V.; Lincoln, G. A.; MacLeod, R.; Martin, S. A. M.; Martinez-Bakker, M.; Nelson, R. J.; Reed, T.; Robinson, J. E.; Rock, D.; Schwartz, W. J.; Steffan-Dewenter, I.; Tauber, E.; Thackeray, S. J.; Umstatter, C.; Yoshimura, T.; Helm, B.
2013|No asymptomatic malaria parasitaemia found among 108 young children at one health facility in Dar es Salaam, Tanzania Strom, Gro E. A.; Tellevik, Marit G.; Fataki, Maulidi; Langeland, Nina; Blomberg, Bjorn
2010|Issues and special features of research on animal health Ducrot, C.; Bed'Hom, B.; Beringue, V.; Coulon, J. -B.; Fourichon, C.; Guerin, J. -L.; Krebs, S.; Rainard, P.; Sarradin, P.; Schwartz, I.; Torny, D.; Vayssier-Taussat, M-L; Zientara, S.; Zundel, E.
2005|Smuggled tobacco, deprivation and addiction Taylor, AJ; Langdon, M; Campion, P
2017|Improving Allocation And Management Of The Health Workforce In Zambia Walsh, Fiona J.; Musonda, Mutinta; Mwila, Jere; Prust, Margaret Lippitt; Vosburg, Kathryn Bradford; Fink, Gunther; Berman, Peter; Rockers, Peter C.
2017|Chlorogenic acid from coffee beans: evaluating the evidence for a blood pressure-regulating health claim Loader, Tara B.; Taylor, Carla G.; Zahradka, Peter; Jones, Peter J. H.
2017|Using logic models to enhance the methodological quality of primary health-care interventions: guidance from an intervention to promote nutrition care by general practitioners and practice nurses Ball, Lauren; Ball, Dianne; Leveritt, Michael; Ray, Sumantra; Collins, Clare; Patterson, Elizabeth; Ambrosini, Gina; Lee, Patricia; Chaboyer, Wendy
2015|Predictors of the Existence of Congregational HIV Programs: Similarities and Differences Compared With Other Health Programs. Williams, Malcolm V; Haas, Ann; Griffin, Beth Ann; Fulton, Brad R; Kanouse, David E; Bogart, Laura M; Derose, Kathryn Pitkin
2014|Engagement in HIV Care Among HIV-Positive Men Who Have Sex with Men From 21 Cities in the United States Paz-Bailey, Gabriela; Pham, Huong; Oster, Alexandra M.; Lansky, Amy; Bingham, Trista; Wiegand, Ryan E.; DiNenno, Elizabeth; Skarbinski, Jacek; Heffelfinger, James D.
2014|Applying Spatial Analysis Tools in Public Health: An Example Using SaTScan to Detect Geographic Targets for Colorectal Cancer Screening Interventions Sherman, Recinda L.; Henry, Kevin A.; Tannenbaum, Stacey L.; Feaster, Daniel J.; Kobetz, Erin; Lee, David J.
2014|Review of Influenza A Virus in Swine Worldwide: A Call for Increased Surveillance and Research Vincent, A.; Awada, L.; Brown, I.; Chen, H.; Claes, F.; Dauphin, G.; Donis, R.; Culhane, M.; Hamilton, K.; Lewis, N.; Mumford, E.; Nguyen, T.; Parchariyanon, S.; Pasick, J.; Pavade, G.; Pereda, A.; Peiris, M.; Saito, T.; Swenson, S.; Van Reeth, K.; Webby, R.; Wong, F.; Ciacci-Zanella, J.
2013|Remote monitoring for implantable defibrillators: a nationwide survey in Italy. Luzi, Mario; De Simone, Antonio; Leoni, Loira; Amellone, Claudia; Pisano, Ennio; Favale, Stefano; Iacoviello, Massimo; Luise, Raffaele; Bongiorni, Maria Grazia; Stabile, Giuseppe; La Rocca, Vincenzo; Folino, Franco; Capucci, Alessandro; D'Onofrio, Antonio; Accardi, Francesco; Valsecchi, Sergio; Buia, Gianfranco
2012|Error disclosure: a new domain for safety culture assessment Etchegaray, Jason M.; Gallagher, Thomas H.; Bell, Sigall K.; Dunlap, Ben; Thomas, Eric J.
2011|Unmet information needs about the delivery of rheumatology health care services: A survey among patients with rheumatoid arthritis Meesters, Jorit; de Boer, Ingeborg; van den Berg, Marleen; Fiocco, Marta; Vlieland, Thea Vliet
2011|Adverse events in general surgery. a prospective analysis of 13,950 consecutive patients Rebasa, Pere; Mora, Laura; Vallverdu, Helena; Luna, Alexis; Montmany, Sandra; Romaguera, Andreu; Navarro, Salvador
2010|Equine and canine influenza: a review of current events Paul, E.; Gibbs, J.; Anderson, Tara C.
2009|A healthier future for all Australians: an overview of the final report of the National Health and Hospitals Reform Commission Bennett, Christine C.
2008|Prevalence of psychiatric disorders among Toronto hospital workers one to two years after the SARS outbreak Lancee, William J.; Maunder, Robert G.; Goldbloom, David S.
1988|SURVEILLANCE IN ULCERATIVE-COLITIS - BURDENS AND BENEFIT JONES, HW; GROGONO, J; HOARE, AM
2002|Do the elderly benefit from annual physical examination? An example from Kaohsiung City, Taiwan Chiou, CJ; Chang, HY
1995|COMPARISON OF MIDI SHERLOCK SYSTEM AND PULSED-FIELD GEL-ELECTROPHORESIS IN CHARACTERIZING STRAINS OF METHICILLIN-RESISTANT STAPHYLOCOCCUS-AUREUS FROM A RECENT HOSPITAL OUTBREAK LEONARD, RB; MAYER, J; SASSER, M; WOODS, ML; MOONEY, BR; BRINTON, BG; NEWCOMBGAYMAN, PL; CARROLL, KC
1992|DISTINCTION BETWEEN ALEUKAEMIC PRODROME OF CHILDHOOD ACUTE LYMPHOBLASTIC-LEUKEMIA AND APLASTIC-ANEMIA REID, MM; SUMMERFIELD, GP
2015|Microbial screening for quinolones residues in cow milk by bio-optical method Appicciafuoco, Brunella; Dragone, Roberto; Frazzoli, Chiara; Bolzoni, Giuseppe; Mantovani, Alberto; Ferrini, Anna Maria
|Zigbee adaptation module for use in health care system, has protocol container for storing information about data transmission protocol, matching table of IEEE 11073 standard protocol and protocol used in legacy personal health device SONG O Y; KIM H J; CHO Y J; KIM J H
|Portable household health monitoring device, has device main body provided with flat panel computer, multi-parameter signal collecting module for collecting physiological data, and management server for performing data exchange process GENG Q; LI Y; ZHANG Y; XUE B; ZHOU L; YUAN H; WU S
|Medical data acquisition device, has data collecting part solid interface arranged with shell, and data processing chip for obtaining image generating result medical data, where data processing chip connected with data collection part MA Y
|User health monitoring device, has central processor connected with and inner induction layer and outside induction layer, and induction controlled component for receiving control information and identification information ZHANG L; FENG H
|Health environmental protection air conditioner filter, has supporting layer whose middle part is formed with gauze layer and filled with honeycomb, and filter core fixed with shell, where distance of honeycomb is about in certain range WEN D
|Computer operating health care bed, has bed body whose left and right edge parts are connected with computer placing frame through supporting frame, and moving cushion provided with upper window and two symmetrical grooves HAO L
|Moxibustion warm-keeping health care chair has chair back periphery provided with cover plate that is in position in chair back is set with rear back heater at step in chair seat is fixed with pedestal through moxibustion material SUN Y
|Health belt useful for managing abdominal obesity, comprises a patch containing electrode protecting fabric, a conductive electrode, a connector connected with a low-frequency oscillator, and conductive hydrogel containing medicine RYU K
|Health knee pad, has main body equipped with permanent magnet connected with knitting machine that is knitted into composite tissue, where main body is fixed to lock edge and convex interface CHEN J; LI S; QIAO Y; SHI Y; SU S; ZHAO G
|Far infrared strong magnetic field position acupuncture point health care mask has mask main portion embedded with far infrared material sheet and permanent magnet, and position alignment face provided with several acupuncture points CHEN Y; GUO Y
|Integrated silicon glue healthcare shoe, has sole whose surface is adhered with healthcare silicon glue layer and fabric layer to form mix layer, where thickness of health care silicon glue layer and mix layer are in specific values YANG H
|Portable healthcare glasses, have glasses leg divided into front half part and rear half part that are connected together through folding structure, where front half part is fixed with hollow part that is matched with lens CHEN L; CHEN Y; REN X; ZHOU D
|Breath trainer, has inner room and inner chamber that are provided with cover, where cover is formed with hollow cylindrical structure, and side wall of inner room formed with convex structure WANG S; WANG W
|Health sanitary grill has upper side plate that is provided with multiple ash discharging grooves, and bottom plate that is provided with fan comprising air outlet guide slope ZHAO Y
|Health recuperating therapy device has treatment chair which is mounted on front end of the egg-shaped cabin main portion, and front and rear rotating wheels which are symmetrically mounted in front and rear ends of pedestal JIANG J; WANG J
|Health care seat pad has flexible magnetic strip that is fixed with adhesive base layer through embedding or covering way, and cushion layer that is detachably connected with first healthcare layer through magic tape DING J
|Health care moxibustion box, has box body whose upper part is equipped with movable cover plate and outer wall is equipped with thermometer, where thermometer is connected with temperature sensor that is fixed in inner part of box body GAO X; GAO L; WANG X; SUN C; SHI Z
|Energy-saving health-care hot curtain, has curtain main body connected with mosquito net main body, heating film formed with multiblock, and temperature controller connected with curtain main body and layer insulation film JIANG H
|Alarm method for railroad worker protection system, involves generating alarm subsequent to determining that health parameter is indicative of unacceptable health, or based on conditions relating to allocated protection zone BAINES S; MCMAH D
|Health care service planning and matching system has providing unit that provides matching system for procurement of desired health service option FIRMINGER S P; GARMS J; HYDE R A; JUNG E K Y; KARKANIAS C D; LEUTHARDT E C; LEVIEN R A; LORD R T; LORD R W; MALAMUD M A; RINALDO J D; TEGREENE C T; TOLLE K M; WOOD L L
|Shampooing bed for patients, has two brackets mounted under caudal end of bed body, shampooing basin mounted over bearer, hanger fixed between bearer and bed body, and launching hole formed on bottom of shampooing basin LIU C; XU X
|Health-related data managing method for e.g. pharmaceutical vendor, involves accepting change to health regimen data entities by adding one health regimen data entity to health regimen data entities JUNG E K Y; LEVIEN R A; LORD R W; MALAMUD M A; RINALDO J D; WOOD L L
|Infrared and magnetic pulse cure instrument has permanent magnetic system and pulse magnetic system, the former consists of several ring magnetic steels and the latter consists of several solenoids with inside iron core with pulse current ZOU J
|Hand-held hot moxibustion fumigating machine, has light control device connected with connecting wire and formed with cold light emitting hole, and device main body provided with main machine shell through connecting wire TIAN S
|Quantum type health care toothbrush has liquid storage pipe that is set with inner sealing with quantum liquid, and upper end portion of toothbrush head is set with storage liquid tube cavity ZHANG L
|Health care clothes has clothes main portion whose inner side wall is set with inner bag which is provided with opening, and is arranged with inner magnetic health care piece and infrared heating piece ZHANG Z
|Health-care massage rod, has outer tube arranged with head part whose side wall is formed with multi-air hole, outer sleeve whose side wall is formed with multi-through hole, and massage head propped against outer sleeve LU Z
|Split health diagnosis and treatment all-in-one machine, has display screen provided with wireless transmission module, where display screen and diagnosis and treatment instrument are connected with each other CHEN L; WANG W
|Health care bottle, has bottle body whose opening end is fixed on inner side of sealing ring, and plug whose wall part is fixed on elastic ring, where sealing ring is made of elastic material and upper surface of plug is fixed with handle XIE Y
|Health appliance used in e.g. rehabilitation facility, has height adjustable lower frame, top frame, pair of bearing beam, and pair of handrail beam KIMURA A
|Children T-shirts comprises front cloth that is composed of left side cloth, middle cloth and right side cloth, and joint suture is fixed with upper portion of right side cloth, and short sleeve is sewed with fixed acetate fiber cloth layer NI J
|Healthcare garment, has massager connected to power supply, and garment main body provided with inflaming retarding part, anti-UV radiation material, water-proof and moisture-permeable material and germanium element material by sewing CHEN J; QIAO Y; SU S; SUN R; WANG Y
|Ribbon embroidery healthcare pillow, has pillow body formed with lining, medicine bag formed by Chinese medicine lining and pillow body, and embroidering ribbon whose spread section passes through front and rear surfaces of pillow skin CUI C
|Full-automatic health care water supply system includes ozone generator, ozone gas-guide tube, liquid level controller, electromagnetic valve, water heater, full-automatic self-sucking pump, intermediate relay KM1 and time relay KT LIU Z
|Healthcare mouse, has mouse main body whose top part is formed with gap, massage idler wheel located in gap, multiple convex circular arc points arranged on outer surface of massage idler wheel, and top cover fixed with bracket YU Z
|Topical anesthetic and antiseptic dose dispensing device for use in surgical procedure has nozzle which is connected to container and configured to dispense pressurized content of chamber responsive to activating trigger WYCOKI M
2014|TOWARD A MODERNIZED DEFINITION OF WILDLIFE HEALTH Stephen, Craig
2007|Risk behaviors for disease transmission among petting zoo attendees McMillian, Marcy; Dunn, John R.; Keen, James E.; Brady, Karen L.; Jones, Timothy F.
2007|Quality of life and congenital heart defects: comparing parent and professional values Knowles, Rachel L.; Griebsch, Ingolf; Bull, Catherine; Brown, Jacqueline; Wren, Christopher; Dezateux, Carol
2006|CT pulmonary angiography versus ventilation-perfusion scintigraphy in pregnancy: Implications from a UK survey of doctors' knowledge of radiation exposure Groves, Ashley M.; Yates, Stuart J.; Win, Thida; Kayani, Irfan; Gallagher, Ferdia A.; Syed, Rizwan; Bomanji, Jamshed; Ell, Peter J.
1995|SOURCES OF HEALTH-CARE AND HEALTH NEEDS AMONG CHILDREN IN KINSHIP CARE FEIGELMAN, S; ZURAVIN, S; DUBOWITZ, H; HARRINGTON, D; STARR, RH; TEPPER, V
|Electronic pet cage, has cage body fixed with bracket, control box whose inner side is provided with PCB that is connected with ozone generator, where ventilation fan and radiating fan are connected with inner part of cage body ZHAO X
|Computerized method for coding medical records, involves locate at least one health condition code correlated with second diagnosis code, in multiple health condition codes for medical code model identifier CHRISTNER M
|Porous health care pillow, has pillowslip part whose upper surface is formed with concave hole that is fixed with storage box, where pillowslip part is formed with strip-shaped groove that is filled with granular Chinese herbal medicine LI H
|Health monitoring system, has intelligent processing module for obtaining health data of processing analysis treatment according to health condition, where intelligent processing module is connected to cloud platform server WANG J; ZHANG Y; ZHOU H; GAN X
|Hygienical blinder, has hanging rope connected to eye cover main body that is arranged with inner layer and outer layer, and protecting sleeve contained with sporoderm-broken lucid ganoderma spore powder YE Z
|Portable ocean water quality formaldehyde detecting machine, has storage battery fixed with shell and connected with control box that is connected with alarm control valve, where control box is fixed with data analyzer and processor LI Y; WU W; ZHANG J
|Hygienical blinder, has protective sleeve provided with opening, health care layer arranged between inner layer and outer layer that are fixed with protecting sleeve, where health care layer comprises protection sleeve and worm grass powder YE Z
|Graphite warm-keeping health care bag, has graphite heating chip connected with rope belt that is connected with fixing piece, and control circuit connected with power supply, where graphite heating chip is fixed with physical therapy part CAI H; CHEN X
|Air cushion health care shoe, has shoe main body whose upper part is formed with air cushion structure layer, and air bag formed as massaging heave structure, where height of air bag is lesser than height of massaging heave structure LUO Z; PAN H; JIN G
|Health care shoe, has vamp part provided with shoe sole, elastic layer provided with strip elastic rib, cushion layer formed with air hole, width of elastic layer in specific value, where cushion layer is provided with filter screen SHI F
|Intelligent health service robot, has voice recognition module and multimedia playing module that are connected with outer side of robot main body, and atomizing device connected with microphone and multimedia device CUI H; HUANG Y; YANG G; WU X; WENG K
|Quantum health care shoe, has decorative layer whose upper part is formed with EVA foaming linum usitatissimum fiber layer along length direction, and sealing tube formed with hole and filled with quantum liquid ZHUANG Y
|Multifunction adjustable temperature health care bed cloth, has splitting mattress arranged with quilt, bag button connected with square bag, and section connected with mattress and wind-proof bar by fastener WANG W; WANG X
|Mosquito repellent health curtain has mosquito-expelling paste element and air cleaning patch element that is detachably attached at side of hinge type blade respectively GONG C; ZHANG Z
|Multifunctional health care sponge pillow has arc convex portion that is formed in front end of recess area, and gel layer that is arranged in surface of recess area to form concave-convex granule WU S
|Health care clothes, have clothes body formed with interlayer and connected with waist part, where waist part is connected with sewing thread, and inflation tube formed with interlayer and connected with clothes body GUAN H; XU Q; XU Z
|Remote controller for health checking system, has transmitter transmitting human body information data to intelligent TV, where human body information data displayed in intelligent TV corresponding to medical reference LI Q; NIE L
|Ultrasonic blood vessel softening health care system, has ultrasonic generator connected with chest physical therapy cushion, and circular sheet body fixed with inner ultrasonic induction detection sensor LI Y
|Sterilizing and disinfecting function featured health-care bathing basin for use in e.g. hotel, has water temperature control device equipped with sound/and light indicator, and boiling time controller fixed on upper part of shell XIE G
